NAME,ALIAS,PATH,DESCRIPTION
TOPICS IN ROMAN ARCH: MODELING HERMOGENES,ARTH-529,/coursehistories/5991,Theatre Rehearsal and Performance provides students with deep intellectual and artistic immersion in the theatrical process through intensive research| rehearsal| and performance of a full-length stage piece. Students may enroll in this course as actors (by audition only) or as assistant directors| stage managers| dramaturgs| or designers (by permission of the instructor). Each semester| the play will be featured in the Theatre Arts Program production season; the class meeting times will vary| but will typically consist of 16-20 hours per week in the evening hours.   
Eastern Medieval Architecture,ARTH-233,/coursehistories/5762,An introduction to the principles of quantum mechanics designed for physics majors and graduate students in physics-related disciplines. The Schrodinger equation operator formalism| central field problem| angular momentum| and spin.Application to one-dimensional and central field problems.   
MDVL ISLAMIC ART & ARCH,ARTH-435,/coursehistories/6112,Introduction to the grammar of the Akkadian language with emphasis on developing skills in the cuneiform writing system and reading of selected texts.   
MUSEUM METHODS,ARTH-501,/coursehistories/2468,Spanish 134 is an intensive intermediate-level language course that covers the material presented in Spanish 130 and Spanish 140. The course emphasizes the development of the four canonical skills (reading| writing| listening and speaking) within a culturally based context. Class time will focus on communicative activities that combine grammatical concepts| relevant vocabulary| and cultural themes. Students will participate in pair| small-group and whole-class activities to practice linguistics skills in a meaningful context. Major course goals include: the acquisition of intermediate-level vocabulary| the controlled use of the past tense and major uses of the subjunctive| and the development of writing skills.   During the spring semester| Spanish 134 is limited to those students who have satisfied the language requirement in another language. During the summer| the course is open to all students who meet placement requirements.   
TOPOG & MON OF ANC ROME,CLST-328,/coursehistories/3020,In this course you will explore ways to provide women with practical| 'real world' skills--political and community organizing| communications| fundraising| advocacy and media experience--that will enable them to achieve meaningful political| economic| and civic participation in the life of their countries. Students may also be involved with an international trip with Women's Campaign International. The course is designed to give the theoretical background and tools to put together an insightful international training to politically empower women.   
Petrography of Cultural Materials,CLST-512,/coursehistories/5778,This course is intended to introduce students to the national institutions and political processes of American government. What are the historical and philosophical foundations of the American Republic? How does American public policy get made| who makes it| and who benefits? Is a constitutional fabric woven in 1787 good enough for today? How| if at all| should American government be changed| and why? What is politics and why bother to study it? If these sorts of questions interest you| then this course will be a congenial home. It is designed to explore such questions while teaching students the basics of American politics and government.   
ROME'S MEDITERR ECONOMY,ANCH-535,/coursehistories/109,A separate topic is offered in either the history of Ancient Near East| Greece or Rome.   
RITUALMEMORYPERFORMANC,ANTH-269,/coursehistories/6336,"Contemporary Politics| Policy and Journalism" is a course on the modern media and its impact on government and politics. It primarily covers the post-Watergate/post-Vietnam era of journalism| the past quarter century. We will focus each week on specific topics and areas of post-Watergate journalism as enumerated below. In weeks we do not have guest lecturers| the first half of class will concern the assigned readings and the second half of class will talk about current press coverage of national events over the prior week. In addition to assigned readings| students are required to stay informed about major national news stories and to follow coverage of them in the national media outlets. An important objective of this course is to afford students the opportunity to interact and discuss the intersection of the press| politics and public policy with some of the leading practitioners in the field| people who work in the "media environment" created by the national press.   
ARCHAEOBOTANY SEMINAR,ANTH-533,/coursehistories/6339,Follow-up to Comm 262| Visual Communication. The laboratory provides an opportunity for students to explore through actual media production many of the conceptual principles and research findings discussed in Comm 262 and other communication courses. Permission of instructor required for enrollment.   
ARCHAEOMETALLURGY SEMINAR,ANTH-552,/coursehistories/6343,This course explores constitutional criminal procedure or the law of the Fourth| Fifth| and Sixth Amendments to the United States Constitution. Topics included the laws and rules associated with search and seizure| arrest| interrogation| the exclusionary rule| and deprivation of counsel. Social science evidence that supports or raises questions about legal doctrine will be examined. No prerequisites are required.   
BYZANTINE ART & ARCH,ARTH-232,/coursehistories/6347,
TOPICS IN MEDIEVAL ARCH: Structural Daring and the Sublime in Pre-modern Architecture,ARTH-334,/coursehistories/6349,
TPCS IN ART OF ANDALUSIA: Cordoba: City Mosque Estates Palace City,ARTH-538,/coursehistories/6353,
ARCHAEOLOGY OF ANATOLIA,CLST-336,/coursehistories/6362,
HISTORY OF ANCIENT IRAQ,NELC-243,/coursehistories/5347,The focus of this course is on the valuation of companies. Topics discussed include discounted cash flow techniques and valuation using alternative valuation techniques such as price multiples. Emphasis is on developing the required information for valuation from financial statements and other information sources.   
TOPICS IN AEG BRONZE AGE: Minoan and Cycladic Wall Paintings in Context,ARTH-520,/coursehistories/6490,Sinusoids| complex exponentials| spectrum representation| periodic signals| Fourier spectra| sampling of continuous-time signals| aliasing and folding| impulse response of linear discrete-time systems| convolution in discrete-time systems| FIR filter structures and their effects on discrete-time signals| graphical representation of the frequency response of FIR filters| cascaded FIR filters| realization of FIR filters| z-transform| poles and zeroes| relationship between the z-domain| frequency domain| and time domain| IIR filters| system function of FIR and IIR filters| convolution and z-transform.   
Introduction to Digital Archaeology,CLST-362,/coursehistories/6499,This is the second of a two-term sequence in electrical engineering senior design. Student work will focus on completing the design undertaken in ESE 441 and successfully implementing the project. Success will be verified using experimental and/or simualtion methods appropriate to the project that test the degree to which project objectives are achieved. Each project team will prepare a poster to support a final project presentation and demonstration to peers| faculty and external judges. The course will conclude with the submission of a final project written team report. During the semester there will be periodic project reviews with individual teams.   
