NAME,ALIAS,PATH,DESCRIPTION
AEGEAN BRONZE AGE: Science in Archaeology,ARTH-525,/coursehistories/169,Topic Varies.   
ARCHAEOLOGICAL CHEMISTRY,ANTH-477,/coursehistories/1214,A comprehensive exploration of the Indian conceptions of Karma and rebirth and their roles and application in Indian history| culture| and religion.   
Survey of Mespotamian Art and Culture: 2000 B.C. to 1st Century A.D.,ARTH-422,/coursehistories/1222,This course is team-taught by four professors with specialties in Arabic| Hebrew| Persian and Turkish literatures| and is conducted jointly with Rutgers University| New Brunswick via videoconferencing. The course deals with the modern literature within each tradition and focuses on poetry| short story and the novel (novels to be studied this semester are: Al-Shaikh's The Story of Zahra| Yehoshua's The Lover| Rachlin's Foreigner| and Pamuk's The White Castle). The readings are all in English. The course is conducted in a seminar format. Students are expected to participate in classroom discussion of the materials assigned for each session| and evaluation is partially based on the quality of that participation. A short paper is assigned on the poetry and the short stories| and there is a final| longer term paper.   
PROSEM IN CLASSICAL ART,ARTH-521,/coursehistories/1224,
PROSEM IN GREEK/ROM ARCH: Architecture and Latest Scholarship,ARTH-528,/coursehistories/1225,Course topics will vary; have included The Binding of Isaac| Responses to Catastrophies in Jewish History| and Concepts of Jewishness from Biblical Israel to the Modern State (Stern); Holy Men & Women (Ben-Amos) Fall 2004: Rewriting the Bible (Dohrmann)   
INTRO GREEK ARCHAEOLOGY,CLST-275,/coursehistories/1253,An introduction to the grammar of the Aramaic language with emphasis on developing skills in reading Aramaic texts.   
SURVEY OF GREK SCULPTURE,CLST-416,/coursehistories/1254,Advanced conversation for students lacking native Chinese language proficiency.  
GIS APPLICATIONS IN ARCH,CLST-515,/coursehistories/1255,A survey of major masterpieces of landscape and figure painting on silk and on walls from the earliest vestiges of Chinese painting in the 1st millennium BCE through the 18th century. Course includes hands-on viewings of paintings in local museums. No prior knowledge of Chinese culture required.   
ARCHAEOL THEORY & METHOD,ANTH-557,/coursehistories/1660,
ANCIENT ATHLETICS,CLST-270,/coursehistories/1755,Is the world evolving toward a global civil society| and perhaps toward global government? The course explores this question across the 20th century| focusing on the origins and evolution of transnational organizations and movements. We will analyze a variety of actors above and below the level of the nation-state| from the League of Nations to Amnesty International. At the same time we will pay careful attention to the many countervailing forces that have resisted the process of globalization: various forms of nationalism| local ethnic and religious movements in places as far-flung as Central Africa and Northern Ireland| and struggles over territories and border control from Arizona to Kashmir. We will look at the long history of contention between these opposing trajectories| exploring such topics as Wilsonianism and its reception in Europe and beyond| transnational human rights norms| the environmentalist movement| institutions designed to deal with global threats such as the World Health Organization or the International Atomic Energy Agency| European integration| political Islam| and the War on Terror.   
ART OF ANCIENT IRAN,ARTH-425,/coursehistories/2232,After introducing students to the major theoretical concepts concerning law and society| significant controversial societal issues that deal with law and the legal systems both domestically and internationally will be examined. Class discussions will focus on issues involving civil liberties| the organization of courts| legislatures| the legal profession and administrative agencies. Although the focus will be on law in the United States| law and society in other countries of Africa| Asia| Europe and Latin America will be covered in a comparative context. Readings included research reports| statutes and cases.   
PROSEM IN CLASSICAL ARCH,ARTH-527,/coursehistories/2233,This course relies on a variety of sociological perspectives to examine the role of the media and popular culture in society| with a particular emphasis on the power of the entertainment industries| the relationship between cultural consumption and status| and the social organization of leisure activities from sports to shopping. Specific course topics include the globalization of branding and popular culture| the rise of aesthetics and style in everyday life| the importance of social networks in the diffusion of fads| fashions| and mass media; and the social effects of new media technologies in the digital age.   
ARCHY FLD METHDS & PROBS,ANTH-556,/coursehistories/144,Seminar analyzing process of archaeological excavation as a problem of researchdesign and method| stressing excavation as an integrated methodological system of research dealing with data retrieval| storage processing| integration and interpretation leading to final publication. Course intended for students proposing archaeological careers; it will be assumed participants have some practical excavation experience.   
AGE OF AUGUSTUS,ARTH-420,/coursehistories/2467,Spanish 110 is a first-semester elementary language course designed for students who have not previously studied Spanish. This course emphasizes the development of foundational reading| writing| listening| and speaking skills while exploring the rich cultural mosaic of the Spanish-speaking world. Students will participate in pair| small-group and whole-class activities that focus on meaningful and accurate communication skills in the target language.   Students who have previously studied Spanish must take the online placement examination.   
ART OF IRAN: Studying a Nizami Manuscript,ARTH-518,/coursehistories/2469,Spanish 140| the continuation of Spanish 130| is a fourth-semester language course that offers students the opportunity to acquire communicative skills (reading| writing| listening and speaking) while developing their awareness and appreciation of the Spanish-speaking world. Topics studied may include the environment| the arts| social relations| and conflict and violence.   
THE ANC. CITY OF ATHENS,CLST-260,/coursehistories/2765,
ETRUSCAN ART&ARCHAEOLOGY,CLST-410,/coursehistories/2767,Courses in this category will examine the value systems| political forms| and social and economic institutions that have shaped human societies around the world. An important aspect of many of these courses will be the examination of the moral and political ideals of liberal democracy in the modern world| but it is expected that most of the courses offered in this category will give to students some comparative perspective--over time and across cultures--on the ways in which human societies are organized. These courses will employ the methods and perspectives of various disciplines such as philosophy| political science| history| religious studies| economics| sociology| and anthropology. The courses will employ both original texts and contemporary materials.   For particular course descriptions| please see the Pilot Curriculum web site: http://www.college.upenn.edu/pilot curriculum/pccrsdescriptions.html   
GREEK VASE PAINTING,ARTH-424,/coursehistories/2231,A sociological theory is a verbal (but sometimes also mathematical) argument about core social processes underlying the apparently irreducible variety of social life. This course will review theoretical perspectives developed after the "classical" period of Durkheim| Weber| and Marx| and particularly since WWII. Theories to be covered include: micro-sociological perspectives of phenomenology| symbolic interactionism| and neo-Durkheimian interaction ritual theory; social behaviorism| exchange theory| and rational choice theory; neo-Marxian perspectives on power| conflict| and class; accounts of modernity and post-modernity; and the systems theories of Parsons and Luhmann. Recurring themes will include the micro-macro connection| the relationship between subjectivity and behavior| and the structure-agency problem. The course satisfies the theory requirement for sociology majors.   
CORINTH COMPUTER PROJECT,CLST-440,/coursehistories/3022,This course examines the policy development process including: the interaction of branches of government; policy analysis; information; constituencies; and management of a policy development office. The objective of this course is to provide an understanding of the development of government policy| both at the macro level and from the viewpoint of persons who are in supporting roles to the major actors in the process. The formula employed to achieve this objective consists of a combination of readings| lectures| discussions| and activities that are designed to blend conceptual and practical skills.   
PROBLEMS ANC. NEAR EAST: Assyrian Palaces and Reliefs,ARTH-522,/coursehistories/167,Topic Varies   
LANDSCAPE ARCHAEOLOGY,CLST-411,/coursehistories/3856,This course focuses on the current state of our knowledge about the neurobiological basis of learning and memory. A combination of lectures and student seminars will explore the molecular and cellular basis of learning in invertebrates and vertebrates from a behavioral and neural perspective.   
ART EGYPT & MESOPOTAMIA: Architecture and the City in the Ancient Near East,ARTH-224,/coursehistories/2464,Recurrent wars throughout history have led social scientists and laymen alike to the conclusion that war is an unavoidable institution. Is this a valid conclusion? If it is| it is a particularly grim conclusion in a nuclear age when humankind has the technological capacity to extinguish all life on the planet. The purpose of this seminar is to address this question by exploring six theories of the causes of war and examining six strategies for preventing war.   
REL&RIT ANC GREEK WORLD,CLST-408,/coursehistories/4010,An introduction to the fundamentals of the Hungarian language| acquisition of conversational| readings and writing skills.   
ROMAN ART & ARCHITECTURE,ARTH-221,/coursehistories/157,This course surveys the political| religious and domestic arts| patronage and display in Rome's Mediterranean| from the 2nd c. BCE to Constantine's 4th-c. Christianized empire. Our subjects are images and decorated objects in their cultural| political and socio-economic contexts (painting| mosaic| sculpture| luxury and mass-produced arts in many media from pottery| silverware and jewelry to textiles and ornamental furniture). We start with the Hellenistic cosmopolitan culture of the Greek kingdoms and their neighbors| and the late Etruscan and Republican Italy; next we map Roman art and art industry as developed around the capital city Rome| further adapted to unify the Empire's many peoples from Britain to the Middle East. That means the nature of the intercultural exchange is consistently an issue. To understand ancient viewers' encounters| you will meet the spaces of sanctuary and tomb| house and city| garden and private collection; your readings will sample ancient people's art writing too. Diverse approaches introduce art historical aims and methods| and their relationships to archaeology| anthropology and other disciplines--and also to modern kinds of museums| not least our own University Museum of Archaeology and Anthopology.   No prerequisities. Of interest also to students of classical| middle-eastern| visual and religious studies| anthropology| history| communications and the programs of GSD.   
ANCIENT GREEK COLONIES,CLST-532,/coursehistories/4202,Investigation of the grammar of Classical Greek from the viewpoint of historical linguistics. The course will offer historical explanations for numerous structural peculiarities of the Greek language and anomalies of Greek grammar| touch on the relationship of Greek with other languages| and incidentally introduce the student to some basic concepts of language analysis likely to be useful in teaching Greek and learning other languages.   
GREEK ART & ARCHITECTURE,ARTH-220,/coursehistories/1667,The continuation of French 110.   
ROMAN SCULPTURE,ARTH-427,/coursehistories/4516,This clinical course is designed to help prospective advanced practice nurses develop advanced skills in physical and developmental assessment of children in a variety of well-child| clinic and hospital settings. Data collection| data interpretation| and hypothesis formulations are emphasized for the purpose of clinical decision making. The role of the advanced practice nurse in assessment of primary health care issues and health promotion is incorporated throughout the course. Collaboration as an integral part of assessment will be an ongoing focus.   
Digital Reconstruction and Archaeology,CLST-212,/coursehistories/4538,This course focuses on agent-based computational models in the social sciences| especially in economic| in commercial and in strategic (game-theoretic) contexts. This relatively recent and now rapidly-developing form of computer simulation seeks to explain and predict complex social phenomena "from the ground up"| through interactions of comparatively simple agents. The course reviews experimental and theoretical results| and exposes the students to modern development environments for this form of simulation. Students have the opportunity to design and implement agent-based simulations. Programming| however| is not required. This course aims to integrate various topics in agent-based simulation| while developing an appreciation of the problems that are particularly characteristic of this form of simulation so that students will understand its promise and potential.   
ANATOLIAETRURIA&GREECE,CLST-531,/coursehistories/4712,The course will focus on race and ethnicity in the United States. We begin with a brief history of racial categorization and immigration to the U.S. The course continues by examining a number of topics including racial and ethnic identity| interracial and interethnic friendships and marriage| racial attitudes| mass media images| residential segregation| educational stratification| and labor market outcomes. The course will include discussions of African Americans| Whites| Hispanics| Asian Americans and multiracials.   
GIFTS/TREAS./GRAVE GOODS,ARTH-516,/coursehistories/4787,This is an introductory course on packet networks| protocols and technologies| with a particular emphasis on IP based networks such as the Internet. The course introduces the various design and implementation choices that are behind the development of modern networks| and emphasizes basic analytical understanding in motivating those choices. Topics are covered in a mostly "bottom-up" approach| starting with a brief review of physical layer issues such as digital transmission| compression and information theory| error correction and error recovery strategies. This is then followed by a discussion on how to move from bits to packets and various issues associated with successfully transmitting packets. The course then undergoes a brief digression aimed at exposing students to basic modeling tools useful in the analysis of communications systems| and then proceeds to explore approaches used to allow multiple users to share local communication resources| e.g.| multiple access control (MAC) strategies and local area networks. Network layer solutions (IP addressing| naming| and routing) that scale beyond local resources are covered next| before exploring end-to-end mechanisms such as TCP. Finally| the building blocks needed to offer advanced functionality such as quality-of-service and network security are examined.   
TOPOGRAPHY OF ATHENS,CLST-510,/coursehistories/4794,The aim of this course is to provide students with a basic knowledge of directing through an introduction to the functional tools of the craft. Classes provide lectures and practical work in dealing with topics such as the function of the director| analyzing a script| visual composition| blocking| stage business| and working with actors. This course is a prerequisite for Advanced Directing.   
MDVL ISLAMIC ART & ARCH: Early Islamic Art and Architecture Until 1250,ARTH-416,/coursehistories/4889,Post-Revolutionary Iranian cinema has gained exceptional international reception in the past two decades. In most major national and international festivals| Iranian films have taken numerous prizes for their outstanding representation of life and society| and their courage in defying censorship barriers. In this course| we will examine the distinct characteristics of the post-revolutionary Iranian cinema. Discussion will revolve around themes such as gender politics| family relationships and women's social| economic and political roles| as well as the levels of representation and criticism of modern Iran's political and religious structure within the current boundaries. There will be a total of 12 films shown and will include works by Kiarostami| Makhmalbaf| Beizai| Milani| Bani-Etemad and Panahi| among others.   
MAT & METHODS MED ARCH,CLST-526,/coursehistories/3025,An introduction to processes and forces that form the surface and the interior of the Earth. Topics include| changes in climate| the history of life| as well as earth resources and their uses.   
THE ISLAMIC CITY,ARTH-517,/coursehistories/3718,This course aims to provide incoming graduate students and advanced undergraduate students with an introduction to issues in Arabic grammar and syntax that commonly arise in pre-modern Arabic texts. Students will also be introduced to| and expected to consult| the standard reference works used as aids in reading such texts. Students will be expected to prepare a text or set of texts assigned by the instructor for each session. Preparation means| for these purposes| supplying all vowels and other necessary diacritical marks| as well as looking up unfamiliar words and constructions in appropriate dictionaries or other reference works. Regular attendance and thorough preparation are essential to success in this course. It is intended that| upon completion of this course| students will be able to work independently with a wide variety of pre-modern Arabic texts.   
ROMAN ARCH & URBANISM,ARTH-226,/coursehistories/4785,Role of transportation in founding and growth of cities. Classification| definitions| theory| and characteristics of urban transportation modes| their components and performance. Vehicle propulsion and travel time computations; energy consumption and its possible reduction. Bus| trolleybus| light rail| rapid transit| AGT and specialized modes - vehicles| ways| terminals| operations and costs. Paratransit modes| and their role in urban transportation. Theoretical and practical capacities of modes. Present and potential innovations in vehicle design| propulsion| automation| including fully automated rapid transit systems. Visit to a transit system.   
EMPIRES ANC NEAR EAST: Early Empires of the Ancient Near East: The Neo-Assyrian Empire,NELC-242,/coursehistories/4832,This course is an introduction to the basic concepts and standards underlying financial accounting systems. Several important concepts will be studied in detail| including: revenue recognition| inventory| long-lived assets| present value| and long term liabilities. The course emphasizes the construction of the basic financial accounting statements - the income statement| balance sheet| and cash flow statement - as well as their interpretation.   
ART OF ANDALUSIA: Art of Andalusia: Experience and Memory in the Mosque of Cordoba,ARTH-519,/coursehistories/5511,This course is for those who have completed Latin 204| Latin 212| or equivalent (such as placement score of 650| or AP score of 4 or 5). Close reading and discussion of a Latin author or a particular genre of latin literature. Topics will vary each semester| and the course may be repeated for credit.   Fall 2012 Topic:Caesar and Lucan both produced literary treatments of the first phase of the civil war that finally destroyed the Roman Republic| the contest between Caesar and Pompey for supremacy at Rome. This phase ended at the battle of Pharsalus in August of 48 BCE. Caesar wrote his narrative shortly after the war's end and before its effects were fully felt| Lucan wrote his epic poem roughly a century later from the perspective of the principate established in its essentials by Caesar's heir| Augustus. Although the narratives cover the same events| the two authors' literary and political aims| as well as their historical contexts| produced wildly divergent stories. We will read them in tandem. In Latin we will cover substantial portions of the three books of Caesar's Civil War and the ten books of Lucan's. We will read the entirety of both works in English.   
GREEK ARCH & URBANISM,ARTH-225,/coursehistories/3999,This course examines concepts of electromagnetism| vector analysis| electrostatic fields| Coulomb's Law| Gauss's Law| magnetostatic fields| Biot-Savart Law| Ampere's Law| electromagnetic induction| Faraday's Law| transformers| Maxwell equations and time-varying fields| wave equations| wave propagation in material media| boundary conditions| polarization| electromagnetic energy flow| normal and oblique incidence of waves at boundaries| transmission lines and applications.   
HELLENISTIC ARTS/SPECT,ARTH-428,/coursehistories/5620,Review of fundamental thermodynamic laws and criteria for equilibrium. Reaction equilibria in multicomponent systems. Free energies of mixing solutions| liquids| solids| and polymers. Binary and ternary phase diagrams. Surfaces and interfaces.   
Seafaring in the Ancient Greek World,CLST-340,/coursehistories/5638,Advanced seminar in topics of music theory and compositions.   
VITRUVIAN STUDIES,ARTH-530,/coursehistories/5767,This course aims to survey three or four topics of current research interest in cosmology| mostly at the level of review articles. The topics will be covered in greater depth and with more connections to ongoing research than the introductory cosmology course| ASTR 525. The course will be largely accesible to first and second year graduate students. Some exposure to cosmology and general relativity will be helpful but the first two weeks will attempt to bridge that gap. The topic selection will be done in part with input from the students. For the Fall 2009 semester| Dark Energy will be the first topic| Nonlinear Dynamics the likely second topic and Gravitational Lensing (focus on strong lensing) is a possible third topic. A few short problem sets and a presentation/write-up on a topic of interest| based on a review article or selected papers| will make up the course requirement.   
DOMESTIC LIFE OF THE COMMONERS IN ANCIENT CIVILIZATIONS,ANTH-324,/coursehistories/5856,This course develops elementary skills in reading| speaking| understanding and writing the Russian language. We will work with an exciting range of authentic written materials| the Internet| videos and recordings relating to the dynamic scene of Russia today. At the end of the course students will be comfortable with the Russian alphabet and will be able to read simplified literary| commercial| and other types of texts (signs| menus| short news articles| short stories) and participate in elementary conversations about daily life (who you are| what you do every day| where you are from| likes and dislikes).   
MIN CYC & MYCENAEAN ART,ARTH-222,/coursehistories/158,This course is designed to give the student an overview of the cultures of the Aegean Bronze Age. The art and architecture of Crete| the Cyclades and the Mainland of Greece will be examined in chronological order| with an emphasis on materials and techniques. In addition| larger issues such as the development of social complexity and stratification| and the changing balance of power during the Aegean Bronze Age will be examined. There are two texts for the course: Sinclair Hood's The Arts in Prehistoric Greece and Donald Preziosi and Louise Hitchcock's Aegean Art and the Architecture.   
SHROUDED IN MIST & CLOUD: The Cultural Landscapes of the Black Sea from Homer to the Present,ARTH-229,/coursehistories/2738,Introduction to advanced organic synthesis. Study of important synthetic reactions including: oxidations| reductions| and methods for the formation of carbon-carbon bonds| with an emphasis in chemoselectivity| stereoselectivity and asymmetric synthesis. Survey of modern methods for the synthesis of small| medium and large ring systems. Analysis of modern synthetic strategies| with illustrative examples from total synthesis of natural and unnatural products.   
INTRO VIS CULT ISLAM WLD,ARTH-235,/coursehistories/5859,Major Russian writers in English translation: Pushkin| Gogol| Turgenev| early Tolstoy| and early Dostoevsky.   
MEDIEVAL ART: Introduction to Visual Culture in the High Middle Ages,ARTH-240,/coursehistories/159,An introductory survey| this course investigates painting| sculpture| and the "minor arts" of the Middle Ages. Students will become familiar with selected major monuments of the Late Antique| Byzantine| Carolingian| Romanesque| and Gothic periods| as well as primary textual sources. Analysis of works emphasizes the cultural context| the thematic content| and the function of objects. Discussions focus especially on several key themes: the aesthetic status of art and the theological role of images; the revival of classical models and visual modes; social rituals such as pilgrimage and crusading; the cult of the Virgin and the status of women in art; and| more generally| the ideology of visual culture across the political and urban landscapes.   
