NAME,ALIAS,PATH,DESCRIPTION
WRITING SEMINAR IN CINE: PERSONAL FILM,CINE-009,/coursehistories/3314,Selected aspects of genetics| biochemistry| physiology and pharmacology are presented and applied to nursing care. Embryonic| histologic| and gross anatomical features of certain organ systems are functionally related to biochemical and physiological mechanisms essential for the maintenance of a stable internal environment. Special emphasis is placed upon integrating functions of the nervous and endocrine systems. Certain deviations from normal metabolism| structure and function are detailed.   
FILM HISTORY,CINE-101,/coursehistories/3315,The conceptual and practice application of brain-behavior relationships for individuals with mental health and psychiatric conditions is developed in this course. Students learn interview and differential diagnostic skills toscreen for neuropsychological etiologies of mental disorders such as schizophrenia| bipolar disorders| mood disorders and anxiety disorders. The course reviews specific theories of etiology and diagnostic classifications found in the Diagnostic and Statistical Manual of Mental Disorders-Fourth Edition- Text Revision (DSM IV- TR). Students develop the ability to make critical decisions as they learn finer points of differentiial diagnosing of mental disorders using a case based method of learning| allowing students to focus on specific populations such as aged| adults| adolescents| anchildren.   
STUDY OF AN AUTHOR: ALFRED HITCHCOCK,CINE-115,/coursehistories/3316,Crisis intervention| brief psycho-therapy| group processes and practices| milieu therapy| and intervention with families are examined as they relate to nursing practice in mental health.   
ROLE OF THE PRODUCER,CINE-120,/coursehistories/3317,This course presents Bowen Family Systems Theory as it applies to families over the life and organizations over time. This is a theoretical course whose purpose is to provide the student with a broad| systemic perspective on human functioning. The course begins with a detailed presentation of Systems Theory| from both a family and organizational perspective. As presented there is a continual compare and contrast to other dominant theories of human functioning. It then applies the concepts of Systems Theory to the understanding and assessment of the stages of the normal family life cycle from a multi-generational| multi-cultural perspective. This is followed by discussions of the theory's application to the emotional problems of children| adolescents| adults and their families. Likewise| application to organizational behavior is made| including health care organizations. Relevant research is discussed throughout.   
TOPICS IN FILM PRACTICE: POETS OF CINEMA,CINE-202,/coursehistories/3318,The relationships among nursing theory| research and practice will be examined. An emphasis will be placed on research competencies for advanced practice nurses (APNs)| including understanding nursing research methods and strategies in order to evaluate research results for applicability to practice and to design projects for evaluating outcomes of practice. An understanding of statistical techniques will be integrated into the course and build on the required undergraduate statistics course. Published nursing research studies will be evaluated for scientific merit and clinical feasibility| with a focus on evidence-based practice.   
PROSEM. CINEMA STUDIES: FIELD OF CINEMA STUDIES,CINE-515,/coursehistories/3319,This participatory interdisciplinary seminar course examines contemporary issues in public health policy and global health. The organizing framework is social determinants of health. We consider evidence that inequalities in education| income| and occupation influence health status| and the policy dilemma that broad interventions to improve population health may increase health disparities. We critically examine whether prevention is always better than cure| and what modern medicine has to offer in terms of health. We explore the public policy process in health using the "tobacco wars" as a case example| of how politics| policy| law| commercial interests| and research intersect to affect the public's health. We examine whether global health is in a state of decline| and the extent to which failures in public health| public policy| and foreign policy have contributed to increasing threats to world health. Likewise we will examine the potential for greater integration of health into foreign policy to create global infrastructure upon which to advance health. We will examine the global health workforce and the impact of widespread global migration of health professionals on receiving and sending countries.   There are no prerequisites. The course is designed for graduate students in the social and behavioral sciences| health professions| public health| business and law. Advanced undergraduate students will be admitted with permission.   
SEMINAR IN AFAMS: BLACKS IN AMER FILM/TV,AFRC-400,/coursehistories/3262,The state of matter is dependent upon temperature| thermal history| and other variables. In this course the science of such structural transition is treated|with the purpose in mind of utilizing it for producing materials with superior properties. The subjects covered include the methods of structural analysis| solidification| solid state transformation| and order-disorder transition.   
Processes of Place-Making: Fostering Public Design,ARTH-290,/coursehistories/2230,Gender is an organizing principle of society| shaping social structures| cultural understandings| processes of interaction| and identities in ways that have profound consequences. It affects every aspect of people's lives| from their intimate relationships to their participation in work| family| government| and other social institutions and their place in the stratification system| Yet gender is such a taken for granted basis for differences among people that it can be hard to see the underlying social structures and cultural forces that reinforce or weaken the social boundaries that define gender. Differences in behavior| power|and experience are often seen as the result of biological imperatives or of individual choice. A sociological view of gender| in contrast| emphasizes how gender is socially constructed and how structural constraints limit choice. This course examines how differences based on gender are created and sustained| with particular attention to how other important bases of personal identity and social inequality--race and class-interact with patterns of gender relations. We will also seek to understand how social change happens and how gender inequality might be reduced.   
TOPICS IN ASIAN-AM STDS,ASAM-150,/coursehistories/2474,Over the past two decades| the public imagination has been gripped by the concept of globalization. Scholars| corporations| advertisers and government officials have latched onto this idea as a defining feature of our current era.These various constituencies use globalization not only to account for epochal shifts in our economy and society| but also to justify new types of business strategy and public policy. This course will examine three interlinked dimensions of globalization: Global economic processes (e.g. the transnational operations of multinational firms that have given rise to a new international division of labor); cultural globalization (e.g. the spread of American brands like Coca Cola| Nike and Hollywood films)| and political globalization (e.g. the rise of supranational organizations like the IMF| World Bank and WTO that promote the idea of free markets).   Moreover| we will study globalization in the context of cities because| given their centrality to globalization processes| it is in cities that we can best understand how globalization takes place. In cities| we can study the global economic processes that restructure urban space| giving rise to new financial districts| international art exhibits and post-modern architecture and entrepreneurial strategies that seek to elevate cities to world city status. The course will examine these processes in a comparative light| contrasting urban globalization processes in Europe and North America with those in Latin America| Asia and Africa.   
VISUAL COMMUNICATION,COMM-262,/coursehistories/296,Examination of the structure and effects of visual media (film| television| advertising| and other kinds of pictures).   
CONTEMPOR FICT/FILM-JPAN: Contemporary Fiction & Film in Japan,EALC-257,/coursehistories/3347,This course is taught with the more descriptive title of "Scripting for Business Analytics." "Business Analytics" refers to modeling and analysis undertaken for purposes of management and supporting decision making. The varieties of techniques and methods are numerous and growing| including simple equational models| constrained optimization models| probabilistic models| visualization| data analysis| and much more. Elementary modeling of this sort can be undertaken in Excel and other spreadsheet programs| but "industrial strength" applications typically use more sophisticated tools| based on scripting languages. Scripting languages are programming languages that are designed to be learned easily and to be used for special purposes| rather than for large-scale application programming. This course focuses on the special purposes associated with business analytics and teaches MATLAB and Python in this context. MATLAB and Python are widely used in practice (both in management and in engineering)| as are the business analytic methods covered in the course. Prior programming experience is useful| but not required or presumed for this course.   
READING FILM: Film and Literature: Reading Film,ENGL-092,/coursehistories/392,This course is an introduction to the analysis of film as both a textual practice and a cultural practice. We will examine a variety of films--from Fritz Lang's M (1931) to Julia Dash's DAUGHTERS OF THE DUST (1991)--in order to demonstrate the tools and skills of "close reading." We will concentrate on those specifically filmic features of the movies| such as mise-en-scene| cinematography| editing and sound strategies| as well as those larger organizational forms| such as narrative and non-narrative structures and movie genres. Because our responses to the movies always extend beyond the film frame| we will additionally look closely at the complex business of film distribution| promotion| and exhibition to show how the less visible machinery of the movie business also shapes our understanding and enjoyment of particular films. Along the way| we will discuss some of the most influential and productive critical schools of thought informing film analysis today| including realism| auteurism| feminism| postmodernism| and others. Screenings are mandatory.   See the English Department's website at www.english.upenn.edu for a description of the current offerings.   
TOPICS IN LIT. & SOCIETY: COPYRIGHT AND CULTURE,ENGL-105,/coursehistories/3361,In this class| we will engage in a close reading of Wittgenstein's major writings: the Tractatus Logico-Philosophicus and the Philosophical Investigations. Some of the main topics to be considered include: how languagerelates to the world; what philosophy is and what it can accomplish; the nature of understanding; what is involved in following a rule; and the phenomenon of seeing-as.   A distinctive feature of Wittgenstein's approach to philosoph is his commitment to philosophy as an activity rather than a set of doctrines. In keeping with this| the main goal of this class is for you to learn to do philosophy: to read closely| to grapple with foundational questions| and to talk seriously with others. This class is very much a seminar| and I will avoid lecturing as much as possible.   
SCREENWRITING WORKSHOP,ENGL-116,/coursehistories/400,This course will look at the screenplay as both a literary text and a blue print for production. Several classic screenplay texts will be critically analyzed (REBEL WITHOUT A CAUSE| DOCTOR STRANGELOVE| PSYCHO| etc.) Students will then embark on writing their own scripts. We will intensively focus on: character enhancement| creating "believable" cinematic dialogue| plot development and story structure| conflict| pacing| dramatic foreshadowing| the element of surprise| text and subtext and visual story-telling. Class attendance is mandatory. Students will submit their works-in-progress to the workshop for discussion.   See English Department's website at www.english.upenn.edu for a description of the current offerings.   
ADVANCED SCREEN WRITING,ENGL-130,/coursehistories/3067,An analysis of American society from the founding of the Colonies to the outbreak of Civil War. Topics to be emphasized include: the interaction among European| Indian and African cultures in the New World; the shaping of the distinctive American character; the creation of an independent nation-state; and the crisis of the Union. Special attention will be given to biographical profiles of the men and women who helped shape American history during this period.   
TPS MODERN BRITISH LIT: Contemporary British Cinema,ENGL-261,/coursehistories/413,The course explores an aspect of 20th-century literature intensively; specific course topics will vary from year to year.   See the English Department's website at www.english.upenn.edu for a description of the current offerings.   
DIRECTOR'S CINEMA,ENGL-292,/coursehistories/424,This course explores an aspect of Film Studies intensively; specific course topics vary from year to year.   See the English Department's website at www.english.upenn.edu for a description of the current offerings.   
TOPICS FILM STUDIES: CINEMATIC TRAVEL,ENGL-392,/coursehistories/3371,The seminar will focus on works by Derek Parfit| Thomas Nagel| Bernard Williams| Samuel Scheffler| T.M. Scanlon| Philippa Foot and other leading contemporary moral philosophers. Students are expected to lead class discussion at some point during the semester| and write an article length paper.   
FILM/VIDEO I,FNAR-061,/coursehistories/444,This course provides students with the introductory skills and concepts needed to create short works using digital video technologies. Students will learn the basics of cinematography and editing through a series of assignments designed to facilitate the use of the medium for artistic inquiry| cultural expression and narrative storytelling.   
FILM/VIDEO II,FNAR-062,/coursehistories/445,Video II offers opportunities to further explore the role of sound| editing and screen aesthetics. Through a series of three video projects and a variety of technical exercises| students will refine their ability to articulate more complex and creative projects in digital cinema. In addition| advanced level production and post-production equipment is introduced in this course.   
DOCUMENTARY VIDEO,FNAR-063,/coursehistories/446,A digital video course stressing concept development and the exploration of contemporary aesthetics of the digital realm| specifically in relation to the documentary form. Building on camera| sound and editing skills acquired in Film/Video I and II| students will produce a portfolio of short videos and one longer project over the course of the semester. Set assignments continue to investigate the formal qualities of image-making| the grammar of the moving image and advanced sound production issues within the documentary context.   
CINEMA PRODUCTION,FNAR-065,/coursehistories/3381,An intermediate course. Electrostatic fields and potentials| dielectrics| and direct currents.   
ADV DIG IMAG: ANIMATION,FNAR-267,/coursehistories/463,Through a series of studio projects| this course will focus on 2D and 3D computer animation. Emphasis is placed on time-based design and storytelling by developing new sensitivities to movement| cinematography| editing| sound| color| and lighting. Compositing software covered in the course will be used to combine 2D graphics| 3D animation| and sound. Recommended materials: Wacom Pen   
MASTERPIECES OF FR CINEM,FREN-230,/coursehistories/1313,A continuing exploration of architectural design. Content and technique in representation and construction are explored through various studio design exercises.   
GERMAN CINEMA,GRMN-258,/coursehistories/2589,An introduction to the study of culture and human institutions| how they change| and their role in both literate and nonliterate societies.   
INTRO. TO ITALIAN CINEMA,ITAL-080,/coursehistories/644,Italian national cinema from the Golden Age of silent film and classics of Neorealism to present| covering work of a dozen major directors. Films discussed in context of history from the Unification| national vs. regional identity| gender roles| contemporary politics. Readings in Italian history| Italian film history| and theory of cinema. Taught in English.   
CONTEMP ITALY THRU FILM,ITAL-213,/coursehistories/3129,The aim of this course is to engage students in identifying the historical roots of the modern medical care system through the study of the social historyof the United States and Great Britain and through an investigation of the history of modern medical sciences.   
IRAN CINEMA:GEND/POL/REL,NELC-118,/coursehistories/3463,Selected topics in Christian mystical writings. Authors will be read in English translation. Knowledge of medieval languages is helpful| but not required.   
WINNRS/LOSRS IN LIT/FILM: WINNER/LOSERS FILM/LIT,RUSS-449,/coursehistories/3504,An introduction to the fundamentals of the Czech language| acquisition of conversational| reading and writing skills.   
INTRO TO SPANISH FILM,SPAN-285,/coursehistories/3512,The American Dream highlights opportunity for individuals to achieve success based on their own ability and initiative. How well does our society live up to this ideal? Who gets ahead| and who falls behind? Topics include factors that affect life chances in contemporary society: education| social class| race| ethnicity and gender.   
ADV TPCS IN THEATRE,THAR-275,/coursehistories/1126,This course will combine an intensive practical and intellectual investigation of some area of the making of theatre: performance techniques| theatrical styles| a particular period of theatre history. For the current topics contact the Theatre Arts office.   One section of 275 every other Spring will consist of a small number of Theatre Arts majors selected by the faculty to become members of "the Edinburgh Project." This ensemble will mount a production that will be performed at the Edinburgh Festival Fringe in August. Many of the readings and exercises in this course will be geared to prepare for production; rehearsals for the project will continue after the exam period at the end of the semester.   
20th-Cent British Lit: British Cinema - Penn-in-London,CINE-160,/coursehistories/3794,Impressionism opened the pictorial field to light| perception| science| modernity| bourgeois leisure and| famously| the material qualities of painting itself. This course will survey the movement's major contexts and proponents-Magnet| Monet| Morisot| Cezanne| Guaguin| Van Gogh| Rodin-from its origins in the 1860s to its demise in the 1890s| as well as its subsequent adaptations throughout the world until WWI. We will pay particular attention to Impressionsim's critical reception and the historical conditions| which allowed one nation| France| to claim the emergence of early Modernism so firmly for itself. Questions to be addressed include: how can an art of vision and light figure the complexities of history and politics| and especially the revolutions that marked the period? What are the gendered and sexual politics of Impressionsm's obsession with the nude female body? How did the invention of the new technologies and media effect the development of modern art?   Throughout the course| we will also analyze the effects the rapidly changing social and cultural fabric of Paris had on artistic developments. Arguable| Paris was the "capital of the nineteenth century|" and it is here where most artistic innovation of the time took place. None-the-less| we will look outside of France's borders with some frequency| especially to Germany and Britain.   
INTRO FILMFORMCONTEXT,COMM-140,/coursehistories/1258,A continuation of the Japanese language at the intermediate level.   
PENN-IN-CANNES: Perspective on Film: Survey of International Cinema,ENGL-039,/coursehistories/3548,Spanish for the Professions is designed to provide advanced-level language students with a wide-ranging technical vocabulary and the enhancement of solid communicative skills within the cultural context of several developing Latin American countries. Focusing on topics such as politics| economy| society| health| environment| education| science and technology| the class will explore the realities and underlying challenges facing Latin America. Through essays| papers| articles| research| discussions| case studies| and videotapes| we shall take an in-depth look at the dynamics of Latin American societies. The course will focus on--but not be restricted to--Mexico| Cuba and Argentina.   
FILM THEORY,ENGL-592,/coursehistories/3739,A continuation of the Japanese language beyond the intermediate level.   
ADULTERY NOVEL,RUSS-125,/coursehistories/1485,
TOPICS FILM HISTORY: CENSORSHIP-AMERICA FILM,CINE-201,/coursehistories/3832,
MLA SEMINARS IN CINEMA: FOOD AND FILM,CINE-500,/coursehistories/3833,
MYTHOLOGY & THE MOVIES,ANTH-160,/coursehistories/3820,An intensive independent study experience on an engineering or biological science problem related to BE. Requires preparation of a proposal| literature evaluation| and preparation of a paper and presentation. Regular progress reports and meetings with faculty advisor are required.   
Post War Japanese Cinema and Visual Culture,ARTH-210,/coursehistories/2981,The purpose of the course is to introduce you to the subjects of the disciplineof Folkore| their occurrence in social life and the scholarly analysis of their use in culture. As a discipline folklore explores the manaifestations of expressive forms in both traditional and moderns societies| in small-scale groups where people interace with each face-to-face| and in large-scale| often industrial societies| in which the themes| symbols| and forms that permeate traditional life| occupy new positions| or occur in differenct occasions in in everyday life. For some of you the distinction between low and high culture| or artistic and popular art will be helpful in placing folkore forms in modern societies. For others| these distinction will not be helpful. In traditional societies| and within social groups that define themselvfes ethnically| professionally| or culturally| within modern heterogeneous societies| and traditional societies in the Americas| Africa| Asia| Europe and Australia|folkore plays a more prominent role in society| than it appears to plan in literatie cultures on the same continents. Consequently the study of folklore and the analysis of its forms are appropriate in traditional as well as modern societies and any society that is in a transitional phase.   
EAST/WEST STAGE & SCREEN: IMMIGR IN DRAMA & CINEMA,ASAM-275,/coursehistories/3827,Development of concepts about the operation of themammalian cardiovascular system as conceived in the years 198 (by Galenus)| 1628 (by Harvey)| and 1998 (at Penn by A. Noordergraaf). Example topics include muscle structure and mechanical properties; the singel band structure of the two ventricles; electrical stimulation; Frank's mechanism; and mathematical desription of the heart as a pump.   
TOPICS IN CHINESE CINEMA,EALC-225,/coursehistories/3869,Analysis of processes used in the chemical and pharmaceutical industries. Mass and energy balances| properties of pure fluids| equations of state. Heat effects accompanying phase changes and chemical reactions.   
TOPICS IN LITERATURE: The Ancients and Shakespeare on Justice and Happiness,ENGL-016,/coursehistories/378,Freshman Seminars under the title "Topics in Literature" will afford entering students who are considering literary study as their major the opportunity to explore a particular and limited subject with a professor whose current work lies in that area. Topics may range from the lyric poems of Shakespeare's period to the ethnic fiction of contemporary America. Small class-size will insure all students the opportunity to participate in lively discussions. Students may expect frequent and extensive writing assignments| but these seminars are not writing courses; rather| they are intensive introductions to the serious study of literature. One of them may be counted toward the English major and may be applied to a period| genre| or thematic requirement within the major.   See the English Department's website at www.english.upenn.edu for a description of the current offerings.   
TPCS IN THEATRE HISTORY,ENGL-078,/coursehistories/386,As a complex cultural product| television lends itself to a variety of critical approaches that build-on| parallel| or depart from film studies. This introductory course in television studies begins with an overview of the medium's history and explores how technical and industrial changes correspond to developing conventions of genre| programming| and aesthetics. Along the way| we analyze key concepts and theoretical debates that shaped the field. In particular| we will focus on approaches to textual analysis in combination with industry research| and critical engagements with the political| social and cultural dimensions of television as popular culture.   See the English Department's website at www.english.upenn.edu for a description of the current offerings.   
