NAME,ALIAS,PATH,DESCRIPTION
TOPICS CULTURAL STUDIES: Propaganda and Political Censorship in America Media,ENGL-295,/coursehistories/2538,This is a two-semester course| covering the same material as the second semester of Intensive Beginning Chinese. The main objective of the course is to help students continue to build a solid foundation of the four basic skills--listening| speaking| reading| and writing. By the end of two semesters| students should achieve the following goals: 1) pronounce all the sounds in Mandarin Chinese accurately and comfortably with a good command of the four tones; 2) carry out basic conversations in daily activities; 3) recognize and reproduce approximately 600-650 characters; and 4) read edited simple stories and write   
FRENCH IDENTITY,FREN-301,/coursehistories/508,The purpose of this course will be to explore the following issues: What is the specificity of women in French society--what distinguishes the "education" --both familial and institutional--which contributes to the formation of a distinctly feminine sense and self? How has this specificity contributed to the roles and functions played by women over the course of the century? And finally| how have women--individually and collectively--become aware of these forces| and sought to modify them in order to devise introduction to French culture and society. Authors include: de Beauvoir| Carles| Djebar| Duras| Ernaux| Kofman| Weil.   
LOOKING FOR LOLA: The Allure of a Cinematic Name,GRMN-001,/coursehistories/3745,An introduction to the study of culture and human institutions| how they change| and their role in both literate and nonliterate societies.   
FICTION INTO FILM: Italian Encores: Fiction into Film,ITAL-380,/coursehistories/2610,Theoretical and applied interpretations of health concepts and human health behavior. Biological and ecological disease processes; case studies of social interaction in health care settings; social structural analyses of medical institutions.   
MOD HEB LIT & CULT TRANS: Image of Childhood in Israeli Film and Literature,NELC-159,/coursehistories/3180,This tutorial allows students to deal in a concentrated manner with selected major topics in linguistics by means of extensive readings and research. Two topics are studied during the semester| exposing students to a range of sophisticated linguistic questions.   
CHEKHOV STAGE & SCREEN,RUSS-426,/coursehistories/2411,Linear algebra: vectors| matrices| systems of linear equations| eigenvalues and eigenvectors. Vector calculus: functions of several variables| vector fields| line and surface integrals| Green's| Stokes' and divergence theorems. Series solutions of ordinary differential equations| Laplace transforms and systems of ordinary differential equations. Use of symbolic manipulation and graphics software.   
INDIAN CINEMA & SOCIETY,SAST-213,/coursehistories/3942,Live broadcasts of historic events - contests| conquests| and coronations - constitute a new form of ceremonial politics whereby television joins the establishment and audience to declare a holiday. The course will analyze this genre - its diffusion| politics| aesthetics| ethnography| and effects.   
TPCS IN SA CINEMA: POSTCOLONIAL MEDIATIONS,SAST-310,/coursehistories/3944,
INTRO-LATIN/AMER FILM: Mexican Film:  19th Century to the Present,SPAN-287,/coursehistories/3969,This course is the sequel to EAS 345 and focuses on the planning process for a new technology venture. Like its prerequisite| the course is designed expressly for students of engineering and applied science having a keen interest in technological innovation. Whereas EAS 345 investigates the sequential stages of engineering entrepreneurship from the initial idea through the early growth phase of a startup company| EAS 346 provides hands-on experience in developing a business plan for such a venture. Working in teams| students prepare and present a comprehensive business plan for a high-tech opportunity. The course expands on topics from EAS 345 with more in-depth attention to: industry and marketplace analysis; competitive strategies related to high-tech product/service positioning| marketing| development and operations; and preparation of sound financial plans. Effective written and verbal presentation skills are emphasized throughout the course. Ultimately| each team presents its plan to a distinguished panel of recognized enterepreneurs| investors and advisors from the high-tech industry.   
AMERICAN MUSICAL THEATRE,THAR-271,/coursehistories/3985,An introduction to game theory and its applications to economic analysis. The course will provide a theoretical overview of modern game theory| emphasizing common themes in the analysis of strategic behavior in different social science contexts. The economic applications will be drawn from different areas including trade| corporate strategy and public policy.   
FILM ANALYSIS & METHODS,CINE-102,/coursehistories/4004,This graduate level course focuses linear system theory in time domain based on linear operators. The course introduces the fundamental mathematics of linear spaces| linear operator theory | and then proceeds with existence and uniqueness of solutions of differenial equations| the fundamental matrix solution and state transition matrix for time-varying linear systems. It then focuses on the fundamental concepts of stability| controllability| and observability| feedback| pole placement| observers| output feedback| kalman filtering| linear quadratic regulator. Special topics such as optimal control| robust| geometric linear control will be considered as time permits.   
CINEMA STUDIES SEMINAR,CINE-498,/coursehistories/4005,This course is designed to provide an understanding of the physcial aspects of telecommunications systems. This includes an understanding of waves and wave propagation| basic optics| the operation of optical fibers and fiber communication systems| an introduction to optical networks| free-space optical communications| and an understanding of simple antennas and arrays and their use in wireless communications.   
ANTHROPOLOGY AND CINEMA: Anthropology and the Cinema,ANTH-336,/coursehistories/2969,This is an intermediate-level course in macroeconomics and the global economy| including topics in monetary and international economics. The goal is to provide a unified framework for understanding macroeconomic events and policy| which govern the global economic environment of business. The course analyzes the determinants and behavior of employment| production| demand and profits; inflation| interest rates| asset prices| and wages; exchange rates and international flows of goods and assets; including the interaction of the real economy with monetary policy and the financial system. The analysis is applied to current events| both in the US and abroad.   
FILM HISTORY,ARTH-108,/coursehistories/3715,This course is an introductory course to the Chinese language and culture in the field of business and commerce. The conversation component is aimed to introduce the language common to a wide range of Sino-American business communication situations. The reader serves as an introduction to basic Chinese economic terminology in its written form. This class prepares students for Advanced Commercial Chinese.   
American & Italian Cinema - Visions of Rome,CLST-206,/coursehistories/4007,Bipolar and MOS devices. Performance limitations due to fabrication techniques.Current and future IC technologies for electronic and optical devices.   
COMMCLTRE&SEXL MINORIT,COMM-430,/coursehistories/1264,Prerequisite(s): Knowledge of biblical Hebrew and prior experience studying the Hebrew text of the Bible in high school or college. May be repeated for credit. Language of instruction is English. Qualified undergraduates are welcome but must contact the instructor for permission and explain how they meet the prerequisites before registering.   
MONSTERS OF JAPAN,EALC-055,/coursehistories/4021,A course designed to allow the students to discover their own talents in at least two forms from a list that includes fiction| poetry| journalistic writing| creative nonfiction writing| and memoir. Though emphasis is on practice| classroom work includes discussion of theory as well as readings in published works. Frequent writing assignments. Reading lists vary with each section. See the English Department's website at www.english.upenn.edu for a description of the current offerings.   See the English Department's website at www.english.upenn.edu for a description of the current offerings.   
KOREAN FILM & CULTURE: SCREENING MODERN KOREA,EALC-186,/coursehistories/3731,An introduction to the vocabulary and speech styles characteristic of business communication.   
CULTURES OF THE BOOK,ENGL-034,/coursehistories/3061,This introductory course takes a policy and politics angle to health care's three persistent issues - access| cost and quality. The roles of patients| physicians| hospitals| insurers| and pharmaceutical companies will be established. The interaction between the government and these different groups will also be covered. Current national health care policy initiatives and the interests of class members will steer the specific topics covered in The course aims to provide skills for critical and analytical thought about the U.S. health care system and the people in it.   
INTRO TO CINEMA,ENGL-091,/coursehistories/1812,An intensive two-credit course covering the first and second semester of the elementary year for students who have never studied Italian before but have already fulfilled the language requirement in another modern language| preferably a romance language. Students who have fulfilled the language requirement in a language other than a romance language will be considered on an individual basis. All students must have departmental permission to register.   Class work emphasizes the development of the oral-aural skills| speaking and and listening. Readings on topics in Italian culture as well as frequent writing practice are also included. Out-of-class homework requires work with the Internet| audio and video materials.   
MADNESS & LIT 19 & 20 C,ENGL-102,/coursehistories/1813,This course is the continuation of the elementary level sequence designed to develop functional competence in the four skills. Class work emphasizes the further development of the oral-aural skills| speaking and listening. Readings on topics in Italian culture as well as frequent writing practice are also included. Out-of-class homework requires work with the Internet| audio and video materials.   
TOPICS AMERICAN LIT: American War & Travel Literature:  Vietnam,ENGL-286,/coursehistories/421,This course explores an aspect of American literature intensively; specific course topics will vary| and have included "American Authors and the Imagined Past" and "American Gothic."   See the English Department's website at www.english.upenn.edu for a description of the current offerings.   
TOPICS 20TH-C LITERATURE: MLA Proseminar: Representing War in the Twentieth Century,ENGL-461,/coursehistories/4032,This course traces the development of the novel across the twentieth-century. The course will consider the formal innovations of the modern novel (challenges to realism| stream of consciousness| fragmentation| etc.) in relation to major historical shifts in the period. Authors treated might include: Conrad| Lawrence| Joyce| Forster| Woolf| Cather| Faulkner| Hemingway| Achebe| Greene| Rhys| Baldwin| Naipaul| Pynchon| Rushdie| and Morrison.   See the English Department's website at www.english.upenn.edu for a description of the current offerings.   
DIGITAL CINEMA,ENGL-569,/coursehistories/4034,An overview of Asian American literature from its beginnings at the turn of the twentieth century to the present. This course covers a wide range of Asian American novels| plays| and poems| situating them in the contexts of American history and minority communities and considering the variety of formal strategies these different texts take.   See the English Department's website at www.english.upenn.edu for a description of the current offerings.   
PARIS IN FILM,FREN-386,/coursehistories/4042,This is an introduction to literary study through the works of a compelling literary theme. (For offerings in a given semester| please see the on-line course descriptions on the English Department website). The theme's function within specific historical contexts| within literary history generally| and within contemporary culture| are likely to be emphasized. Some versions of this course will also serve as an introduction to other members of the English faculty| who will visit the class as guest lecturers. This course is designed for the General Requirement| and is ideal for the students wishing to take an English course but not necessarily intending to major.   See the English Department's website at www.english.upenn.edu for a description of the current offerings.   
LECTURE,GRMN-256,/coursehistories/553,For centuries the pact with the devil has signified humankind's desire to surpass the limits of human knowledge and power. From the reformation chap book to the rock lyrics of Randy Newman's Faust| from Marlowe and Goethe to key Hollywood films| the legend of the devil's pact continues to be useful for exploring our fascination with forbidden powers.   
The German Connection: Hollywood and Berlin,GRMN-550,/coursehistories/1891,Mathematics 480 will open with a review of the basics of real analysis (brief or extended background requires). The review will include: introduction of the real numbers through Dedekind cuts| continuity of real-valued functions on the real line; Cantor nested-interval principle| basic results for continuous functions| Maximum and Intermediate Value theorems| Heine-Borel Theorem| Uniform Continuity on closed intervals; metric spaces| convergence of sequences| Cauchy sequences| completeness| more general uniform continuity and intermediate value theorems; general topology| separation| compactness| product spaces| Tychonoff's Theorem.   Special topics in analysis: Weierstrass Polynomial Approximation Theorem| Bernstein polynomials and simultaneous approxfunctions and derivatives| topics from divergent series| summation methods; r measure theory| the Lebesgue integral| Lp spaces| Holder| Minkowski| and and Cauchy-Schwarz inequalities; basics of Functional Analysis| normed spaces| Banach spaces and Hilbert space| with examples (Lp spaces| continuous-functions spaces)| Banach spaces and spectral theory| groups and Fourier transforms| Tauberian theorems; approximation theory| again| through the prism of functional analysis; extension of the polynomial approximation theorem (Stone-Weierstrass theorem)| Muntz approximation theorem (by polynomials with preassigned powers)| compact operators| the Spectral theorem| Stone's theorem (resprsentations of the additive group of real numbers); Peter-Weyl theory (represenations of compact groups). A selection from these topics as time and class preparation allow.   
GENDER HIST & AMER FILM,HIST-347,/coursehistories/4056,The focus of this course has varied in the past to include "Psychoanalysis and Literature|" "Allegory| Allegories| and Reading|" and "Introduction to Literary Criticism|" treating authors from Plato and Aristotle to the leading contemporary Anglo-American and continental critics and theorists and dealing with the complexity of terms such as "meaning|" "interpretation|" "genre|" and so on.   
CINEMA & THE SISTER ARTS,ITAL-588,/coursehistories/4066,This course explores an aspect of Native-American literature intensively; specific course topics will vary from year to year.   See the English Department's website at www.english.upenn.edu for a description of the current offerings.   
BRAZILIAN MUSIC,PRTG-240,/coursehistories/3223,Physical properties; fluid statics; Bernoulli equation; fluid kinematics; conservation laws and finite control-volume analysis; conservation laws and differential analysis; inviscid flow; The Navier-Stokes equation and some exact solutions; similitude| dimensional analysis| and modeling; flow in pipes and channels; boundary layer theory; lift and drag.   
RELIGION AND FILM,RELS-105,/coursehistories/2101,This course will provide an overview of major figures and themes of modern political thought. We will focus on themes and questions pertinent to political theory in the modern era| particularly focusing on the relationship of the individual to community| society| and state. Although the emergence of the individual as a central moral| political| and conceptual category arguably began in earlier eras| it is in the seventeenth century that it takes firm hold in defining the state| political institutions| moral thinking| and social relations. The centrality of "the individual" has created difficulties| even paradoxes| for community and social relations| and political theorists have struggled to reconicle those throughout the modern era. We will consider the political forms that emerged out of those struggles| as well as the changed and distinctly "modern" conceptualizations of political theory such as freedom| responsibilty| justice| rights and obligations| as central categories for organizing moral and political life.   
RUSS & EAST EURO FILM,RUSS-165,/coursehistories/2915,This course explores an aspect of Film History intensively; specific course topics vary from year to year.   See the English Department's website at www.english.upenn.edu for a description of the current offerings.   
RUSSIAN HISTORY IN FILM,RUSS-275,/coursehistories/2407,Brief review of High School calculus| applications of integrals| transcendental functions| methods of integration| infinite series| Taylor's theorem. Use of symbolic manipulation and graphics software in calculus.   
Nationalism and Ethnic Conflict in Film,RUSS-430,/coursehistories/3240,Management 238 is the standard undergraduate course in Organizational Behavior. The course deals essentially with the management of people at work. It examines the individual employee in his organizational environment| as well as the organization itself. Topics range from motivation| leadership groups all the way to organization structure| culture| human resources and organizational change. The course develops some themes in which these topics become relevant -- for example the networking organization and diversity at the workplace. Students should expect to conduct group projects involving actual fieldwork and might be asked to give a presentation in class.   
FATE/CHANCE IN LIT&FILM,RUSS-432,/coursehistories/2918,While it has been more than a hundred years since Freud discovered the unconscious since it was in 1897 that Freud started his self-analysis and discovered that "Nothing human was alien to him"| one may wonder about the survival of Freudian thought today with the rapid development of genetics| biology and chemistry| one often hears that psychoanalysis is obsolete and has lost its scientific credibility. In order to assess Freud' legacy in our culture| this seminar aims at a systematic rereading of Freud's works by focusing the practice of the talking cure in the wake of questions posed by Lacan's French school. We will study the various channels through which Freudian ideas have permeated our culture. We shall read first Freud's groundbreaking book on dreams before engaging with a few clinical essays Dora: An analysis of a case of Hysteria| The Wolf Man| The Rat Man| The Psychotic Doctor Schreber| The Sexual Enlightenment of Children. We will survey meta-psychological texts like Leonardo da Vinci| Jokes| Civilization and Its Discontents| and Moses and Monotheism. Short weekly response paper| two ten page papers| one oral presentation.   
STUDIES IN SPAN AM CULT.: MONSTRUOS Y MAQUINAS,SPAN-396,/coursehistories/1087,Topics vary. See the Romance Languages Department's website at http://ccat.sas.upenn.edu/roml for a description of the current offerings.   
TELEVISON STUDIES,CINE-150,/coursehistories/4181,This course uses the law school case method to teach students the legal framework for government in the U.S. The first unit addresses federal law and covers separation of powers| federalism| individual rights| administrative law| and the nation's judicial system. The second unit addresses state law and includes state constitutions| state governmental structures and the relationship between state and local governments. The third unit focuses on local government law and includes the police power| zoning and takings| public immunity| civil service| and collective bargaining. Students will learn the material by outlining key court decisions and by making two presentations| one on a federal agency and one on a local agency.   
HISTORY OF ANIMATION,CINE-170,/coursehistories/4182,This course provides students with the concepts and tools to help nonprofit and government organizations market their programs and services. The course emphasizes applications| and students will complete a marketing plan during the course for a nonprofit organization or government agency of their choice. Students will learn how to conduct competitive analyses| benchmarking| market segmentation and client needs; explore opportunities for social research on client needs; explore opportunities for social entrepreneurship and product development; and design effective Web and direct marketing tactics as part of an overall promotion and packaging strategy.   
FILM IN RESIDENCE: Film Culture in Residence,CINE-180,/coursehistories/4183,In this course you will explore ways to provide women with practical| 'real world' skills--political and community organizing| communications| fundraising| advocacy and media experience--that will enable them to achieve meaningful political| economic| and civic participation in the life of their countries. Students may also be involved with an international trip with Women's Campaign International. The course is designed to give the theoretical background and tools to put together an insightful international training to politically empower women.   
ART AND BUSINESS OF FILM: Art & Business of Film: Creating Managing Exhibiting and Marketing Film,CINE-285,/coursehistories/4184,This course explores the role of media in politics and discusses strategies for using media resources for greatest effect. The design of the course allows for a flexible workshop format and includes guest lectures by media personalities and politicians as well as a trip to meet with media professionals in Washington. The course also provides regular opportunities for students to implement what they have learned through in-class media trainings| mock editorial board interviews| governing strategy scenarios| campaign strategy scenarios| and political advertisement assessments.   
TELEVISION AND MEDIA,CINE-296,/coursehistories/4185,Judges in law courts are bound to decide facts according to law and to find law in keeping with precedent| statutes| and the Constitution. How do judges shoulder this great responsibility when the cases before them involve highly politicized| morally charged| socially divisive issues about which the judge may have formed a strong personal opinion? The course will address this question through a reading of cases and commentary| including in particular Robert Cover's Justice Accused and Lawrence Baum's The Puzzle of Judicial Behavior.   
TOPICS IN ANIMATION,CINE-320,/coursehistories/4186,An introduction to geology for non-science majors and those who are particularly curious about the nature of our planet and the scientific controversies about its past and its future.   
TOPICS IN CINEMA STUDIES: Masters of European Cinema: Film Poetics,CINE-392,/coursehistories/4187,The big bang| origin of elements| stars| Earth| continents and mountains.   
ANTHROPOLOGY AND CINEMA,ANTH-231,/coursehistories/4150,This course will present the study of health traditions in the field of folklore and folklife. It is designed to explore the value of this approach to disciplines and individuals as they simultaneously bear upon all human experience with| communication about| and understanding of illness| disease and healing.   
INTRO TO FILM THEORY,ARTH-107,/coursehistories/4156,This seminar surveys the ways in which public events have been studied| covering a range from singular occasions such as protests or memorials to regularly recurring fairs| conventions| historic reenactments| parades| etc. We will begin with examining ritual and seek to differentiate sacred and profane modes and experiences of display. Public events create and sustain a particularly volatile public sphere within which the confluence of politics and market are at once visible and veiled. Drawing on European| American| and postcolonial contexts| the course will place special emphasis on the interrelationship of public display and the state| covering a time span from the 18th century to the present.   
UNDERGRADUATE SEMINAR: Court Artist in Renaissance Italy 1430-1530,ARTH-301,/coursehistories/164,Topic varies.   
