NAME,ALIAS,PATH,DESCRIPTION
ENGINEERING PLANET EARTH,STSC-169,/coursehistories/5843,Course topics will vary; have included The Binding of Isaac| Responses to Catastrophies in Jewish History| and Concepts of Jewishness from Biblical Israel to the Modern State.   Though Judaism is rightly known as a culture that exalts the study of text| performance of rituals is no less important for adherents who seek to fulfill divine command| rabbinic obligation and/or communal expectation. Christian thinkers in medieval and early modern Europe identified Jewish "ceremonial law" as a component of sacred Scripture whose authority had expired| and they ridiculed Jews for practicing "carnal" rather than "spiritual" religion. This course has a two-fold focus: Drawing on the insights of anthropology and ritual theory| students will explore the cultural logic of a range of concrete practices undertaken by Israelites and Jews in different geographic locales| from biblical times through the present. Students will also examine the perception and portrayal of Jewish customs in Christian theological| political and proto-ethnographic writings from the 7th -16th centuries. Readings from primary sources will be in English translation.   
PRINCIPLES OF SUSTAINABILITY,ENVS-327,/coursehistories/5890,During the first year of Gujarati| major emphasis is placed on acquiring phonetics| grammatical patterns| and basic vocabulary. These goals are accomplished through guided drills and conversations accompanied by formal instruction on Gujarati grammar. From the outset| students are also taught the Gujarati writing system| which is used for all materials. By the end of the first year of instruction| student should be able to carry on coherent conversations on selected topics| read simple texts and compose short pieces in Gujarati.   
NATURE'S NATION:,STSC-279,/coursehistories/5965,Data summaries and descriptive statistics; introduction to a statistical computer package; Probability: distributions| expectation| variance| covariance| portfolios| central limit theorem; statistical inference of univariate data; Statistical inference for bivariate data: inference for intrinsically linear simple regression models. This course will have a business focus| but is not inappropriate for students in the college.   
AIR POLLUTION: SOURCES & EFFECTS IN URBAN ENVIRONMENTS,ENVS-411,/coursehistories/6027,
Environmental Humanities: Theory Method Practice,GRMN-543,/coursehistories/6397,
WATER WORLDS,GRMN-150,/coursehistories/6524,Web Design I is a course designed to introduce the student to web presentation| theory| techniques and current software applications. Instruction will include usability| graphic design| web terminology| appropriate file protocoling| information architecture planning| communication strategies and www identity design. Upon completion of this course| students will possess a working knowledge of how to organize and design full web page content for interactive online user interfacing or control-group presentation.   
