NAME,ALIAS,PATH,DESCRIPTION
Writing about the Material World,FOLK-009,/coursehistories/488,This is a critical writing seminar. It fulfills the writing requirement for all undergraduates. As a discipline-based writing seminar| the course introduces students to a topic within its discipline but throughout emphasizes the development of critical thinking| analytical| and writing skills. For current listings and descriptions| visit the Critical Writing Program's website at www.writing.upenn.edu/critical.   
AMERICAN FOLKLORE,FOLK-201,/coursehistories/489,This course will examine American expressive culture through an exploration of narrative; music; dance; drama; public events; material arts and architecture; religion; medicine; politics;foodways; ways of speaking; and customs surround and celebrating work| leisure| childhood| family| aging| individually and community. In other words| we will be studying the 99% of American life that often goes unnoticed by other college courses! Special topics featured in 2004; tattooing| piercing| branding and other forms of contemporary body arts; UFO abduction as belief and legend; women's home altars; and the African-based North American religion called "vodou.   
DREAMING THE ISLAND,FOLK-227,/coursehistories/490,This course focuses on the transnational ethnicity of Latino American memoir and literature from the Spanish Caribbean. The landscapes of the islands of Puerto Rico| Cuba| and the Dominican Republic act as tropes for situating history and identity for Caribe-Flo-American authors. The tropicality of the islands serve as a way of situating the present and the past in its contrast tothe urban-American sites of New York| Miami| and New Jersey. Authors explored in the course include among others| Esmeralda Santiago| Christina Garcia| Julia Alvarez and Junot D-Ebaz. Their writings show the bifurcated and flucating nature of Latino Amrican identity in relation to language| religion| and quotidian life. The textualization of an "imagined" history through metaphores of la isla / the island| illustrates the precarious| yet rich nature of "alternate" American narratives in ethnic literature. In assessing how these narratives of home identity and place add to urban American milieus we will point towards processes evident in the construction and experience of current global identities.   
FOLKLORE AND SEXUALITY,FOLK-270,/coursehistories/491,Sexuality is usually thought of as being biological or social| divided into categories of natural and unnatural. Often misssed are its creative and communicative aspects. Examining the constructed social elements of sexuality requires attention be paid to folklore in groups| between individuals and on the larger platform of popular technological media. The most interesting locations for exploration are those places where borderlands or margins| occur between genders| orientations and other cultural categories. A field-based paper will be required that must include documentary research.   
URBAN LEGENDS & SOCIETY,FOLK-290,/coursehistories/492,Focused study of expressive culture in a particular cultural setting. Topics vary each semester and the course may be repeated for credit.   
ISSUES FOLKLORE THEORY,FOLK-503,/coursehistories/493,"Fieldwork" is the term folklorists and scholars in related fields use to describe the process by which they arrive at their discipline's subject matter. This includes everything from the pragmatic issues of collecting and documenting materials to the complex relations involved whken people study people. Readings| short writing assignments| and class discussions will probe this spectrum of concerns comprehensively. Brief exercises are planned to experience different aspects of fieldwork. On this background of theory and practice| students will work toward designing a fieldwork based project and draft a funding proposal.   
RITUAL PROCESS & PERFORM,FOLK-518,/coursehistories/494,This course explores the form and development of America's built landscape -- its houses| farm buildings| churches| factories| and fields -- as a source of information on folk history| vernacular culture| and architectural practice.   
FOLK/UNORTHODOX HEALTH,FOLK-533,/coursehistories/495,Examination of theories concerning the origin and function of folk beliefs| investigation of the expression of folk beliefs in legend| folk art| custom and ritual. Ritual is the focal genre for explanatory purposes| and introduction to the social symbolic approach to analysis and interpretation is primary for exploration and application.   
ACDM WRTG/RSRCH DESIGN,FOLK-541,/coursehistories/496,Have you ever noticed that scholars in different academic disciplines seem to speak different languages? Have you wondered how scholars put together a plan for their research| explain their findings| and organize and write their papers? This class is designed to introduce MLA students and other advanced students to the research and writing conventions used by scholars in the arts and sciences. With attention to disciplines in the humanities| social sciences| and sciences| we will identify and explore some of the theories| sources| language| and qualitative and quantitative methodologies that scholars use as they conduct original research in their fields. Throughout the class| we'll also discuss writing conventions across the arts and sciences| with special attention to the structure of argument; the use of evidence; voice and style in both traditional academic writing and more innovative forms of writing; and documentation conventions. Students will develop an original research project through incremental writing assignments| and will write a formal research proposal (15-20 pages)| which can be used as their Capstone proposal if they wish.   
MOD JEWISH LIT IN TRANS: Literary Pluralism-Immigrants Women Arabs & Others,AMES-154,/coursehistories/61,Topic varies semester to semeester. Past topics have included: Film and Literature: Childhood in Times of Peace and War; War and Love: Heroism and Anti-Heroism in Israeli Writings; Jewish Film and Literature: Childhood Memory; Fantasy| Dreams & Madness in Hebrew Literature: Escape or Solution; Voices (of Others) of Israel. Fall 2004: Jewish Film & Literature: History and Memory.   
MASCUL IN NARR & PERFORM,ANTH-544,/coursehistories/143,Students will learn how to write| shoot edit and upload documentary films over the length of this two semester course. In the first part| students complete a series of hands-on formal training in filmcraft while they simultaneously identify a research subject that they will propose to depict in a documentary film. In the second part of the course students will produce the faculty-approved documentary themselves. The film's final cut must be screened by the end of the second semester. Students should expect to work on their projects outside class time. The school will provide basic filmmaking equipment- video cameras and computers for editing in labs. Students are responsible for all storage (computer drives)| tapes| dvds| and project relatedcosts.   
SCI MAGIC & RELIGION,HSSC-025,/coursehistories/625,Throughout human history| the relationships of science and religion| as well as of science and magic| have been complex and often surprising. This course will cover topics ranging from the links between magic and science in the seventeenth century to contemporary anti-science movements.   
COMPARATIVE MEDICINE,HSSC-145,/coursehistories/629,This course focuses on health and healing in the colonial and post-colonial world. We give special attention to local healing under condition of domination| to definitions of the body and the person in biomedicine and in non-European healing traditions| and to the political and cultural place of medicine in regions which have experienced colonial rule.   
WORLD MUSICS & CULTURES,MUSC-022,/coursehistories/784,Draws on repertories of various societies from Asia| Africa| Europe| and the Americas to examine relations between aesthetic productions and social processes. We investigate musical sounds| cultural logics informing those sounds| and social strategies of performance. Topics may include indigenous music theories| music and social organization| symbolic expressions and musical meaning| gender| religion| and social change.   
JAZZ:STYLE & HISTORY,MUSC-075,/coursehistories/789,Music 075 401 (Dr. Ramsey): Exploration of the family of musical idioms called jazz. Attention will be given to issues of style| to selected musicians| and to the social| cultural| and scholarly issues raised by its study. Music 075 601 (Professor Parberry): Development of jazz from the beginning of the 20th Century to present. Analysis of the stylistic flux of jazz| such as the progression from dance music to bebop and the emergence of the avant-garde and jazz rock. Attention will be given to both the artists who generated the changes and the cultural conditions that often provided the impetus.   
WOMEN AND RELIGION,RELS-005,/coursehistories/972,This course will look at issues of gender in Hinduism| Islam| and Christianity. By using historical| psychoanalytical and anthropological tools| we will explore the various ways in which religion shapes gender roles and vice-versa. Aspects considered will include the representation of the divine| the role of women in religious institutions| and rules regarding the human body| marriage and sexuality. We will also take into consideration contemporary women's self-representation in religious literature| art| and film.   
RELIGIOUS DIVERSITY/AM: BUDDHISM IN AMERICA,RELS-310,/coursehistories/984,In the l950's America seemed to be a land of Protestant| Catholic| and Jew. Now it is clearly also a land of Muslims and Hindus| Buddhists and Taoists| Rastafarians and Neo-pagans and many more religious groups. This course will focus upon a variety of topics: religious diversity in West Philadelphia| Philadelphia and beyond; the politics of religious diversity; religion in American schools and cities; and conflicts and cooperation among diverse religious groups.   
RELIGION IN AMER HIST II,RELS-517,/coursehistories/987,From Marvin Gaye| to Tammy Faye Baker| to Sarah Palin and James Baldwin| Pentecostalism has influenced many| including politicians| preachers| writers| and the media. One of the fastest growing religious movements in the world| Pentecostalism continues to have a profound effect on the religious landscape. Pentecostalism's unique blend of charismatic worship| religious practices| and flamboyant| media-savvy leadership| has drawn millions into this understudies and often controversial religious movement. This course will chronicle the inception and growth of Pentecostalism in the United States| giving particular attention to beliefs| practices| gender| ethnicity| and Global Pentecostalism.   
INTRODUCTION TO FOLKLORE,FOLK-101,/coursehistories/1305,Problem-oriented approach to application of quantitative methods in anthropological research. Emphasis on formulation of specific problems using real data sets by each student in his or her area of interest. The logic of problem solving using quantitative arguments| the investigation of data reliability and representativeness| and the use of statistical arguments in the presentation of results covered in detail. Use of digital computers as research tools will be an integral part of the presentation.   
BALLADS AND FOLK POETRY: FOLKSONGS AND BALLADS,FOLK-228,/coursehistories/1306,Seminar on a rapidly developing| interdisciplinary field. Application of inorganic and organic chemical techniques for dating and characterizing ancient material remains| and assessing their technological and cultural significance. Middle-range theory--the methodology and limitations of integrating natural scientific data with archaeological hypothesis and reconstruction--is stressed. Topics include geophysical/chemical prospecting of sites| radiocarbon dating and calibration| ceramic provenancing and trade| organic contents analysis of vessels| isotopic dietary studies| and paleogenetics.   
FOLKLORE NATIONALISM,FOLK-320,/coursehistories/1307,African culture history| as inferred from archaeology| linguistic relationships and ethnology. Culture areas of Africa and representative societies; common themes and differences; significance for anthropological concerns.   
URBAN FOLKLORE,FOLK-436,/coursehistories/1308,Method and theory in biocultural anthropology applied to current issues in human health| including nutrition| growth| and reproduction. Emphasis on structure and analysis of data.   
SEMINAR: IRELAND & UK,FOLK-547,/coursehistories/1309,Selected research topics in New World archaeology| using the resources of the University Museum.   
DOCUMENTARY VIDEO,FNAR-063,/coursehistories/446,A digital video course stressing concept development and the exploration of contemporary aesthetics of the digital realm| specifically in relation to the documentary form. Building on camera| sound and editing skills acquired in Film/Video I and II| students will produce a portfolio of short videos and one longer project over the course of the semester. Set assignments continue to investigate the formal qualities of image-making| the grammar of the moving image and advanced sound production issues within the documentary context.   
WORLD MUSICS & CULTURES,MUSC-050,/coursehistories/1412,This course will explain in non-mathematical terms how essentially all biological properties are determined by the microscopic chemical properties of proteins. It will also explain how research results| especially those of structural biology| are presented to its various audiences.   
MUSIC OF LATIN AMERICA,MUSC-158,/coursehistories/1415,A general laboratory course covering aspects of qualitative and quantitative analysis| determination of chemical and physical properties| and chemical synthesis. This 0.5 c.u. lab course is an alternative to CHEM 053| but is only open to freshman students who are also enrolled in the special freshman section of CHEM 101 - Section 004.   
SCIENCE MAGIC RELIGION,RELS-116,/coursehistories/1479,
AMERICAN POPULAR CULTURE,SOCI-229,/coursehistories/1512,The course deals with the topics of Fourier series| Fourier transforms| Laplace transform| time and frequency response| ideal low-pass filters| band-pass channels| analog communications| amplitude modulation| angle modulation| frequency-division multiplexing| digital communications| pulse-code modulation| time-division multiplexing| random processes| stationarity| autocorrelation functions| spectral density| Gaussian processes| noise in analog and digital modulation schemes.   
AMERICAN POPULAR CULTURE,FOLK-231,/coursehistories/1557,This course will look at the screenplay as both a literary text and a blue print for production. Several classic screenplay texts will be critically analyzed (REBEL WITHOUT A CAUSE| DOCTOR STRANGELOVE| PSYCHO| etc.) Students will then embark on writing their own scripts. We will intensively focus on: character enhancement| creating "believable" cinematic dialogue| plot development and story structure| conflict| pacing| dramatic foreshadowing| the element of surprise| text and subtext and visual story-telling. Class attendance is mandatory. Students will submit their works-in-progress to the workshop for discussion.   See English Department's website at www.english.upenn.edu for a description of the current offerings.   
MLA Proseminar: Ethnography & Memory,HIST-585,/coursehistories/1561,Writing with a view to publication in the freelance sections of newspapers such as THE PHILADELPHIA INQUIRER and THE NEW YORK TIMES| in magazines such as THE ATLANTIC and THE NEW YORKER| and in the literary quarterlies and the journals of opinion. Among the areas likely to be considered are writing as a public act| issues of taste and of privacy| questions of ethics and of policy| methods of research and of checking| excerpting| marketing| and the realistic understanding of assignments and of the publishing world. Student papers will be the basis of weekly editorial sessions| with concentration on the language: how to render material literate| how to recognize and dispose of padding and self-indulgence| how to tighten structure and amplify substance.   See the English Department's website at www.english.upenn.edu for a description of the current offerings.   
AFRICAN  FOLKLORE: Tradition and Modernity,FOLK-233,/coursehistories/1841,The course is designed to teach students how to think as an economist about legal rules; to evaluate alternative legal rules against standards of economic efficiency and distributive justice; and to understand the nature of the legal process and several specific areas of the law. With the use of alternative texts| both deductive and inductive reasoning will be employed to study the formation and interpretation of legal rules.   
GREAT STORY COLLECTIONS,FOLK-241,/coursehistories/1842,This course provides an introduction to environmental management with a focus on law and policy as a basic framework. The primary aim of the course is to give students a deeper practical sense of the important relationship between business and the natural environment and to think critically about how best to manage this relationship.   
FOLK & ALTERNATIVE MEDS,FOLK-369,/coursehistories/1843,This course explores important issues in conducting business internationally in and with emerging economies. Much of the course attempts to define emerging economies and to understand the changes occurring in these countries. The course also examines the position of emerging economies in the global context| and how broad social issues affect the development of emerging economies and the ability to establish relationships or conduct business in emerging economies.   
PROSEMINAR IN FOLKLORE,FOLK-500,/coursehistories/1844,The goal of this course is to study the role the law has played| and continues to play| in addressing the problems of racial discrimination in the United States. Contemporary issues such as racial profiling| affirmative action| and diversity will all be covered in their social and legal context. The basis for discussion will be assigned texts| articles| editorials and cases. In addition| interactive videos will also be used to aid class discussion. Course requirements will include a term paper and class presentations.   
FIELDWORK THEORY,FOLK-502,/coursehistories/1845,This course is a multidisciplinary| interactive study of business ethics within a global economy. A central aim of the course is to enable students to develop a framework to address ethical challenges as they arise within and across different countries. Alternative theories about acting ethically in global environments are presented| and critical current issues are introduced and analyzed. Examples include bribery| global sourcing| environmental sustainability| social reports| intellectual property| e-commerce| and dealing with conflicting standards and values across cultures. As part of this study| the course considers non-Western ethical traditions and practices as they relate to business.   
From Colonization to Tourism,FOLK-507,/coursehistories/1846,The course explores the fundamentals of U.S. constitutional doctrine and adjudication| with an emphasis on commercial and business issues and implications of constitutional law. The course starts by considering the Constitution and the structure and relationship of the governmental entities it establishes and upon which it depends. Special attention is given to the role of the federal courts| especially the Supreme Court| in interpreting and applying constitutional principles. From this foundation| the course moves on to examine in detail the major economic and business implications of constitutional law in different eras of the nation's history. A core theme is how historical events and changing notions of public policy have affected and been affected by the evolution of constitutional doctrine.   
PROVERB RIDDLE & SPEECH,FOLK-532,/coursehistories/1847,A general introduction to the nature| history and use of human language| speech and writing. Topics include the biological basis of human language| and analogous systems in other creatures; relations to cognition| communication| and social organization; sounds| forms and meanings in the world s languages; the reconstruction of linguistic history and the family tree of languages; dialect variation and language standardization; language and gender; language learning by children and adults; the neurology of language and language disorders; the nature and history of writing systems. Intended for any undergraduate interested in language or its use| this course is also recommended as an introduction for students who plan to major in linguistics.   
JEWISH FOLKLORE,AMES-243,/coursehistories/1615,Students will make work that draws from and interacts with the three-dimensional world we live in. Formal strategies will explore principles of organization. Planar construction| modeling and assemblage methods will be used for investigations spanning from bas-relief to environmental art. This is a "learn by doing" process with no prerequisites.   
JAPANESE THEATER,AMES-485,/coursehistories/1626,The purpose of this beginning level ceramics class is to learn the skills needed to use the potter's wheel as a tool for object making. Traditional ceramic techniques such as centering the clay| pulling walls and trimming pots will be a focus. A variety of glazing and slip decoration methods will be covered. Slide discussions| field trips and readings will supplement the studio work. $80 Studio fee.   
MONEY IN SOC & CULTURE,ANTH-120,/coursehistories/1634,This intermediate photography course will expand on traditional black and whit techniques by using various types of films| fiber printing papers and advanced darkroom procedures. The basics of the Zone System| advanced metering| studio lighting and 4x5 view camera will be introduced as well as medium format Hasselblad camera systems. A wide array of traditional (and non) photographic techniques will be covered to provide a "toolbox" of processes that will expand the students' vocabulary as image-makers. Emphasis will be on exploring and mastering these different approaches as we begin to identify how these different processes - and how they look - can contribute to meaning in a work of art. Throughout the course students will be guided toward the creation of work that is both technically and conceptually realized. Correlations between digital and analog photographic practices are also incorporated into this course| providing an introduction into the possibilities of hybrid platforms. Th examination of both historic and comtemporary photographs will supplement this research. The finalproject will be a developed portfolio of prints based on oneidea or theme. Labfee: $50.00.   
PSYCHOLOGY AND CULTURE,ANTH-521,/coursehistories/1658,With folksongs and ballads| ordinary people in every era have turned language into poetry and their own voices into music. Our folksong and ballad traditions contain some of the great poetic| narrative and music artistry ever created. As stories told in song| ballads tell takes of tender love and brutal murder| of painful partings and joyous reunions| of outlawed men and warrier women| of mighty nobles and downtrodden commons. Lyric songs express humanity's basic emotions: love and hate| fear and desire joy and sorrow. This course will exame folksongs and ballards in all their forms| concentratingon English-language materials but making excurions into other traditions as well. We will explore the themes and meaning of different kinds of songs| from the classic medieval ballads to the journalistic fare of the nineteenth century| from homey songs of place to frightening tales of terror. We will explore different regional and ethnic traditions| including British and Irish songs| Appalachian ballads and African-American blues| Western Cowboy songs and Mexican-American outlaw ballards. We will detail how folksong traditions in American played a crucial role in the development of popular music| inquire into the history of individul songs| and ask how folk songs vary from singer to singer and from country to country.   
ETHNOGRAPHY OF BELIEF,RELS-507,/coursehistories/2109,This survey course will deal with the roots and evolution of the international political economy from the end of World War II and the launching of the Bretton Woods system to the Asia crisis of 1997 and its spread to Russia and parts of Latin America. It will focus on the interplay between politics and economics for topics such as management of the international financial system via the IMF| World Bank| World Trade Organization| globalization| trade| multinational corporations and changes in world production patterns| the integration of Europe| development strategies| debt crises| and attempts at political and economic liberalization in countries as diverse as China| Mexico| Indonesia| and South Africa.   
RITUAL IN AM LIFE,WSTD-082,/coursehistories/2184,The highlights of Indian literature| the literary connections between India andthe West| and some basic questions of comparative literature. Readings consist of translated materials (SARS 203)| original sources (SARS 503)| and secondary literature in English.   
