NAME,ALIAS,PATH,DESCRIPTION
WRITING ABOUT GENDER,WSTD-110,/coursehistories/1541,This course traces the development of the novel across the twentieth-century. The course will consider the formal innovations of the modern novel (challenges to realism| stream of consciousness| fragmentation| etc.) in relation to major historical shifts in the period. Authors treated might include: Conrad| Lawrence| Joyce| Forster| Woolf| Cather| Faulkner| Hemingway| Achebe| Greene| Rhys| Baldwin| Naipaul| Pynchon| Rushdie| and Morrison.   See the English Department's website at www.english.upenn.edu for a description of the current offerings.   
CULTURE COM. & BODY,FOLK-420,/coursehistories/2286,Principles and engineering applications of statistical inference. The basic topics covered are parameter estimation| confidence intervals| and hypothesis testing. Additional topics may include analysis of variance (ANOVA) and/or linear regression. Each method is treated both from theoretical and applied viewpoints| including software analysis of selected data sets.   
FOLK RELIGION,FOLK-523,/coursehistories/2287,The course provides an introduction to optimization problems vis.| the mathematical models| their formulation| analysis and computational tools for their solutions. The course covers major mathematical models of optimization problems - linear programming| netowrk analysis and integer programming. Formulation issues and basic solution methodologies are covered in a fairly rigorous fasion for these classes of optimizaiton problems. Examples are selected from a broad range of engineering and business problems.   
PROSE NARRATIVE,FOLK-531,/coursehistories/2288,Basic methods for analysis and design of feedback control in systems. Applications to practical systems. Methods presented include time response analysis| frequency response analysis| root locus| Nyquist and Bode plots| and the state-space approach.   
ETHNOGRAPHIC WRITING: LITERATURE OF ETHNOGRAPH,FOLK-543,/coursehistories/2289,Development of transportation and its impact on society and the economy. Geometric characteristics of vehicles. Theory of traction and vehicle dynamic performance. Travel time computations. Transportation networks. Street design and traffic engineering. Railroad technology and operations. High-speed railroads. Air transportation system components and operations. Air traffic control and navigation. Transportation system performance and scheduling. Field trip to major transportation facilities.   
CARNIVALPAGEANTPARADE,FOLK-546,/coursehistories/2290,This course is designed to integrate the fundamentals of systems design using the capabilities of modern computer aided design tools. The course focus is on the use of the computer in systems design for both civil engineering systems and systems science and engineering students. The course is project oriented| entails considerable use of the computer| and centers on 2d and 3d graphics| and on the solution of optimization problems.   
FLD METH IN ETHNO,MUSC-250,/coursehistories/2349,The Greeks enjoy a special place in the construction of western culture and identity| and yet many of us have only the vaguest notion of what their culture was like. A few Greek myths at bedtime when we are kids| maybe a Greek tragedy like Sophokles' Oidipous when we are at school: these are often the only contact we have with the world of the ancient Mediterranean. The story of the Greeks| however| deserves a wider audience| because so much of what we esteem in our own culture derives from them: democracy| epic poetry| lyric poetry| tragedy| history writing| philosophy| aesthetic taste| all of these and many other features of cultural life enter the West from Greece. The oracle of Apollo at Delphi had inscribed over the temple| "Know Thyself." For us| that also means knowing the Greeks. We will cover the period from the Late Bronze Age| c. 1500 BC| down to the time of Philip of Macedon| c. 350 BC| concentrating on the two hundred year interval from 600-400 BC.   
MUSIC & PERF OF AFRICA,MUSC-253,/coursehistories/2350,An introduction to the study of culture and human institutions| how they change| and their role in both literate and nonliterate societies.   
WRITING:INDIAN AM EXP,SARS-009,/coursehistories/2414,After a rapid review of the basic techniques for solving equations| the course will discuss one or more of the following topics: stability of linear and nonlinear systems| boundary value problems and orthogonal functions| numerical techniques| Laplace transform methods.   
SOC. OF MEDIA & POP CULT,SOCI-137,/coursehistories/1050,This course relies on a variety of sociological perspectives to examine the role of the media and popular culture in society| with a particular emphasis on the power of the entertainment industries| the relationship between cultural consumption and status| and the social organization of leisure activities from sports to shopping. Specific course topics include the globalization of branding and popular culture| the rise of aesthetics and style in everyday life| the importance of social networks in the diffusion of fads| fashions| and mass media; and the social effects of new media technologies in the digital age.   
PERFORMING HISTORY,HIST-093,/coursehistories/2591,This is a critical writing seminar. It fulfills the writing requirement for all undergraduates. As a discipline-based writing seminar| the course introduces students to a topic within its discipline but throughout emphasizes the development of critical thinking| analytical| and writing skills. For current listings and descriptions| visit the Critical Writing Program's website at www.writing.upenn.edu/critical.   
THEMES JEWISH TRADITION: REWRITING THE BIBLE,RELS-129,/coursehistories/2669,Second semester of a year-long project.   
AFRO-AMERICAN FOLKLORE,FOLK-203,/coursehistories/2822,Economic history of India 1500-1947. A survey of the economic interactions of the Indian subcontinent with the rest of Asia and Europe from 1500 to 1800| and an analysis of the effects of subsequent British rule prior to independence.   
NATL & FOLK WORLD CHANGE,FOLK-407,/coursehistories/2823,A study of the government sectors' taxation and spending activities| focusing on their impact upon resource allocation| income distribution| and efficiency in the economy.   
FESTIVE DRAMA,FOLK-545,/coursehistories/2824,The course begins with an extensive discussion of models of labor market demand and supply. The rest of the course addresses a variety of related topics including the schoool-to-work transition| job training| employee benefits| the role of labor unions| discrimination| workforce diversity| poverty| and public policy.   
POLITICS OF CULT IN ASIA,ANTH-320,/coursehistories/2728,Basic concepts and principles of chemistry and their applications in chemistry and closely-related fields. The first term emphasizes the understanding of chemical reactions through atomic and molecular structure. This is a university level course| treating the material in sufficient depth so that students can solve chemical problems and can understand the principles involved in their solution. It includes an introduction to condensed matter. This course is suitable for majors or non-majors and is recommended to satisfy either major or preprofessional requirements for general chemistry. This course is presented for students with high school chemistry and calculus. Students with a lesser background than this should take Chemistry 100.   
CARIBBEAN MUS & DIASPORA,MUSC-258,/coursehistories/2879,What dialogues have defined and constituted American and other literatures? This course examines critical intersections between different literatures| addressing questions of race| ethnicity| and culture. Previous versions of this course have included such titles as "African-American and Jewish-American Literature." Our readings will consider a range of literary interactions| and will take a self-consciously comparative and intertextual approach.   See the English Department's website at www.english.upenn.edu for a description of the current offerings.   
FOLK/UNORTHDOX HEALTH SY,RELS-505,/coursehistories/2912,Topics in Contemporary American Literature| an example of which has been "The Literary History of The Cold War| 1947-1957". Other very recent topics and authors may be themes of this course.   
FOLK ART,FOLK-358,/coursehistories/3093,
FOODWAYS,FOLK-444,/coursehistories/3094,
JEWISH HUMOR,NELC-254,/coursehistories/3183,The main purpose of this course is to teach students to read Old English ("Anglo-Saxon")| chiefly but not exclusively for research in linguistics. Grammar will be heavily emphasized; there will also be lectures on the immediate prehistory of the language| since the morphology of Old English was made unusually complex by interacting sound changes. In the first eight weeks we will work through Moore and Knott's "Elements of Grammar" and learn the grammar; the remainder of the term will be devoted to reading texts.   
RUSSIANS & FAIRY TALES: Psychology and Sociology in Fairy Tales,FOLK-306,/coursehistories/3386,A discussion of those concepts and techniques of classical analysis employed inphysical theories. Topics include complex analysis. Fourier series and transforms| ordinary and partial equations| Hilbert spaces| among others.   
MATERIAL LIFE IN AMER,HIST-323,/coursehistories/3406,This course is designed to stimulate an interest in the philosophy and methods of terrorism; to illustrate the varieties of conditions under which methods of terrorism are used; to outline the institutional conditions which permit and support the use of terrorism; and to understand the problems involved in "solving" the terrorism dilemma.   
JEWISH FOLKLORE,NELC-258,/coursehistories/3467,This course studies the emergence of organized terrorism in nineteenth century Russia. It examines the philosophy of the terrorist struggle through its methods| causes| various codes| and manifestoes that defined its nature for the times to come. We critique intellectual movements such as nihilism| anarchism| and populism that inspired terrorism defining the political violence and disorder as beneficial acts. The issue of policing terrorism becomes central when we study a police experiment to infiltrate| delegitimize and ultimately neutralize the terrorist networks in late imperial Russia.   The discussions draw on the ideology and political efficacy of the conspiratorial mode of operation| terrorist tactics such as assassination and hostage-taking| the cell structure of the groups and underground incognito of the strikers| their maniacal self-denial| revoluntionary asceticism| underground mentality| faceless omnipotence| and other attributes-intensifiers of its mystique. We analyze the technology and phenomenology of terror that generate symmetrical disorganizing threats to any organized form of government and reveal the terrorist act as a sublime end as well as a lever for achieving practical causes. Our study traces the rapid proliferation of terrorism in the twentieth century and its impact on the public life in Western Europe| the Balkans| and America.   
Bread and Roses: Artistic Expression and Community Activism,FOLK-580,/coursehistories/3552,Topics vary. See the Romance Languages Department's website at http://ccat.sas.upenn.edu/roml for a description of the current offerings.   
FOLK RELIGION,FOLK-223,/coursehistories/3642,The objective of this course is to discuss and understand the accounting that underlies merger| acquisition| and investment activities among firms that result in complex financial structures. Key topics include the purchase accounting method for acquisitions| the equity method for investments| the preparation and interpretation of consolidated financial statements| tax implications of mergers and acquisitions| earnings-per-share considerations| the accounting implications of intercompany transactions and non-domestic investments| etc.   
EXPLRNG LOCAL MEM & TRAD,FOLK-321,/coursehistories/3643,
FOLKORE AND FEMINISM,FOLK-576,/coursehistories/3644,
RELIG ANCIENT NEAR EAST: Religion in Culture--Culture in Religion: History of Religion in the ANE,AMES-248,/coursehistories/1174,
NATIVE AMERICAN FOLKLORE,FOLK-360,/coursehistories/3742,The Greeks enjoy a special place in the construction of western culture and identity| and yet many of us have only the vaguest notion of what their culture was like. A few Greek myths at bedtime when we are kids| maybe a Greek tragedy like Sophokles' Oidipous when we are at school: these are often the only contact we have with the world of the ancient Mediterranean. The story of the Greeks| however| deserves a wider audience| because so much of what we esteem in our own culture derives from them: democracy| epic poetry| lyric poetry| tragedy| history writing| philosophy| aesthetic taste| all of these and many other features of cultural life enter the West from Greece. The oracle of Apollo at Delphi had inscribed over the temple| "Know Thyself." For us| that also means knowing the Greeks. We will cover the period from the Late Bronze Age| c. 1500 BC| down to the time of Philip of Macedon| c. 350 BC| concentrating on the two hundred year interval from 600-400 BC.   
STUD IN AFRICAN-AM MUSIC,MUSC-146,/coursehistories/3769,Ethnohistory is a multi-disciplinary form of ethnographic study and documentary research that employs both anthropological and historical approaches. This course examines the foundations of the ethnohistorical method as a means to interpret cross-cultural colonial interactions and conflicts| and to better understand the complex histories of Native American Indian peoples from Pennsylvania and northward and eastward. Students will develop skills and strategies for interpreting and contextualizing primary and secondary source materials| oral traditions| colonial records| historical maps| and material culture. Hands-on study will include visits to local archives and historical sites to view relevant documents and landscapes.   
LECTURE: lecture,CLST-200,/coursehistories/277,Myths are traditional stories that have endured many years. Some of them have to do with events of great importance| such as the founding of a nation. Others tell the stories of great heroes and heroines and their exploits and courage over adversity. Still others are simple tales about otherwise unremarkable people who get into trouble or do some great deed. What are we to make of all these tales| and why do people seem to like to hear them? This course will focus on the myths of ancient Greece and Rome| as well as a contemporary American ones| as a way of exploring the nature of myth and the function it plays for individuals| societies| and nations. We will also pay some attention to the way the Greeks and Romans themselves understood their ownmyths. Are myths subtle codes that contain some universal truth? Are they a window on the deep recesses of a particular culture? Are they entertaining stories that people like to tell over and over? Are they a set of blinders that all of us wear| though we do not realize it? Investigate these questions a variety of topics creation of the universe between gods and mortals| religion and family| sex|love| madness| and death.   
ENVRMENTAL IMAGINARIES,FOLK-575,/coursehistories/3879,Continuation of CHEM 053.   
Public Arts Liberal Arts: Applied Ethnography and Community,FOLK-579,/coursehistories/3880,Basic concepts and principles of chemistry and their applications in chemistry and closely-related fields. The first term emphasizes the understanding of chemical reactions through atomic and molecular structure. This is a university level course| treating the material in sufficient depth so that students can solve chemical problems and can understand the principles involved in their solution. It includes an introduction to condensed matter. This course is suitable for majors or non-majors and is recommended to satisfy either major or preprofessional requirements for general chemistry. This course is presented for students with high school chemistry and calculus. Students with a lesser background than this should take Chemistry 100.   
COMPARATIVE MEDICINE,STSC-145,/coursehistories/3979,Theories of various industrial organizational structures and problems are developed| including monopoly| oligopoly| moral hazard and adverse selection. These theories are then applied to the study of various industries| antitrust cases| and regulatory issues.   
MYTH IN SOCIETY,FOLK-229,/coursehistories/4040,English is a global language with a distinctly imperial history| and this course serves as an essential introduction to literary works produced in or about the former European colonies. The focus will be poetry| film| fiction and non fiction and at least two geographic areas spanning the Americas| South Asia| the Caribbean and Africa as they reflect the impact of colonial rule on the cultural representations of identity| nationalism| race| class and gender.   See the English Department's website at www.english.upenn.edu for a description of the current offerings.   
JAPANESE THEATER: Geisha and Samurai On Stage,EALC-255,/coursehistories/4025,This course will introduce students to key works of English literature written before 1660. It will explore the major literary genres of this period| as well as the social and cultural contexts in which they were produced. The course will examine how literature texts articulate changes in language and form| as well as in concepts of family| nation| and community during the medieval and early modern periods.   See the English Department's website at www.english.upenn.edu for a description of the current offerings.   
SCI MAGIC & RELIGION,STSC-028,/coursehistories/3974,The course begins with a survey of basic descriptive statistics and data sources and then covers elementary probability theory| sampling| estimation| hypothesis testing| correlation| and regression. The course focuses not on mathematical proofs of theorems| but rather on practical issues involved in the substantive interpretation of economic data using the techniques of statistical inference. For this reason| empirical case studies that apply the techniques to real-life data are stressed and discussed throughout the course| and students are required to perform several statistical analyses of their own. May not be taken for credit by students who have taken either one or two semesters of Statistics or by any student who has already completed statistics at least at the level of Stat 101 (including the sequence Stat 111/112). (Students with a one semester AP Statistics credit for Stat 101 or higher can drop the credit to take Econ 5 via a release form available from the department). Students who have one semester of statistics take the second course in statistics or Econ 6 (or Econ 5| if Stat 111 was taken) to satisfy the statistics requirement of the major.   
NARRAT ACROSS CULTURES,COML-125,/coursehistories/289,The purpose of this course is to present a variety of narrative genres and to discuss and illustrate the modes whereby they can be analyzed. We will be looking at shorter types of narrative: short stories| novellas| and fables| and also some extracts from longer works such as autobiographies. While some works will come from the Anglo-American tradition| a larger number will be selected from European and non-Western cultural traditions and from earlier time-periods. The course will thus offer ample opportunity for the exploration of the translation of cultural values in a comparative perspective.   
FEMINIST FAIRY TALES,ENGL-290,/coursehistories/423,The advanced women's studies course in the department| focusing on a particularaspect of literature by and about women. Topics might include: "Victorian Literary Women"; "Women| Politics| and Literature"; "Feminist Literary Theory";and similar foci.   See the English Department's website at www.english.upenn.edu for a description of the current offerings.   
STDS MEDIEVAL JEWISH LIT: PASSOVER HAGGADA,HEBR-258,/coursehistories/4279,
HISTORY OF ANTHROPOLOGY,HSSC-585,/coursehistories/4290,This course will explore the emergence of modern evolutionary biology| the ways it has reflected our concepts of life and nature| and the human and social implications of biological theories and ideas. We will focus on some ofthe central historical figures that have shaped our udnerstanding-Linnaeus| Lamarck| Darwin| Mendel| Galton--and the implications of their ideas for who we are| where we come from| and where we are going.   
ACDM WRTG/RSRCH DESIGN,MLA-541,/coursehistories/4350,An introduction to phonetics and phonology. Topics include articulatory phonetics (the anatomy of the vocal tract; how speech sounds are produced); transcription (conventions for representing the sounds of the world's languages); classification (how speech sounds are classified and represented cognitively through distinctive features); phonology (the grammar of speech sounds in various languages: their patterning and interaction) and syllable structure and its role in phonology.   
ACCORDIONS OF NEW WORLD,MUSC-157,/coursehistories/4360,Multivariate analysis of data gathered in continuing research in the speech community; variable rule analysis and use of Cedergren/Sankoff program; instrumental analysis of speech signal; experimental techniques for study of subjective correlates of linguistic boundaries.   
Once Upon A Fairy Tale: Introduction to Russian Culture,RUSS-100,/coursehistories/4407,The focus of this course is on analysis of the issues and options which must be faced in developing a successful technological venture and on the creation of a winning business plan. Particular attention is directed to the identi- fication of technology-based venture opportunities| evaluation of technical feasibility and commercial potential| and planning for successful commerciali- zation.   
CHILDREN'S FOLKLORE,FOLK-535,/coursehistories/4481,Advanced Health Communication: I provides foundation training in academic skills and in those linguistic features of English which are relevant to those skills. The course focuses on reading strategies| academic writing conventions| discussion skills| and critical thinking. In addition to these academic skills| the participants work on general English pronunciation| accurate grammar| and vocabulary.   This course satisfies the Arts & Letters Sector for Nursing Class of 2012 and Beyond.   
INTRO TO FOLKLORE,NELC-181,/coursehistories/4627,
FOLKLORE AND LITERATURE: AMERICAN FOLK LITERATURE,ENGL-099,/coursehistories/4804,Urban Studies offers various seminars as URBS-100. These courses explore current urban issues.   
EARLY JEWISH MAGIC,RELS-229,/coursehistories/4840,
FAIRY TALES,FOLK-240,/coursehistories/4865,Further development of reading| writing| and speaking skills in modern Hebrew. The course is designed for students who have completed the basic language courses and passed the proficiency examination (or passed the Department's placement test at the appropriate level). The readings are based on literary texts and poetry. Special attention is given to the recurrence of biblical themes in modern Hebrew writing.   
GAME PLAY,FOLK-536,/coursehistories/5285,This course examines concepts of electromagnetism| vector analysis| electrostatic fields| Coulomb's Law| Gauss's Law| magnetostatic fields| Biot-Savart Law| Ampere's Law| electromagnetic induction| Faraday's Law| transformers| Maxwell equations and time-varying fields| wave equations| wave propagation| dipole antenna| polarization| energy flow| and applications.   
FOLKLORE & SUPERNATURAL,FOLK-406,/coursehistories/5325,Students will continue to develop the technical skills involved in the wheel throwing process. Using the wheel as a tool to make sculptural as well as functional objects will also be explored. Focus will be placed on students' creative and technical development. $80 Studio Fee.   
NARRATIVE ANALYSIS,LING-470,/coursehistories/3668,Development of the skills of reading| writing| and conversing in modern Hebrew on an intermediate level. Open to all students who have completed two semesters of Hebrew at Penn with a grade of B- or above and new students with equivalent competency.   
URBAN ETHNOGRAPHY,URBS-213,/coursehistories/5481,When knowledge leads to power| how is society as a whole affected? Case studies of the role of science in comtemporary decision making in public and business affairs.   
ACCORDIONS OF THE NEW WORLD,MUSC-255,/coursehistories/6062,Continuation of the Introduction of Japanese - Non-intensive.   
THEMES JEWISH TRADITION: THE BINDING OF ISAAC,NELC-252,/coursehistories/4090,This course will expose students to the principles that underlie our understanding of how the Earth works. The goal of Earth Systems Science is to obtain a scientific understanding of the entire Earth system by describing its component parts (lithosphere| hydrosphere| atmosphere| biosphere) and their interactions| and describe how they have evolved| how they function| and how they may be expected to respond to human activity. The challenge to Earth Systems Science is to develop the capability to predict those changes that will occur in the next decade to century| both naturally and in response to human activity. Energy| both natural and human-generated| will be used as a unifying principle. Knowledge gained through this course will help students make informed decisions in all spheres of human activity: science| policy| economics| etc.   
