NAME,ALIAS,PATH,DESCRIPTION
AMER. BUS. HISTORY,MGMT-225,/coursehistories/3163,This course provides an introduction to the law of corporate management and finance| focusing on large publicly held corporations. It is presented from the perspective that before too long virtually all students will serve on one or more corporate boards of directors and that each should| therefore| know about the duties owed by directors and officers to those toward whom they bear a fiduciary duty. The course covers the basic obligations of corporate directors and managers under state corporate law and the federal securities laws. It also considers the rights and responsibilites of other major stake holders in the governance of public corporations| including shareholders| creditors/bondholders| employees (including corporate executives)| investment bankers| corporate lawyers| and accountants. Particular attention is given to the law of mergers and acquisitions. Important issues of social policy concerning large business corporations are also discussed.   
STRATEGIC IMPLEMENTATION,MGMT-482,/coursehistories/3164,This course examines the art and science of negotiation| with additional emphasis on conflict resolution. Students will engage in a number of simulated negotiations ranging from simple one-issue transactions to multi-party joint ventures. Through these exercises and associated readings| students explore the basic theoretical models of bargaining and have an opportunity to test and improve their negotiation skills.   
NEGOTIATIONS,MGMT-491,/coursehistories/3165,This course examines various business disciplines as they apply to the sports industry. The course provides the student with an overview of the business of the intercollegiate| Olympic and professional sports enterprises. In addition| the course investigates the business related issues encountered by managers of sports organizations and covers how business principles can be applied to effectively address these issues.   
NEW VENTURE INITIATION,MGMT-571,/coursehistories/3166,This course explores business responsibility from rival theoretical and managerial perspectives. Its focus includes theories of ethics and their application to case studies in business. Topics include moral issues in advertising and sales; hiring and promotion; financial management; corporate pollution; product safety; and decision-making across borders and cultures.   
PRESENTING THE ARTS,THAR-285,/coursehistories/3515,Recurrent wars throughout history have led social scientists and laymen alike to the conclusion that war is an unavoidable institution. Is this a valid conclusion? If it is| it is a particularly grim conclusion in a nuclear age when humankind has the technological capacity to extinguish all life on the planet. The purpose of this seminar is to address this question by exploring six theories of the causes of war and examining six strategies for preventing war.   
NEGOTIATIONS,MGMT-586,/coursehistories/3564,Continuation of STAT 101. A thorough treatment of multiple regression| model selection| analysis of variance| linear logistic regression; introduction to time series. Business applications.   
LABOR-MGMT RELATIONS,MGMT-414,/coursehistories/3671,This course provides an introduction to the society| culture and history of ancient Egypt. The objective of the course is to provide an understanding of the characteristics of the civilization of ancient Egypt and how that ancient society succeeded as one of the most successful and long-lived civilizations in world history.   
BUSINESS POLICY,MGMT-423,/coursehistories/3767,Examination of language as a part of culture| as a source of knowledge about other aspects of culture| and as social behavior.   
WHARTON FIELD CHALLENGE: United Nations-Global Compact,MGMT-353,/coursehistories/3911,This is a critical writing seminar. It fulfills the writing requirement for all undergraduates. As a discipline-based writing seminar| the course introduces students to a topic within its discipline but throughout emphasizes the development of critical thinking| analytical| and writing skills. For current listings and descriptions| visit the Critical Writing Program's website at www.writing.upenn.edu/critical.   
INDEPENDENT STUDY,MGMT-199,/coursehistories/4319,
CORP. GOVERNANCE EXEC,MGMT-242,/coursehistories/4320,Dante's Divina Commedia will be read and discussed in Italian. The first half of the semester will be devoted to Inferno; the second half to selected cantos of the Purgatorio and Paradiso. We shall consider this masterpiece of Italian literature in the context of Dante's medieval worldview and culture| his identity as a Florentine| his politics| and his poetics. The text will be read in a facing Italian-English edition with class discussion in Italian designed to arrive at an appreciation of the poem that builds on the students' previous knowledge of the language and is geared toward developing skills of literary analysis in Italian. Visual materials from illustrated manuscripts of the Commedia and recently developed web-based resources will complement class readings.   
FORMATION & IMPLEMENT,MGMT-406,/coursehistories/4321,
CORP. GOVERNANCE EXEC,MGMT-625,/coursehistories/4322,Petrarch's life and work in the context of Italian and European culture and society.   
EXECUTIVE LEADERSHIP,MGMT-671,/coursehistories/4323,The impact of paradigm shifts on Italian and European culture.   
NEGOTIATIONS,LGST-806,/coursehistories/4305,Research seminar for thesis writing   
STR PLANNING & CONTR,MGMT-701,/coursehistories/4325,An introduction to the Latin language for beginners. Students begin learning grammar and vocabulary| with practical exercises in reading in writing. By the end of the course students will be able to read and analyze simple Latin texts| including selected Roman inscriptions in the Penn Museum.   
AMER. BUS. HISTORY,MGMT-714,/coursehistories/4326,An accelerated introduction to the Latin language for beginners| equivalent in scope to the first year of Latin (101+102). Ideal for students with some background in learning languages| or who need to learn Latin rapidly. Students begin learning grammar and vocabulary| with practical exercises in reading in writing. By the end of the course students will have a complete working knowledge of Latin grammar| a growing vocabulary| and experience in reading selected inscriptions in the Penn Museum and Julius Caesar's account ofthe Roman invasion of Britain.   
DEALS: ECON STRUC TRANS,MGMT-717,/coursehistories/4327,A rapid but thorough course in the grammar and syntax of classical Latin. No previous knowledge of the language is assumed.   
CORP DEV: MERG & ACQUIS,MGMT-721,/coursehistories/4328,Prerequisite(s): LATN 102 or equivalent (such as placement score of 550). Introduction to continuous reading of unadapted works by Latin authors in prose(e.g.| Cornelius Nepos| Cicero| Pliny)| in combination with a thorough review of Latin grammar. By the end of the course students will have thorough familiarity with the grammar| vocabulary| and style of the selected authors| will be able to tackle previously unseen passages by them| and will be able to discuss questions of language and interpretation.   
TECHNOLOGY STRATEGY,MGMT-731,/coursehistories/4329,This course is for those who have completed Latin 204| Latin 212| or equivalent (such as placement score of 650| or AP score of 4 or 5). Close reading and discussion of a Latin author or a particular genre of latin literature. Topics will vary each semester| and the course may be repeated for credit.   Fall 2012 Topic:Caesar and Lucan both produced literary treatments of the first phase of the civil war that finally destroyed the Roman Republic| the contest between Caesar and Pompey for supremacy at Rome. This phase ended at the battle of Pharsalus in August of 48 BCE. Caesar wrote his narrative shortly after the war's end and before its effects were fully felt| Lucan wrote his epic poem roughly a century later from the perspective of the principate established in its essentials by Caesar's heir| Augustus. Although the narratives cover the same events| the two authors' literary and political aims| as well as their historical contexts| produced wildly divergent stories. We will read them in tandem. In Latin we will cover substantial portions of the three books of Caesar's Civil War and the ten books of Lucan's. We will read the entirety of both works in English.   
STRAT MGMT OF HUM ASSETS,MGMT-751,/coursehistories/4330,
STRATEGIC IMPLEMENTATION,MGMT-782,/coursehistories/4331,This course presents law as an evolving social institution| with special emphasis on the legal regulation of business. It considers basic concepts of law and legal process| in the U.S. and other legal systems| and introduces the fundamentals of rigorous legal analysis. An in-depth examination of contract law is included.   
ENTREPRENEURSHIP,MGMT-801,/coursehistories/4332,This course provides an introduction to the law of corporate management and finance| focusing on large publicly held corporations. It is presented from the perspective that before too long virtually all students will serve on one or more corporate boards of directors and that each should| therefore| know about the duties owed by directors and officers to those toward whom they bear a fiduciary duty. The course covers the basic obligations of corporate directors and managers under state corporate law and the federal securities laws. It also considers the rights and responsibilites of other major stake holders in the governance of public corporations| including shareholders| creditors/bondholders| employees (including corporate executives)| investment bankers| corporate lawyers| and accountants. Particular attention is given to the law of mergers and acquisitions. Important issues of social policy concerning large business corporations are also discussed.   
INNOV CHG AND ENT,MGMT-802,/coursehistories/4333,This course examines the art and science of negotiation| with additional emphasis on conflict resolution. Students will engage in a number of simulated negotiations ranging from simple one-issue transactions to multi-party joint ventures. Through these exercises and associated readings| students explore the basic theoretical models of bargaining and have an opportunity to test and improve their negotiation skills.   
VENTURE CAP & ENT MGMT,MGMT-804,/coursehistories/4334,This course examines various business disciplines as they apply to the sports industry. The course provides the student with an overview of the business of the intercollegiate| Olympic and professional sports enterprises. In addition| the course investigates the business related issues encountered by managers of sports organizations and covers how business principles can be applied to effectively address these issues.   
FORMATION & IMPLEMENT: FORMATION & IMPLEMENTATION OF ENTREP VENTURES,MGMT-806,/coursehistories/4335,This course explores business responsibility from rival theoretical and managerial perspectives. Its focus includes theories of ethics and their application to case studies in business. Topics include moral issues in advertising and sales; hiring and promotion; financial management; corporate pollution; product safety; and decision-making across borders and cultures.   
PRIV. EQUITY EMERG. MAR,MGMT-809,/coursehistories/4336,This course introduces students to the legal frameworks for regulating international business - national| regional| and international| Topics include mechanisms for international dispute| different standards on assigning nationality| jurisdictional and choice of law problems| controversies regarding the treatment of incoming foreign direct investment and expropriation of foreign-owned businesses| patterns in extraterritoriality| problems of clashing legal standards affecting areas like labor and the environment| and projects for creating more uniform rules governing the conduct of international business. Throughout students will be encouraged to evaluate the policy dimensions of laws and to develop their own critical perspectives regarding these.   
SOCIETAL WEALTH VENTURING,MGMT-810,/coursehistories/4337,The 2000 UN Global Compact has confirmed the role of TNCs as central actors in the UN system of international human rights law| but whether their role should be voluntary or legally mandated remains in dispute. This course introduces students to how globalization has led to projects for expanding international human rights law to capture the operations of TNCs and why this development is opposed in many quarters. Competing perspectives on the pros and cons of imposing human rights responsibilities on TNCs and on the respective roles that businesses and governments should play will be examined. The Positions of various governments| businesses| international institutions| academics| and NGOs will be considered| and a number of illustrative case studies will be analyzed.   
ENTREP THROUGH ACQUIS.: Entrepreneurship through Acquisitions,MGMT-811,/coursehistories/4338,A study of the nature| functions| and limits of law as an agency of societal policy. Each semester an area of substantive law is studied for the purpose of examining the relationship between legal norms developed and developing in the area and societal problems and needs.   
STRAT & PRAC OF FAMILY,MGMT-833,/coursehistories/4339,A general introduction to the nature| history and use of human language| speech and writing. Topics include the biological basis of human language| and analogous systems in other creatures; relations to cognition| communication| and social organization; sounds| forms and meanings in the world s languages; the reconstruction of linguistic history and the family tree of languages; dialect variation and language standardization; language and gender; language learning by children and adults; the neurology of language and language disorders; the nature and history of writing systems. Intended for any undergraduate interested in language or its use| this course is also recommended as an introduction for students who plan to major in linguistics.   
MULT BUS STRAT,MGMT-871,/coursehistories/4340,This course takes a historical approach to tracing (and reconstructing) the nature of language contacts and bilingualism| over the course of human history. Contacts between groups of people speaking different languages| motivated by trade| migration| conquest and intermarriage| are documented from earliest records. At the same time| differences in socio-historical context have created different kinds of linguistic outcomes. Some languages have been completely lost; new languages have been created. In still other cases| the nature and structure of language has been radically altered. The course introduces the basics of linguistic structure through a discussion of which aspects of language have proved to be relatively stable| and which are readily altered| under conditions of bilingualism.   
ART AND BUSINESS OF FILM: Art & Business of Film: Creating Managing Exhibiting and Marketing Film,CINE-285,/coursehistories/4184,This course explores the role of media in politics and discusses strategies for using media resources for greatest effect. The design of the course allows for a flexible workshop format and includes guest lectures by media personalities and politicians as well as a trip to meet with media professionals in Washington. The course also provides regular opportunities for students to implement what they have learned through in-class media trainings| mock editorial board interviews| governing strategy scenarios| campaign strategy scenarios| and political advertisement assessments.   
GLOBAL CORP LAW & MGMT: Corporate Law and Management in Global Perspective,LGST-802,/coursehistories/4304,This course covers models for insurer's losses| and applications of Markov chains. Poisson processes| including extensions such as non-homogeneous| compound| and mixed Poisson processes are studied in detail. The compound model is then used to establish the distribution of losses. An extensive section on Markov chains provides the theory to forecast future states of the process| as well as numerous applications of Markov chains to insurance| finance| and genetics. The course is abundantly illustrated by examples from the insurance and finance literature. While most of the students taking the course are future actuaries| other students interested in applications of statistics may discover in class many fascinating applications of stochastic processes and Markov chains.   
SPORTS BUSINESS MGMT,LGST-809,/coursehistories/4307,Italian national cinema from the Golden Age of silent film and classics of Neorealism to present| covering work of a dozen major directors. Films discussed in context of history from the Unification| national vs. regional identity| gender roles| contemporary politics. Readings in Italian history| Italian film history| and theory of cinema. Taught in English.   
ADV TOPICS NEGOTIATION,OPIM-692,/coursehistories/4378,Syllabus for MATH 370-371: an introduction to the basic concepts of modern algebra. Linear algebra| eigenvalues and eigenvectors of matrices| groups| rings and fields. MATH 502-503 is a masters level version of this course.   
POL ENVIRON OF MULT FIRM,MGMT-715,/coursehistories/4488,This course uses an evidence-based approach towards systematic assessment and management of common symptoms and symptom clusters accompanying progressive| life-limiting illnesses within a framework of nationally recognized standards and guidelines for palliative and end-of-life care. Students are prepared to apply principles of palliative management to diverse patient populations across clinical settings including acute| primary| long-term| and community care. Refer to course syllabus or email course faculty for respective requirements.   
COMP STR/IND STR,MGMT-711,/coursehistories/4608,
ORGANIZ ECON & STRAT,MGMT-719,/coursehistories/4609,This seminar will take up some of the "foundational" texts in contemporary feminist theory as well as some of the newest work| to explore the ways in which power operates through gender and sex. Subsidiary themes that will be developed include: the still relevant modernism/postmodernism debate as it relates to feminism; the intersectionality of race| gender| sexuality and class and how feminists can and do talk about "women"; the role of "the body" in relation to social constructivism; the relevance of feminist theory to policy issues| and which theoretical approaches are the most appropriate or have the most powerful potential. Room will be left on the syllabus for student input into the readings. This course is open to undergraduates who have had some prior course work in GSWS and/or political theory; undergraduates are advised to contact the professor to discuss their preparation before enrolling.   
INSIDE INDIAN BUSINESS,MGMT-736,/coursehistories/4610,Consult department for detailed descriptions. More than one course may be taken in a given semester. Recent titles have included: Race Development and American International Relations| Hegel and Marx| and Logic of the West.   
MANAGING ORG CHANGE,MGMT-773,/coursehistories/4611,Introduction to the basic topics of psychology| including learning| motivation| cognition| development| abnormal| physiological| social| and personality.   
MANAGERIAL ECON & GAME,MGMT-784,/coursehistories/4612,Decisions to have children are influenced by cultural norms and economic constraints. Cultural and economic conditions have changed drastically| and| as a result| recent years have seen a sharp| nearly worldwide decline in birth rate| and exceedingly low birth rates in contemporary Europe and Japan. The history| causes| and consequences of this "fertility transition" are the central topics of this seminar. Historical topics include the emergence of the concept of deliberate family size restriction| which fostered birth rate declines in some countries long before the introduction of efficient contraceptives. Causes include the escalating cost of rearing children. Consequences include population aging and resultant difficulty funding pensions for retirees. (The "social security crisis" is much worse in Europe and Japan than in the USA.) The seminar also considers contemporary women's career-family conflicts| which illustrate some of the psychological| sociological| and economic factors with which the seminar is concerned. http://psych.upenn.edu/~norman/s6p.htm.   
GOV.& MGMT. OF CHIN FRMS,MGMT-788,/coursehistories/4613,An introduction to statistics| statistical methods| and probability theory. The course will cover: the nature of statistical data; estimation and hypothesis testing; concepts of statistical inference; measures of central tendency and variability; elementary probability; ANOVA; regression and correlation; non-parametric methods. Emphasis will be placed on application to research in the behavioral sciences. In addition| there will be an introduction to some of the most popular computer-based statistical programs.   
INDEPENDENT STUDY PROJ: Entrepreneurial Value Creation,MGMT-899,/coursehistories/4614,How the individual acquires and is guided by knowledge about objects and events in their environment.   
ENVT'L MGMT LAW & POL,LGST-815,/coursehistories/4600,This course is one of the first arising out of scholarship on cold war international history. It draws on declassified government documents and other archival records to provide a window into the world-view of decision-makers who need to make national security policy based on incomplete information about ambiguous threats. The materials reveal a great deal about the importance of divergent historical perspectives and strategic cultures in the foreign policy-making process. The main focus of the course is on the intersection of the cold war and the rise of Asian nationalism. At the core of the analysis is the clash between America's global strategy of military containment against the Soviet Union and the assertion of Indian| and Chinese nationalism| concerned with preventing the United States from succeeding to Great Britain's imperial rule. The course examines new patterns of power after the Cold War| especially the emergence of two major powers in Asia - China and India - and the issues raised by the U.S. unilateralist use of military power to preserve its predominant position.   
SPECIAL TOPIC: The Economic & Financial Crisis: Causes Consequences & Policy Options,MGEC-891,/coursehistories/4607,This course analyzes the changing relations between social dominance and state power from the time of colonial rule.   
MANAG DECSN MAKING,OPIM-690,/coursehistories/4640,This is a critical writing seminar. It fulfills the writing requirement for all undergraduates. As a discipline-based writing seminar| the course introduces students to a topic within its discipline but throughout emphasizes the development of critical thinking| analytical| and writing skills. For current listings and descriptions| visit the Critical Writing Program's website at www.writing.upenn.edu/critical.   
GLOBAL IMMERSION PROGRAM: Greater China (Pass/No Credit course),MGMT-656,/coursehistories/4993,Survey of the principal developments in Northern Europe during the "early modern" period| i.e. the transition from medieval to modern art-making during the fifteenth and sixteenth centuries. Principal attention to painting and graphics with additional consideration of developments in sculpture| particularly in the regions of the Netherlands and German-speaking Europe. Attention focused on the works of the following artists: Van Eyck| Bosch| Durer| Holbein| Bruegel| and on topics such as the rise of pictorial genres| urban art markets| Reformation art and art for the dynastic courts of emerging nation-states.   
MGMT OF CRISIS RELIEF,MGMT-780,/coursehistories/4994,The history of western architecture| ca. 1700-1900| when architectue was transformed to serve a world that had been reshaped by political and industrial revolutions. Topics to be considered include the Rococo| the English Garden| Palladianism| Romanticism| neo-classicism| the picturesque| the Greek and Gothic Revivals| and the search for a new style.   
STRAT FOR ECON INCLUSION,MGMT-783,/coursehistories/4995,Impressionism opened the pictorial field to light| perception| science| modernity| bourgeois leisure and| famously| the material qualities of painting itself. This course will survey the movement's major contexts and proponents-Magnet| Monet| Morisot| Cezanne| Guaguin| Van Gogh| Rodin-from its origins in the 1860s to its demise in the 1890s| as well as its subsequent adaptations throughout the world until WWI. We will pay particular attention to Impressionsim's critical reception and the historical conditions| which allowed one nation| France| to claim the emergence of early Modernism so firmly for itself. Questions to be addressed include: how can an art of vision and light figure the complexities of history and politics| and especially the revolutions that marked the period? What are the gendered and sexual politics of Impressionsm's obsession with the nude female body? How did the invention of the new technologies and media effect the development of modern art?   Throughout the course| we will also analyze the effects the rapidly changing social and cultural fabric of Paris had on artistic developments. Arguable| Paris was the "capital of the nineteenth century|" and it is here where most artistic innovation of the time took place. None-the-less| we will look outside of France's borders with some frequency| especially to Germany and Britain.   
