NAME,ALIAS,PATH,DESCRIPTION
ENTREPENURIAL ORGNZN,MGMT-010,/coursehistories/735,
INTERNATIONAL MANAGEMENT,MGMT-013,/coursehistories/736,
LABOR MGMT RELATIONS,MGMT-014,/coursehistories/737,
ORG BEHAVIOR/THEORY,MGMT-039,/coursehistories/738,This course analyzes how the structure and processes of an organization can be designed in light of the restrictions and requirements of the technology it uses| the environment in which it operates| the nature of its goals and the stage of its development.   
LDERSHP & COMMUN IN GRPS,MGMT-100,/coursehistories/739,As a Wharton undergraduate| you are in a position to become a future business leader. Management 100 is designed to increase your understanding of leadership and communication in teams and to help you build skills that are necessary for professional success. You will study literature on leadership| management communication| and group dynamics and also complete a field project| an integral part of the course. Your field project provides the context in which you will develop as a leader| practice communication skills| learn about the nature of group work| and enhance your sensitivity to community issues. Management 100 will enrich your Wharton experience by providing many opportunities for interaction with peers| advanced students| alumni| faculty and the community.   
LECTURE,MGMT-101,/coursehistories/740,This course addresses contemporary management challenges stemming from changing organizational structures| complex environmental conditions| new technological developments and increasingly diverse workforces. It highlights critical management issues involved in planning| organizing| controlling and leading an organization. This course will help you understand some of the issues involved in both managing and being managed and equip you to become more effective contributors to organizations that you join. The course will cover several topics in management| organization and strategy. Each topic will span one or two weeks. Topics include combinations of the following areas: organizational structure| organizational culture| strategy| interorganizational relationships| job design| groups| reward systems| work force composition| power and politics| social responsibility| organizational change| organizational decision-making| business history. The professor will cover an overview of the topic with frameworks and examples in the lecture and the teaching assistant will lead a case discussion that integrates these frameworks in the recitation.   
INDUS REL & HUM RES MGMT,MGMT-104,/coursehistories/741,The focus of Management 104 is the economic and institutional constraints on organizations in the formulation and implementation of human resources management policies and strategies in the United States and| as appropriate| internationally. The specific constraints discussed are labor markets (external and internal)| labor laws (governing employment policies and employee relations)| and labor unions (and the threat thereof). Particular attention is paid to the relationship of these constraints to the competitiveness of American enterprise in the global economy.   
POLITICS OF MULT FIRM,MGMT-209,/coursehistories/742,This course explores the intersection of international strategy and international relations to help students to identify and introduce sustainable and profitable business strategies in sectors with a history of or strong potential for ongoing political intervention. We will examine the identity| background| incentives and operations of relevant national and international political actors; and the process by which they generates policies that can adversely or favorably influence firm profitability. Corporations whose success depends crucially on a sophisticated analysis of the contending forces in the geopolitical arena and an ability to influence policy outcomes will serve as examples of the first-order strategic importance of incorporating the political environment in multinational strategy formulation.   
DIVERSITY IN WORKPLACE,MGMT-224,/coursehistories/743,
BUS. PLAN CREAT. & IMPLE,MGMT-227,/coursehistories/744,Business Plan Creation and Implementation is an overview course of Entrepre- neurial Businesses for the entrepreneurial-minded Penn student. The course will cover opportunity assessment and feasibility analysis| as well as implementation| deal structure and operations with a special emphasis on the psychological and sociological ramifications of the entrepreneurial pursuit. Each topic is approached from a pgramatic perspective. The purpose of this course is to expose students to the entrepreneurial pursuit| its ramifications and its rewards. Thus| both class assignments and class discussions are based upon real life experiences. The lecture| the readings| the cases and the speakers all reflect that purpose.   
ENTREP DECISION MAKING,MGMT-230,/coursehistories/745,MGMT 230 integrates the material introduced in business fundamental courses andapplies it to the design and evaluation of new ventures. The purpose of this course is to explore the many dimensions of new venture creation and growth and to foster innovation and new business formations in independent and corporate settings. The course addresses both a theoretical perspective on venture initiation and the application of writing an actual business plan.   
ENTREPR VENTR INITIATION,MGMT-231,/coursehistories/746,MGMT 231 is an advanced sequel to Mgmt.230 focusing on independent entrepreneurship| business plans and the business planning process| and the operating management of small firms. Ideally| the course builds upon venture opportunities identified in MGMT 230.   
COMPARATIVE MANAGEMENT,MGMT-234,/coursehistories/747,This is essentially a course in comparative national environments for business and how aspects of these environments impact on the firm. The course examines a number of institutions and phenomena in various countries. Issues range from language| religion| gender and ethnicity to legal systems| financial markets and corporate governance. The lectures draw on ideas from history| geography| sociology| political science and economics to inform our analyses. The lectures and cases range over both developed market economies and emerging economies.   
MANAGEMENT OF TECHNOLOGY,MGMT-237,/coursehistories/748,This course examines the technical and managerial challenges presented by emerging and evolving technologies. Particular consideration is given to the forces affecting the nature and rate of technological innovation and the managerial options available to both established and entrepreneurial organizations. In doing so| we explore both internal and external sources of innovation as well as the appropriate strategies and processes for capitalizingon them. The course will be taught in seminar fashion with substantial class discussion. Assigned and supplementary readings will be augmented by cases and occasional guest lectures. Students will prepare a variety of written assignments| including case analyses and two research papers dealing with selected technologies| firms and industries.   
ORGANIZATIONAL BEHAVIOR,MGMT-238,/coursehistories/749,Management 238 is the standard undergraduate course in Organizational Behavior. The course deals essentially with the management of people at work. It examines the individual employee in his organizational environment| as well as the organization itself. Topics range from motivation| leadership groups all the way to organization structure| culture| human resources and organizational change. The course develops some themes in which these topics become relevant -- for example the networking organization and diversity at the workplace. Students should expect to conduct group projects involving actual fieldwork and might be asked to give a presentation in class.   
ORGANIZATION DESIGN,MGMT-239,/coursehistories/750,We are born in and spend much of our lives in organizations. From families to schools to athletic teams and jobs| organizations play a central role in our experience. And this is especially so as we pursue careers. Few of us have the luxury of working as a lone artist unfettered by an organization's demands and restrictions. At times we are grateful to organizations for their services and protection. At other times we hate them being unfeeling and inflexible bureaucracies. In this coures we shall examine how organizations are structured with a particular emphasis on businesses and not-for-profit organizations for which most of us will work. How can they be structured so that they are effective and efficient? And how can we personally survive in them when they are less than we might want?   
COMMUN IN WORKPLACE,MGMT-243,/coursehistories/751,Efficient and effective communication is critical to the productivity| indeed the very survival of business organizations. Moreover| recent advances in technology have expanded the traditional boundaries of communication networks. As corporate hierarchies give way to lateral| project-oriented teams| the most productive managers will be those able to form cooperative relationships through informal channels of communication. Accordingly| course objectives are to deepen the student's understanding of communication in the workplace and| also| to refine the speaking and writing skills necessary for professional development.   
PERSONNEL MANAGEMENT,MGMT-244,/coursehistories/752,This course introduces the student to the strategic role human resource management might play in creating competitive advantage for firms. We study P/HRM policies and practices in context and consider broader corporate strategies| business activities| and competitiveness in an increasingly global marketplace. We give attention to the diversity of the American workforce| and to the effects of changing technologies in production and in provision of services.   
EXECUTIVE LEADERSHIP,MGMT-248,/coursehistories/753,The objective of this course is to provide students with a number of opportunities to gain insights about the nature of outstanding| ordinarily effective| and ineffective moral and evil leadership. This will be accomplished by (a) reading social science studies| biographies| case historical accounts of leaders| and theoretical and philosophical writings about leadership| (b) watching video tapes about leaders and listening to audio tapes of interviews and speeches of leaders and reports of reactions of followers to leaders| (c) completion of leadership related exercises| and (d) class discussion.   
MERGERS & ACQUISITIONS,MGMT-249,/coursehistories/754,This course explores the role of mergers and acquisitions and alternative methods of corporate development in advancing the strategies of operating business. Emphasis is on the way companies use acquisitions to alter business mixes; seize opportunities in new products| technologies and markets; enhance competitive positioning; adjust to changing economics| and promote value-creating growth. Although the course will emphasize strategic acquisitions| it also will explore leveraged buy-outs and hostile financial acquisitions as well as their influence on corporate buyers.   
THE LANGUAGE OF LEADERSH,MGMT-250,/coursehistories/755,This course is based on the assumption that mastering the language of leadership is crucial to a successful career in business and the professions. Future business leaders need to develop the art of reading and understanding organizations. Moreover| they need to learn how to shape what others see and understand| how to influence others for the benefit of all concerned - individual| organization| and community. It looks at management from a rhetorical perspective. You will study the literature on organizational theory and application and that of writing theory and practice. At the same time| you will build your own composing| revising and editing skills and mastersuch standard business genres as letters| memos| and reports. Each week bridges two bodies of literature and relates theory and practice.   The course objectives are to: increase your understanding of management as a rhetorical enterprise; foster critical thinking about the language of management; heighten your ability to shape meaning in written language; improveyour writing competencies -- your ability to analyze audience| provide structure | use evidence| and observe stylistic conventions; enhance your composing| revising| and editing skills; help you master standard types of business genres.   
CONSULT TO GROWTH CO,MGMT-251,/coursehistories/756,This course offers students a unique opportunity to develop consulting skills and entrepreneurial expertise by working as consultants to thriving entrepreneurial ventures in the Philadelphia area. This capstone course combines both fieldwork and class work and allows students to apply knowledge and skills acquired through other course work to real world issues that must be addressed by operating companies. An understanding of characteristics producing rapid entrepreneurial growth and skills related to effective communications and management of a business relationship are emphasized.   
NEGOTIATION/DISPUTE RES,LGST-206,/coursehistories/667,This course examines the art and science of negotiation| with additional emphasis on conflict resolution. Students will engage in a number of simulated negotiations ranging from simple one-issue transactions to multi-party joint ventures. Through these exercises and associated readings| students explore the basic theoretical models of bargaining and have an opportunity to test and improve their negotiation skills.   
ENVT'L MGMT LAW & POL,LGST-215,/coursehistories/670,This course provides an introduction to environmental management with a focus on law and policy as a basic framework. The primary aim of the course is to give students a deeper practical sense of the important relationship between business and the natural environment and to think critically about how best to manage this relationship.   
INTRO TO MANAGEMENT,MGMT-011,/coursehistories/1401,
DIVERSITY IN THE WRKPLCE,MGMT-015,/coursehistories/1402,This course will provide students with an introduction to analysis of processes used in the chemical and pharmaceutical industries. Emphasis will be placed on the development of flow sheets and material balances for chemical processes. Students wil also be introduced to modern process simulation software.   
MULTINATIONAL MANAGEMENT,MGMT-111,/coursehistories/1403,Thermodynamics and its applications to chemical processes; forms of energy and their interconversion; phase and chemical equilibria; heat engines and thermal cycles.   
EMPLOYMENT LAW,LGST-208,/coursehistories/1382,A view of how a multicellular embryo is specified to differentiate into a wide spectrum of cell types| and how the spatial patterns and axes of embryos are determined. The course will focus on genetic and molecular approaches| but will also discuss comparative embryology and inductive events not yet understood on a molecular level. Recent work on cloning animals using nuclear transfer and on stem cell biology will also be covered. Special emphasis will be placed on two organisms offering particular experimental advantages for the study of embryonic development: Drosophila| C. elegans| zebrafish| chicks| frogs| and mice.   
STRATEGIC MGMT INNOV,MGMT-557,/coursehistories/1565,This course will see how theatre artists have built theatre pieces from Shakespeare's scripts| starting from the time that the theatres reopened during the Restoration| when theatrical aesthetics had changed and the continuity of theatrical tradition from Shakespeare's own theatre had been broken. We will consider how different social| political| and theatrical cultures re-envisioned the scripts| how they work in theatre| how this different vision of the scripts affected what they became| how they worked| in the theatre of the day.   
LDRSHP FOR TECHNOLOGISTS,MGMT-579,/coursehistories/1566,This course explores an aspect of 18th-century literature intensively; specific course topics will vary from year to year.   See the English Department's website at www.english.upenn.edu for a description of the current offerings.   
BUSINESS POLICY,MGMT-585,/coursehistories/1567,This course explores an aspect of the 19th-century novel intensively; specific course topics will vary from year to year.   See the English Department's website at www.english.upenn.edu for a description of the current offerings.   
PERSONNEL/HUM RES MGMT,MGMT-022,/coursehistories/1992,Analysis of key contemporary issues in health and social policy that will provide students with a deeper understanding of the design and structure of the U.S. health care system| the policy initiatives that have shaped it| and the roles of the government| the private sector| and consumers and advocacy groups in setting the policy agenda. Seminars will examine the origins of each issue| the policies enacted and their effects| both intended and unintended| and will propose and debate the merits of alternative policy solutions. The role of health services and policy research in informing the policy debate and directions will be highlighted.   This course satisfies the Society & Social Structures Sector for Nursing Class of 2012 and Beyond.   
ORG BEHAVIOR/PSYCHOLOGY,MGMT-038,/coursehistories/1993,Quality care is an issue for consumers| providers| purchasers| and policy makers. This case study examines the multiple challenges that surround the quality of health care in the evolving United States health care marketplace. Through classroom discussion and special project experience| the student will become familiar with the concept of health care quality and approaches to the measurement and management of quality. Using Donabedian's construct of structure| process and outcomes| strategies to improve quality while containing or reducing costs are reviewed| including the contributions of clinical practice guidelines. The evolving dominant structures for providing health care services| managed care and integrated delivery systems| and their approaches to quality management and reporting will be explored.   
MULTINATL CORP STRATEGY,MGMT-205,/coursehistories/1994,Principles of clinical pharmacology are applied to the nursing care of pediatric patients. Prescribing and monitoring procedures for the drug regimens used to treat pediatric patients are reviewed. Problems inherent in misuse of commonly used drugs are also considered.   
BUSINESS POLICY,MGMT-223,/coursehistories/1995,This course uses an evidence-based approach towards systematic assessment and management of common symptoms and symptom clusters accompanying progressive| life-limiting illnesses within a framework of nationally recognized standards and guidelines for palliative and end-of-life care. Students are prepared to apply principles of palliative management to diverse patient populations across clinical settings including acute| primary| long-term| and community care. Refer to course syllabus or email course faculty for respective requirements.   
TECHN INNOV & ENTRSHIP,MGMT-235,/coursehistories/1996,This course will utilize a multidisciplinary approach to address the field of women's health care. The constructs of women's health care will be examined from a clinical| as well as sociological| anthropological and political point of view. Topics will reflect the historical movement of women's health care from an an obstetrical/gynecological view to one that encompasses the entire life span and life needs of women. The emphasis of the course will be to undertake a critical exploration of the diversity diversity of women's health care needs and the past and current approaches to this care. Issues will be addressed from both a national and global perspective| with a particular focus on the relationship between women's equality/inequality status and state of health.   This course satisfies the Society & Social Structures Sector for Nursing Class of 2012 and Beyond.   
GROUP DYNAMICS,MGMT-240,/coursehistories/1997,This course builds on the knowledge attained in NURS 600 as well as the knowledge and skills of the expert clinician. The focus of the course is clinical teaching for the advanced practitioner| perceptor preparation and issues related to establishing and maintaining clinical sites. Academic responsibilities of faculty members| ethical and legal issues in education and educational effects of professional trends| health care policies and rapidly changing environments are also explored.   
STRATEGIC IMPLEMENTATION,MGMT-282,/coursehistories/1998,Integrates basic physiology and clinical pathophysiology for graduate nursing students. Whenever possible basic physiologic concepts will be used to illustrate specific pathophysiological problems. The interrelationships between clinical pathophysiology and basic physiology are emphasized.   
PRESENTING THE ARTS,THAR-280,/coursehistories/2168,Topic for Fall 2012:Medieval Sepharad. Through close reading of Hebrew primary sources| students will explore developments in Sephardi culture from the 11th through the 16th centuries. Topics to be examined include Sephardi preoccupation with the biblical text; medieval Sepharadic belle lettres| scriptural exegesis and historiographic writings; Karaite-Rabbanite interactions; Jewish-Islamic interactions| and the nexus of philosophy and kabbalah. Students must be able to read unpointed Hebrew texts. Undergarduates require instructor's permission.   Primary sources include readings from ancient| medieval and early modern Jewishtexts. Students must be able to read unvocalized Hebrew. Open to undergraduates only with the instructor's permission.   
GLOBAL & INT'L POLITIC,MGMT-208,/coursehistories/2619,This course will explore the ways that health and illness-related beliefs and behaviors develop within communities. We will identify the forces that shape these beliefs and behaviors and ultimately affect who gets sick| who gets well| and the very nature of the illness experience. Emphasis will be given to the relationships among sociocultural| political and biological factors and the ways that these factors interact to produce the variation that we see in health and illness related attitudes| behaviors and outcomes across cultures.   
COMPETITIVE STRATEGY,MGMT-211,/coursehistories/2620,Examination of sociocultural 'registers' of language namely linguistic varieties specific to particular social practices and institutions. Topics include registers of scientific language| religious language| professional language (as in law| bureaucracy| medicine or business)| formal and etiquette-laden speech| magical incantation| secret languages| thieves' argot| standardized 'national' languages| and slang. The emphasis throughout is on the relationship between particular linguistic registers and the forms of social life they enable| including forms of social conduct| stereotypes of personhood and group-relative identity| and relations of power and authority between social groups.   
VEN CAPITAL & ENT MGMT,MGMT-264,/coursehistories/2621,Survey of method and theory of lithic analysis| including experimentation| typology| technology| and microwear| focusing on the behavioral implications of lithic assemblage variability.   
INTRO TO MANAGEMENT,MGMT-411,/coursehistories/2622,Disease evaluated in its culture context| based on findings in skeletal and mummified paleopathologic specimens. Instruction in examination of specimens. For senior anthropology majors| graduate and medical students.   
PERSONNE/HUM RES MGMT,MGMT-422,/coursehistories/2623,Examination of current understanding of Ancient Maya| emphasizing critical review of recent archaeological research and theories.   
ORG BEHAVIOR PSYCHOLOGY,MGMT-438,/coursehistories/2624,Examination of the components of explanation and features of identity that enter into the life stories people tell one another and themselves through the life course. Readings may include McGoldrick & Gerson| Genograms; Linde| Life Stories; James| Varieties of Religious Experience; Erikson| Identity| Youth and Crisis; Fulghum| From Beginning to End; Herman| Trauma and Recovery; and Haley| Roots among others.   
STRAT & PRAC OF FAMILY,MGMT-233,/coursehistories/2873,This course provides students with a survey of British poetry and poetics from the Restoration to the Modern period| and usually will include writers ranging from Aphra Behn and Alexander Pople to Thomas Hardy. The course may be offered in various froms| some covering less| and some more historical ground. Most will provide a sampling of eighteenth-century| Romantic| and Victorial poets.   See the English Department's website at www.english.upenn.edu for a description of the current offerings.   
COMMUNITY REINVESTMENT,MGMT-255,/coursehistories/2874,This course offers an introduction to the literature of the Romantic period (ca. 1770-1830). Some versions of this course will incorporate European romantic writers| while others will focus exclusively on Anglo-American romanticism| and survey authors such as Austen| Blake| Brockden Brown| Byron| Coleridge| Emerson| Irving| Keats| Radcliffe| Scott| Shelley| and Wordsworth.   See the English Department's website at www.english.upenn.edu for a description of the current offerings.   
