NAME,ALIAS,PATH,DESCRIPTION
ELEMENTARY RUSSIAN II,RUSS-002,/coursehistories/993,Continuation of RUSS001. Further work developing basic language skills using exciting authentic materials about life in present-day Russia. At the conclusion of the course| students will be prepared to negotiate most basic communication needs in Russia (getting around town| ordering a meal| buying goods and services| polite conversation about topics of interest) and to comprehend most texts and spoken material at a basic level.   
INTERMEDIATE RUSSIAN II,RUSS-004,/coursehistories/994,A continuation of RUSS003. This course will further develop your ability to use the Russian language in the context of everyday situations (including relationships| travel and geography| leisure activities) and also through reading and discussion of elementary facts about Russian history| excerpts from classic literature and the contemporary press and film excerpts. At the end of the course you will be able to negotiate most daily situations| to comprehend most spoken and written Russian| to state and defend your point of view. Successful completion of the course prepares students to satisfy the language competency requirement.   
TERRORISM: Russian Origins to 21st C. Methods,RUSS-022,/coursehistories/995,This course studies the emergence of organized terrorism in nineteenth century Russia. It examines the philosophy of the terrorist struggle through its methods| causes| various codes| and manifestoes that defined its nature for the times to come. We critique intellectual movements such as nihilism| anarchism| and populism that inspired terrorism defining the political violence and disorder as beneficial acts. The issue of policing terrorism becomes central when we study a police experiment to infiltrate| delegitimize and ultimately neutralize the terrorist networks in late imperial Russia.   The discussions draw on the ideology and political efficacy of the conspiratorial mode of operation| terrorist tactics such as assassination and hostage-taking| the cell structure of the groups and underground incognito of the strikers| their maniacal self-denial| revoluntionary asceticism| underground mentality| faceless omnipotence| and other attributes-intensifiers of its mystique. We analyze the technology and phenomenology of terror that generate symmetrical disorganizing threats to any organized form of government and reveal the terrorist act as a sublime end as well as a lever for achieving practical causes. Our study traces the rapid proliferation of terrorism in the twentieth century and its impact on the public life in Western Europe| the Balkans| and America.   
RUSSIAN LITERATURE IN TRANSLATION II(1870-PRESENT),RUSS-032,/coursehistories/996,Major Russian writers in English translation: Tolstoy| Dostoevsky| Pasternak| Babel| Solzhenitsyn| and others.   
INTRO TO RUSSIAN CIV II,RUSS-106,/coursehistories/997,The collapse of communism in the world's largest country and the transition to new political| social| and economic modes have resulted in profound changes for the people in Russia and in the rest of the world -- changes that have brought an unprecedented diversity of opportunity for some| and for others| severe restrictions.   How do 19th and 20th century Russia and the Soviet Union give meaning to 21st century Russia? This course investigates this question by looking at the interconnections between literature| the visual and theater arts| religion and society. Film| works of art| literary texts| manifestoes| ethnographies| and memoirs will be used in examining such topics as art in society| revolutionary thought| utopian and distopian visions| mythmaking| the status of women| youth culture| and changing values in post-communist society.   
DOSTOEVSKY,RUSS-201,/coursehistories/998,This course explores the ways Fyodor Dostoevsky (1821-1881) portrays the "inner world(s)" of his characters. Dostoevsky's psychological method will be considered against the historical| ideological| and literary contexts of middle to late nineteenth-century Russia. The course consists of three parts External World (the contexts of Dostoevsky)| "Inside" Dostoevsky's World (the author's technique and ideas) and The World of Text (close reading of Crime and Punishment and The Brothers Karamazov). Students will write three essays on various aspects of Dostoevsky's "spiritual realism."   
RUSSIAN HISTORY IN FILM: Drama and Fiction,RUSS-225,/coursehistories/999,This course draws on the fictional| drama and cinematic representation of the Russian history based on Russian as well as non Russian sources and interpretations. The analysis targets major modes of imagining| such as narrating| showing and reenacting historical events| personae and epochs justified by different| historically mutating ideological postulates and forms of national self-consciousness. Common stereotypes of picturing Russia from "foreign" perspectives draw special attention. The discussion involves the following themes and outstanding figures: the mighty autocrats Ivan the Terrible| Peter the Great| and Catherine the Great; the tragic ruler Boris Godunov; the brazen rebel and royal impostor Pugachov; the notorious Rasputin| his uncanny powers| sex-appeal| and court machinations; Lenin and the October Revolution; images of war; the times of construction and the times of collapse of the Soviet Colossus.   
RUSSIAN CONVERSATION AND COMPOSITION II,RUSS-312,/coursehistories/1000,Primary emphasis on speaking| writing| and listening. Development of advanced conversational skills needed to carry a discussion or to deliver a complex narrative. This course will be based on a wide variety of topics from everyday life to the discussion of political and cultural events. Russian culture and history surveyed briefly. Materials include Russian TV broadcast| newspapers| Internet| selected short stories by contemporary Russian writers. Offered each spring.   
PUSHKIN,RUSS-402,/coursehistories/1001,The writer's lyrics| narrative poems| and drama.   
ADV RUSS CONV,RUSS-413,/coursehistories/1002,This course continues developing students' advanced skills in Russian| and introduces students to major movements and figures of twentieth-century Russian literature and culture. We will read the works of modern Russian writers| and watch and discuss feature films. The course will introduce the first Soviet films and works of the poets of the Silver Age and beginning of the Soviet era as well as the works from later periods up to the Perestroika and Glasnost periods (the late 1980s).   
RUSS AVANT-GARDE: FILMARTTHTR/RUSS REVOL,RUSS-024,/coursehistories/1484,This course is the sequel to EAS 345 and focuses on the planning process for a new technology venture. Like its prerequisite| the course is designed expressly for students of engineering and applied science having a keen interest in technological innovation. Whereas EAS 345 investigates the sequential stages of engineering entrepreneurship from the initial idea through the early growth phase of a startup company| EAS 346 provides hands-on experience in developing a business plan for such a venture. Working in teams| students prepare and present a comprehensive business plan for a high-tech opportunity. The course expands on topics from EAS 345 with more in-depth attention to: industry and marketplace analysis; competitive strategies related to high-tech product/service positioning| marketing| development and operations; and preparation of sound financial plans. Effective written and verbal presentation skills are emphasized throughout the course. Ultimately| each team presents its plan to a distinguished panel of recognized enterepreneurs| investors and advisors from the high-tech industry.   
ADULTERY NOVEL,RUSS-125,/coursehistories/1485,
WAR & REPRESENTATION,RUSS-150,/coursehistories/1486,Introduction to economic analysis and its application. Theory of supply and demand| costs and revenues of the firm under perfect competition| monopoly and oligopoly| pricing of factors of production| income distribution| and theory of international trade. Econ 1 deals primarily with microeconomics.   
MEDIA AND TERRORISM,RUSS-434,/coursehistories/1591,
ELEMENTARY RUSSIAN I,RUSS-001,/coursehistories/2111,This course will focus primarily on epidoes of external intervention by Great Powers in the politics of Middle Eastern states. We shall begin by examining the emergence of the Middle Eastern state system after the disappearance of the Ottoman Empire in the early part of the 20th century. This discussion will provide opportunities to develop key concepts in the study of international politics and will serve as crucial historical background. We shall then turn our attention to the primary concern of the course - a systematic consideration of the motives| operational results| and long-term implications of a number of important examples of intervention by Great Powers in the Middle East. Among the episodes to be considered will be British policies toward the end of World War I| in Palestine in the 1930s| and| along with the French| in Suez in 1956. Soviet intervention in the first Arab-Israeli war| in 1948| will be analyzed along with Soviet policies toward Egypt in the early 1970s. American intervention in Iran in 1953 and in the Gulf War in 1991 will also be examined.   
INTERMEDIATE RUSSIAN I,RUSS-003,/coursehistories/2112,One of the great accidents of history is the Partition of the subcontinent into the two states of India and Pakistan| and the onset of the cold war as a global struggle between the United States and the Soviet Union. The major focus of the course is on the interaction between regional conflicts| the most enduring symbolized by the unresolved dispute between India and Pakistan over Kashmir| and the global strategies of rival great powers which sought to tip the balance of power in their favor by military and ideological influence over the "third world." These conflicts were exacerbated by the Indian leadership's commitment to an independent foreign policy of non-alignment| and its aspirations to leadership of newly independent states in Asia and Middle East| ranged against Pakistan's inability to establish a viable state without exernal support. The resulting alignments and alliances drew the subcontinent into the center of cold war rivalries. The last part of the course focuses on the changing security environment after the cold war| the rise of India and China as competitors for influence; and problems posed by persisting mutual resentment and distrust in India and the United States| despite recognition on both sides of the need to cooperate and avoid China's domination of Asia.   
RUSS LIT TO 1870'S,RUSS-031,/coursehistories/2113,Topics include evaluation of political data; the politics of governmental information; the foundations of political polling; and the use of political records. The research methods examined are content analysis| survey research; cross-cultural and cross-national studies; case studies| and direct observation.   
INTRO TO RUSS CIV,RUSS-105,/coursehistories/2114,Consult department for detailed descriptions. More than one course may be taken in a given semester. Recent titles have included: Leadership & Democracy; Conservative Regimes.   
TOLSTOY,RUSS-202,/coursehistories/2115,This seminar is taught in Washington D.C. for students enrolled in the Washington Semester Program. It includes an orientation to observation and research in the Washington Community and a major independent research project on the politics of governance.   
CHEKHOV: On Stage and Screen,RUSS-203,/coursehistories/2116,This course intends to familiarize the student with the concept of "law"| its use as a constitutive and regulative force in the international arena| and the expanding scope of international law through the inclusion of transnational law and human rights.   
RUSSIAN POETICS,RUSS-401,/coursehistories/2117,Constitutionalism is an independent theory of political order| arising from the   
19C DREAMS TO 20C ANGST,RUSS-405,/coursehistories/2118,Consult department for detailed descriptions. More than one course may be taken in a given semester. Recent titles have included: Sustainable Environmental Policy & Global Politics; Shakespeare and Political Theory.   
RUSSIAN GHOST STORIES,RUSS-130,/coursehistories/2403,A general introduction to the nature| history and use of human language| speech and writing. Topics include the biological basis of human language| and analogous systems in other creatures; relations to cognition| communication| and social organization; sounds| forms and meanings in the world s languages; the reconstruction of linguistic history and the family tree of languages; dialect variation and language standardization; language and gender; language learning by children and adults; the neurology of language and language disorders; the nature and history of writing systems. Intended for any undergraduate interested in language or its use| this course is also recommended as an introduction for students who plan to major in linguistics.   
RUSS LIT TO 1870S,RUSS-145,/coursehistories/2404,Introduction to learning and understanding American Sign Language ( ASL ); cultural values and rules of behavior of the Deaf community in the United States. Includes receptive and expressive readiness activities; sign vocabulary; grammatical structure; facial expressive| body movement| gestures signs; receptive and expressive fingerspelling; and deaf culture.   
TERRORISM,RUSS-190,/coursehistories/2405,A review of the basic algebra and trigonometry required by students who plan to take calculus. Topics include basic algebraic operations| linear and quadratic equations and functions| polynomial functions| mathematical induction| the binomial theorem| exponential and logarithmic functions| complex numbers and includes a treatment of plane trigonometry. It is a non-credit course.   
RUSSIA AND THE WEST,RUSS-220,/coursehistories/2406,Introduction to concepts and methods of calculus for students with little or no previous calculus experience. Polynomial and elementary transcendental functions and their applications| derivatives| extremum problems| curve-sketching| approximations; integrals and the fundamental theorem of calculus.   
RUSSIAN HISTORY IN FILM,RUSS-275,/coursehistories/2407,Brief review of High School calculus| applications of integrals| transcendental functions| methods of integration| infinite series| Taylor's theorem. Use of symbolic manipulation and graphics software in calculus.   
ADVANCED RUSS CONV/COMP,RUSS-311,/coursehistories/2408,Functions of several variables| vector-valued functions| partial derivatives and applications| double and triple integrals| conic sections| polar coordinates| vectors and analytic geometry| first and second order ordinary differential equations. Applications to physical sciences. Use of symbolic manipulation and graphics software in calculus.   
RUSSIAN/RUSSIAN SPEAKERS,RUSS-360,/coursehistories/2409,Functions of several variables| partial derivatives| multiple integrals| differential equations; introduction to linear algebra and matrices with applications to linear programming and Markov processes. Elements of probability and statistics. Applications to social and biological sciences. Use of symbolic manipulation and graphics software in calculus.   
ROMANTICS & REALISTS: Advanced Russian I,RUSS-412,/coursehistories/2410,Topics from among the following: logic| sets| calculus| probability| history and philosophy of mathematics| game theory| geometry| and their relevance to contemporary science and society.   
CHEKHOV STAGE & SCREEN,RUSS-426,/coursehistories/2411,Linear algebra: vectors| matrices| systems of linear equations| eigenvalues and eigenvectors. Vector calculus: functions of several variables| vector fields| line and surface integrals| Green's| Stokes' and divergence theorems. Series solutions of ordinary differential equations| Laplace transforms and systems of ordinary differential equations. Use of symbolic manipulation and graphics software.   
FILM/ART RUSS REVOLUTION,RUSS-436,/coursehistories/2412,St urm-Liouville problems| orthogonal functions| Fourier series| and partial differential equations including solutions of the wave| heat and Laplace equations| Fourier transforms. Introduction to complex analysis. Use of symbolic manipulation and graphics software.   
POST-SOV RUSSIA IN FILM,RUSS-460,/coursehistories/2413,This is identical to Math 312| registration is restricted to Engineering graduate students only.   
CONFORM & DISSENT: USSR,HIST-413,/coursehistories/2320,Students work 15-20 hours per week in field placement and meet weekly with class and instructors. The class is intended to help students reflect from a variety of perspectives on the work that they are doing in their placement organizations. The class format is primarily discussion. Students are required to complete assigned readings| prepare written and oral presentations| and submit a final project.   
Russian Outside the Classroom,RUSS-107,/coursehistories/2676,This is an introductory course in mathematical biology. The emphasis will be on the use of mathematical and computational tools for modeling physical phenomena which arise in the study biological systems. Possible topics include random walk models of polymers| membrane elasticity| electrodiffusion and excitable systems| single-molecule kinetics| and stochastic models of biochemical networks.   
Dreams and Nightmares in Fiction and Film,RUSS-185,/coursehistories/2677,Introduction to the structure and function of the vertebrate nervous system. We begin with the cellular basis of neuronal activities| then discuss the physiological bases of motor control| sensory systems| motivated behaviors| and higher mental processes. This course is intended for students interested in the neurobiology of behavior| ranging from animal behaviors to clinical disorders.   
RUSSIAN SHORT STORY,RUSS-196,/coursehistories/2678,An introduction to the scientific study of vision| with an emphasis on the biological substrate and its relation to behavior. Topics will typically include physiological optics| transduction of light| visual thresholds| anatomy and physiology of the visual pathways| retinal processing| properties of visual cortex| and color vision.   
Business & Democracy in the New Russia,RUSS-416,/coursehistories/2679,This lecture course is designed to introduce the student to the functioning of the autonomic nervous system (ANS)| which is critically involved in the maintenance of body homeostasis through regulation of behavior and physiology. The course will begin with a review of the basic anatomy and physiology of the ANS including the sympathetic| parasympathetic and enteric divisions. The mechanisms by which the ANS regulates peripheral tissues will be discussed| including reflex and regulatory functions| as will the effect of drugs which modulate ANS activity. The role of the ANS in regulating behavior will be addressed in the context of thirst| salt appetite and food intake.   
Classic Russian Literature Today,RUSS-467,/coursehistories/2680,
RUSSIAN LIT AFTER 1870,RUSS-155,/coursehistories/2914,Sometimes limiting itself to the works of one or two authors| sometimes focusing on a particular theme such as "American Poetry and Democratic Culture|" this course devotes itself to the study of twentieth-century Americanpoetry.   See the English Department's website at www.english.upenn.edu for a description of the current offerings.   
RUSS & EAST EURO FILM,RUSS-165,/coursehistories/2915,This course explores an aspect of Film History intensively; specific course topics vary from year to year.   See the English Department's website at www.english.upenn.edu for a description of the current offerings.   
MADNESS & MADMEN,RUSS-197,/coursehistories/2916,This course explores an aspect of Film Studies intensively; specific course topics vary from year to year.   See the English Department's website at www.english.upenn.edu for a description of the current offerings.   
RUSS/RUSSIAN SPEAKERS II,RUSS-361,/coursehistories/2917,This course explores an aspect of Postcolonial literature intensively; specific course topics vary from year to year.   See the English Department's website at www.english.upenn.edu for a description of the current offerings.   
FATE/CHANCE IN LIT&FILM,RUSS-432,/coursehistories/2918,While it has been more than a hundred years since Freud discovered the unconscious since it was in 1897 that Freud started his self-analysis and discovered that "Nothing human was alien to him"| one may wonder about the survival of Freudian thought today with the rapid development of genetics| biology and chemistry| one often hears that psychoanalysis is obsolete and has lost its scientific credibility. In order to assess Freud' legacy in our culture| this seminar aims at a systematic rereading of Freud's works by focusing the practice of the talking cure in the wake of questions posed by Lacan's French school. We will study the various channels through which Freudian ideas have permeated our culture. We shall read first Freud's groundbreaking book on dreams before engaging with a few clinical essays Dora: An analysis of a case of Hysteria| The Wolf Man| The Rat Man| The Psychotic Doctor Schreber| The Sexual Enlightenment of Children. We will survey meta-psychological texts like Leonardo da Vinci| Jokes| Civilization and Its Discontents| and Moses and Monotheism. Short weekly response paper| two ten page papers| one oral presentation.   
Singing in the Snow: History of Russian Song,RUSS-465,/coursehistories/2919,This course explores an aspect of the 20th-century novel intensively; specific course topics will vary from year to year.   See the English Department's website at www.english.upenn.edu for a description of the current offerings.   
Literary and Cultural History of Medieval Rus',RUSS-234,/coursehistories/3238,MGMT 230 integrates the material introduced in business fundamental courses andapplies it to the design and evaluation of new ventures. The purpose of this course is to explore the many dimensions of new venture creation and growth and to foster innovation and new business formations in independent and corporate settings. The course addresses both a theoretical perspective on venture initiation and the application of writing an actual business plan.   
Russian Modernism: Literature Music and Visual Arts,RUSS-417,/coursehistories/3239,The focus of this course is on analysis of the issues and options which must be faced in developing a successful technological venture and on the creation of a winning business plan. Particular attention is directed to the identi- fication of technology-based venture opportunities| evaluation of technical feasibility and commercial potential| and planning for successful commerciali- zation.   
Nationalism and Ethnic Conflict in Film,RUSS-430,/coursehistories/3240,Management 238 is the standard undergraduate course in Organizational Behavior. The course deals essentially with the management of people at work. It examines the individual employee in his organizational environment| as well as the organization itself. Topics range from motivation| leadership groups all the way to organization structure| culture| human resources and organizational change. The course develops some themes in which these topics become relevant -- for example the networking organization and diversity at the workplace. Students should expect to conduct group projects involving actual fieldwork and might be asked to give a presentation in class.   
Russian Utopia in Literature Film and Politics,RUSS-469,/coursehistories/3241,This course is designed to develop students' skills in effectively designing| leading and consulting to teams in organizations. This will be a highly interactive course with emphasis on class participation and experiential learning. One of the goals of this course is to provide both the conceptual understanding and the behavioral skills required to implement strategies. To this end| class sessions will make use of a variety of approaches to teaching and learning| including the case method| simulation exercises and lectures. We will cover topics such as leading groups| group formation and socialization| diversity| creativity| group problem solving and decision making| conflict and knowledge sharing. Students will leave this class with knowledge of how to most effectively lead a team as well as how to be an effective team member. [NOTE: Instructors may have different objectives for this course. Please see individual instructors' syllabi for further clarification.]   
ADV RUSSIAN FOR BUSINESS,RUSS-508,/coursehistories/3242,The objective of this course is to provide students with a number of opportunities to gain insights about the nature of outstanding| ordinarily effective| and ineffective moral and evil leadership. This will be accomplished by (a) reading social science studies| biographies| case historical accounts of leaders| and theoretical and philosophical writings about leadership| (b) watching video tapes about leaders and listening to audio tapes of interviews and speeches of leaders and reports of reactions of followers to leaders| (c) completion of leadership related exercises| and (d) class discussion.   
SOVIET CIVILIZATION,HIST-125,/coursehistories/3112,A survey of the development of American colonial society| 1607-1750| with emphasis on the regional differences between life in early New England| the Mid-Atlantic| and the South| as well as the relationships between British colonists| Native Americans| and African Americans.   
Russian Outside the Classroom II,RUSS-108,/coursehistories/3502,
