NAME,ALIAS,PATH,DESCRIPTION
Russia and Eastern Europe in International Affairs,RUSS-123,/coursehistories/6314,A democratic republic in crisis| debilitated by the corruption and ambition of its politicians| sinking into an increasingly bitter confrontation of two political parties - 2|000 years ago. In the first century BCE Rome faced many of the same political challenges we do today; and as in contemporary America| politicians relied on rhetoric and the art of spin to manipulate public opinion and win support. In this course we will be reading the speeches of Cicero| perhaps the greatest of the Roman orators and certainly one of the great figures in the history of rhetoric| and studying the kinds of strategies he used to advance his own career and the interests of his party.   
TARKOVSKY'S PASSIONS,RUSS-250,/coursehistories/6315,
The Living & the Dead: The Great Patriotic War in Russ Cultural Imagination,RUSS-455,/coursehistories/6316,Myths are traditional stories that have endured many years. Some of them have to do with events of great importance| such as the founding of a nation. Others tell the stories of great heroes and heroines and their exploits and courage over adversity. Still others are simple tales about otherwise unremarkable people who get into trouble or do some great deed. What are we to make of all these tales| and why do people seem to like to hear them? This course will focus on the myths of ancient Greece and Rome| as well as a contemporary American ones| as a way of exploring the nature of myth and the function it plays for individuals| societies| and nations. We will also pay some attention to the way the Greeks and Romans themselves understood their ownmyths. Are myths subtle codes that contain some universal truth? Are they a window on the deep recesses of a particular culture? Are they entertaining stories that people like to tell over and over? Are they a set of blinders that all of us wear| though we do not realize it? Investigate these questions a variety of topics creation of the universe between gods and mortals| religion and family| sex|love| madness| and death.   
History of Russian Literary Language and Culture,RUSS-519,/coursehistories/6317,We will take into account the development of the city of Athens from the Mycenaean period to Late Antiquity but will concentrate on the era when the city was at its height| from the sixth to fourth centuries B.C. We will examine the great public places--notably| the sanctuary of Athena on the Acropolis and the political and commercial core of the Agora--and will explore as well the neighborhoods with their private houses| small shrines| fountain houses and craft workshops.   We will also turn to the port of Peiraeus| which was so essential to Athens' trade and naval power and which in its layout and in the character of its population contrasted sharply with Athens itself.   
PORTRAITS OF OLD RUSSIA,RUSS-113,/coursehistories/6466,
COMMUNISM,RUSS-134,/coursehistories/6467,
DIGITAL HUMANITIES,COML-066,/coursehistories/6364,
Slavery Serfdom and Cultures of Bondage in the U.S. and Russia,RUSS-149,/coursehistories/6561,This course covers the finance of technological innovation| with a focus on the valuation tools useful in the venture capital industry. These tools include the "venture capital method|" comparables analysis| discounted cash flow analysis| Monte Carlo simulation| contingent-claims analysis| decision trees| and real options. The primary audience for this course is finance majors interested in careers in venture capital or in R&D-intensive companies in health care or information technology.   
READING RUSSIAN HISTORY,RUSS-408,/coursehistories/6562,This is a critical writing seminar. It fulfills the writing requirement for all undergraduates. As a discipline-based writing seminar| the course introduces students to a topic within its discipline but throughout emphasizes the development of critical thinking| analytical| and writing skills. For current listings and descriptions| visit the Critical Writing Program's website at www.writing.upenn.edu/critical.   
RUSSIAN POLITICS,PSCI-217,/coursehistories/1456,This course examines children's relationship to media in its historic| economic| political and social contexts. The class begins with an exploration of the ways in which "childhood" is created and understood as a time of life that is qualitatively unique and socially constructed over time. It continues with a review of various theories of child development as they inform children's relationship with and understanding of television and other household media. It next reviews public policies designed to empower parents and limit children's exposure to potentially problematic media content and simultaneously considers the economic forces that shape what children see and buy. Children and Media concludes with a critical examination of research on the impact of media on children's physical| cognitive| social and psychological development.   
