NAME,ALIAS,PATH,DESCRIPTION
RUSSIAN SONG & FOLKLORE,RUSS-419,/coursehistories/3503,This course is for students who want to acquire the linguistic skills necessary for communication in everyday situations and that would constitute a solid base for further study of the Polish language. In addition students will become acquainted with various aspects of Polish culture (including Polish films)| history and contemporary affairs. Students will learn through classroom exercises based on a modern textbook| completion of individual and group assignments and work with various audio and video materials. The textbook Hurra - Po Polsku 1 is written in the spirit of the communicative approach| which makes it possible to communicate from the very beginning of the learning process. The special attention| however| will be paid on systematic development of all language skills: listening| reading| speaking and writing.   
WINNRS/LOSRS IN LIT/FILM: WINNER/LOSERS FILM/LIT,RUSS-449,/coursehistories/3504,An introduction to the fundamentals of the Czech language| acquisition of conversational| reading and writing skills.   
RUSSIANS & FAIRY TALES: Psychology and Sociology in Fairy Tales,FOLK-306,/coursehistories/3386,A discussion of those concepts and techniques of classical analysis employed inphysical theories. Topics include complex analysis. Fourier series and transforms| ordinary and partial equations| Hilbert spaces| among others.   
RISE & FALL OF RUSS EMP,HIST-048,/coursehistories/3403,This course is an introduction to the major theories and issues in international politics. The goals of the course are to give students a broad familiarity with the field of international relations| and to help them develop the analytical skills necessary to think critically about international politics. The course is divided into four parts: 1) Concepts and Theories of International Relations; 2) War and Security; 3) The Global Economy; and 4) Emerging Issues in International Relations.   
FRANCE-AGE OF TWO WW'S,HIST-202,/coursehistories/591,
POST-SOVIET RUSS SOCIETY: People Business Democracy,RUSS-468,/coursehistories/3687,This first semester elementary language course is designed for sudents who have never studied Korean before or who have placed into the first semester level. The primary emphasis will be on development of oral-aural skills. Readings and frequent writing assignments are included in the course.   
RUSSIA IN THE 20TH CENT,HIST-049,/coursehistories/570,Out of an obscure| backward empire| the Soviet Union emerged to become the great political laboratory of the twentieth century. This course will trace the roots of the world's first socialist society and its attempts to recast human relations and human nature itself. Topics include the origins of the Revolution of 1917| the role of ideology in state policy and everyday life| the Soviet Union as the center of world communism| the challenge of ethnic diversity| and the reasons for the USSR's sudden implosion at the end of the century.Focusing on politics| society| culture| and their interaction| we will examine the rulers (from Lenin to Gorbachev) as well as the ruled (peasants| workers| and intellectuals; Russians and non-Russians). The course will feature discussions of selected texts| including primary sources in translation.   
20C RUS: FICTION&REALITY: 20th Century Russian Literature: Fiction & Reality,RUSS-461,/coursehistories/3783,Topic Varies.   
WAR & REPRESENTATION: War and its Representation in Russia Europe and the US,RUSS-193,/coursehistories/3932,This course examines children's relationship to media in its historic| economic| political and social contexts. The class begins with an exploration of the ways in which "childhood" is created and understood as a time of life that is qualitatively unique and socially constructed over time. It continues with a review of various theories of child development as they inform children's relationship with and understanding of television and other household media. It next reviews public policies designed to empower parents and limit children's exposure to potentially problematic media content and simultaneously considers the economic forces that shape what children see and buy. Children and Media concludes with a critical examination of research on the impact of media on children's physical| cognitive| social and psychological development.   
SAINTS & DEVILS RUSS LIT,RUSS-213,/coursehistories/3933,This course is an introduction to the field of political communication| conceptual approaches to analyzing communication in various forms| including advertising| speech making| campaign debates| and candidates' and office-holders' uses of news. The focus of this course is on the interplay in the U.S. between television and politics. The course includes a history of televised campaign practices from the 1952 presidential contest through the election of 2008.   
Portraits of Russian Society: Art Fiction Drama,RUSS-136,/coursehistories/4114,This class is designed to give students a foundation of basic skills needed to express ideas creatively in clay. Assignments will combine learning different approaches to art/sculpture making issue with clay forming and finishing techniques. Coil building| slab construction| pinching and tile making will be learn ed. Students will become familiar with basic glaze and slip surface treatments.The firing process will also be covered. Issues in historical and contemporaryceramics will be discussed. Instruction will center around demonstration| slidepresentations| individual and group critiques.   
RUSSIAN HUMOR,RUSS-464,/coursehistories/4115,The purpose of this beginning level ceramics class is to learn the skills needed to use the potter's wheel as a tool for object making. Traditional ceramic techniques such as centering the clay| pulling walls and trimming pots will be a focus. A variety of glazing and slip decoration methods will be covered. Slide discussions| field trips and readings will supplement the studio work. $80 Studio fee.   
Haunted House: Russian Realism in European Context,RUSS-544,/coursehistories/4116,Students will continue to develop the technical skills involved in the wheel throwing process. Using the wheel as a tool to make sculptural as well as functional objects will also be explored. Focus will be placed on students' creative and technical development. $80 Studio Fee.   
Once Upon A Fairy Tale: Introduction to Russian Culture,RUSS-100,/coursehistories/4407,The focus of this course is on analysis of the issues and options which must be faced in developing a successful technological venture and on the creation of a winning business plan. Particular attention is directed to the identi- fication of technology-based venture opportunities| evaluation of technical feasibility and commercial potential| and planning for successful commerciali- zation.   
Russian Music: Concert Hall to Dance Club,RUSS-194,/coursehistories/4408,This course examines the technical and managerial challenges presented by emerging and evolving technologies. Particular consideration is given to the forces affecting the nature and rate of technological innovation and the managerial options available to both established and entrepreneurial organizations. In doing so| we explore both internal and external sources of innovation as well as the appropriate strategies and processes for capitalizingon them. The course will be taught in seminar fashion with substantial class discussion. Assigned and supplementary readings will be augmented by cases and occasional guest lectures. Students will prepare a variety of written assignments| including case analyses and two research papers dealing with selected technologies| firms and industries.   
USSR AFTER STALIN,RUSS-260,/coursehistories/4409,Management 238 is the standard undergraduate course in Organizational Behavior. The course deals essentially with the management of people at work. It examines the individual employee in his organizational environment| as well as the organization itself. Topics range from motivation| leadership groups all the way to organization structure| culture| human resources and organizational change. The course develops some themes in which these topics become relevant -- for example the networking organization and diversity at the workplace. Students should expect to conduct group projects involving actual fieldwork and might be asked to give a presentation in class.   
DevelopmentDemocracy&Postsoc:Processes&Outcomes of Decentralizat. Reforms,RUSS-273,/coursehistories/4410,This course is designed to develop students' skills in effectively designing| leading and consulting to teams in organizations. This will be a highly interactive course with emphasis on class participation and experiential learning. One of the goals of this course is to provide both the conceptual understanding and the behavioral skills required to implement strategies. To this end| class sessions will make use of a variety of approaches to teaching and learning| including the case method| simulation exercises and lectures. We will cover topics such as leading groups| group formation and socialization| diversity| creativity| group problem solving and decision making| conflict and knowledge sharing. Students will leave this class with knowledge of how to most effectively lead a team as well as how to be an effective team member. [NOTE: Instructors may have different objectives for this course. Please see individual instructors' syllabi for further clarification.]   
Russian Culture and Society Now,RUSS-418,/coursehistories/4411,The objective of this course is to provide students with a number of opportunities to gain insights about the nature of outstanding| ordinarily effective| and ineffective moral and evil leadership. This will be accomplished by (a) reading social science studies| biographies| case historical accounts of leaders| and theoretical and philosophical writings about leadership| (b) watching video tapes about leaders and listening to audio tapes of interviews and speeches of leaders and reports of reactions of followers to leaders| (c) completion of leadership related exercises| and (d) class discussion.   
RUSS FILM 1900-1945,RUSS-164,/coursehistories/4664,This course is intended for students who have spoken Russian at home and seek to achieve proficiency in the language. Topics will include an intensive introduction to the Russian writing system and grammar| focusing on exciting materials and examples drawn from classic and contemporary Russian culture and social life. Students who complete this course in combination with RUSS361 satisfy the Penn Language Requirement.   
RUSS FOLK AND LIT TALE,RUSS-410,/coursehistories/4665,Introduction to the analysis of poetic texts| based on the works of Batyushkov| Lermontov| Tyutchev| Fet| Mandelshtam| and others.   
MASTERWORKS RUSS VIS ART,RUSS-462,/coursehistories/4666,This course continues developing students' advanced skills in Russian| and combines advanced study of the Russian language with an examination of the fundamental literary movements and figures of nineteenth-century Russian literature and culture. Course materials include prosaic and poetic texts by Pushkin| Gogol'| Lermontov| Dostoevsky| Tolstoy| Chekhov| as well as films and art. Language work will be devoted to writing| syntactical and stylistic analysis| vocabulary| academic speech| and listening comprehension.   
Russian History in Animation,RUSS-470,/coursehistories/4844,The Elementary Twi I course can be taken to fulfill a language requirement| or for linguistic preparation to do research on Ghana/Africa-related topics. The course emphasizes communicative competence to enable the students to acquire linguistic and extra-linguistic skills in Twi. The content of the course is selected from various everyday life situations to enable the students to communicate in predictable common daily settings. Culture| as it relates to language use| is also a part of the course content.   Students will acquire the speaking| listening| reading and writing skills at the mid-high novice level| based on the ACTFL scale. The mid-high novice level proficiency skills that the students will acquire constitute threshold capabilities of the second semester range of proficiency to prepare students for Elementary Twi II course materials.   
PORTRAITS SOV SOCIETY,RUSS-187,/coursehistories/5038,This course is designed to teach undergraduates the fundamentals of clinical research| focusing on research design| data collection| database construction| and statistical analysis. This course stresses independent thinking and professional responsibility. Students will work closely with staff in the Emergency Department.   
The Life and Art of Anton Chekhov,RUSS-421,/coursehistories/5039,Advanced research in Emergency Medicine.   
TOPICS IN EUROPEAN HIST: Jews Witches & Others in Eastern Europe,HIST-230,/coursehistories/5124,This is a critical writing seminar. It fulfills the writing requirement for all undergraduates. As a discipline-based writing seminar| the course introduces students to a topic within its discipline but throughout emphasizes the development of critical thinking| analytical| and writing skills. For current listings and descriptions| visit the Critical Writing Program's website at www.writing.upenn.edu/critical.   
SOVIET & POST-SOV ECON,RUSS-189,/coursehistories/5264,Images and the figures of speech called imagery bring language to life and abstract ideas to light in the mind. They are what create the physical world of fiction and convey the subjective realities of poems and the arguments of essays. In this workshop we will explore the intersection between writing and the visual arts suggested by Simonides de Keos in the 5th century B.C.E. (Poetry is a speaking picture| painting a silent poetry) and echoed above in Horace's famous dictum. We will look at some of the theory behind the "sister arts" and the two forms of description which unite them: literal and figurative. Mostly we will examine and play with the language of images and the transfer of categories of meaning which metaphor and it's attendant likenesses govern| along with the image's great project: animation--the ultimate sense of the real. We will read poems| stories| portions of plays| and essays by writers as diverse as Seamus Heaney| Kate Chopin| Milan Kundeers| Annie Dillard| Yusef Komunyakka| Shakespeare| Susan Sontag| and Susan Minot. Students will write weekly and participate in weekly peer review. Revision is expected. This is a workshop that will teach writers of all genres to write persuasively and evocatively.   See the English Department's website at www.english.upenn.edu for a descripion of the current offerings.   
CONTEMP RUSS THRGH FILM,RUSS-420,/coursehistories/5265,In the 16th and 17th centuries it was an almost universally held belief that women should never rule over men. However| the existence of three regnant queens Mary Tudor| Mary Stuart and Elizabeth I inescapably belied this central principle of social order. How did men and women of the period reconcile themselves to female rule| or did they? How did queens construct their public personae in order to maintain Their power? What portrayals of ruling women were employed by queens'opponents? How do political ideologists| conflicting religious beliefs| adn the pressure of dynastic struggle effect the question of female rule?   
Russian Awakenings: Western Mysticism & Nineteenth-century Russian Culture,RUSS-541,/coursehistories/5266,Introduction to probability. Expectation. Variance. Covariance. Joint probability. Moment generating functions. Stochastic models and applications. Markov chains. Renewal processes. Queuing models. Statistical inference. Linear regression. Computational probability. Discrete-event simulation.   
WAR AND REPRESENTATION,COML-150,/coursehistories/5197,
COLD WAR: GLOBAL HISTORY,HIST-135,/coursehistories/5226,Some versions of this course survey American poetry from the colonial period to the present| while others begin with Whitman and Dickinson and move directly into the 20th century and beyond. Typically students read and discuss the poetry of Williams| Stein| Niedecker| H.D.| Pound| Stevens| Fearing| Rakoksi| McKay| Cullen| Wilbur| Plath| Rich| Ginsberg| Kerouac| Waldman| Creeley| Ashberry| O'Hara| Corman| Bernstein| Howe| Perelman| Silliman| and Retallack.   See the English Department's website at www.english.upenn.edu for a description of the current offerings.   
ADULTERY NOVEL,COML-127,/coursehistories/5281,Basic ideas of probability theory. Combinatorics. Random variables and functions of random variables. Means| moments and generating functions. Order statistics and special distributions. Inequalities and the central limit theorem.   
POLITICS OF RUSS HISTORY,RUSS-409,/coursehistories/5355,This is a critical writing seminar. It fulfills the writing requirement for all undergraduates. As a discipline-based writing seminar| the course introduces students to a topic within its discipline but throughout emphasizes the development of critical thinking| analytical| and writing skills. For current listings and descriptions| visit the Critical Writing Program's website at www.writing.upenn.edu/critical.   
RUSSIAN POETICS,RUSS-485,/coursehistories/5475,What is disease? In this seminar students will ask and answer this question by analyzing historical documents| scientific reports| and historical scholarship (primarily 19th and 20th century U.S. and European). We will look at disease from multiple perspectives -- as a biological process| clinical entity| population phenomenon| historical actor and personal experience. We will pay special attention to how diseases have been recognized| diagnosed| named and classified in different eras| cultures and professional settings.   
HOLOCAUST & SOVIET UNION,HIST-333,/coursehistories/1911,This course explores the intersection of international strategy and international relations to help students to identify and introduce sustainable and profitable business strategies in sectors with a history of or strong potential for ongoing political intervention. We will examine the identity| background| incentives and operations of relevant national and international political actors; and the process by which they generates policies that can adversely or favorably influence firm profitability. Corporations whose success depends crucially on a sophisticated analysis of the contending forces in the geopolitical arena and an ability to influence policy outcomes will serve as examples of the first-order strategic importance of incorporating the political environment in multinational strategy formulation.   
Poetics of Screenplay: The Art of Plotting,RUSS-111,/coursehistories/5592,This course explores the role of mergers and acquisitions and alternative methods of corporate development in advancing the strategies of operating business. Emphasis is on the way companies use acquisitions to alter business mixes; seize opportunities in new products| technologies and markets; enhance competitive positioning; adjust to changing economics| and promote value-creating growth. Although the course will emphasize strategic acquisitions| it also will explore leveraged buy-outs and hostile financial acquisitions as well as their influence on corporate buyers.   
PUSHKIN,RUSS-506,/coursehistories/5593,This course offers students a unique opportunity to develop consulting skills and entrepreneurial expertise by working as consultants to thriving entrepreneurial ventures in the Philadelphia area. This capstone course combines both fieldwork and class work and allows students to apply knowledge and skills acquired through other course work to real world issues that must be addressed by operating companies. An understanding of characteristics producing rapid entrepreneurial growth and skills related to effective communications and management of a business relationship are emphasized.   
RUSSIA AND THE EAST: Imagining Asia: Russia and the East,RUSS-222,/coursehistories/5728,A survey of classical Greek approaches to questions about knowledge| the natureof the world| the soul| ethics| and politics. Will focus on Socrates| Plato| and Aristotle.   
From Late-Soviet to Non-Soviet Literature and Culture,RUSS-528,/coursehistories/5729,The explosion of scientific knowledge in early modern Europe cast doubt not only on the medieval worldview but also on its assumption of a theological guarantee for the possibility of human knowledge. Thus modern philosophers had to begin the project of establishing standards and foundations for human knowledge without a divine guarantee. The Reformation and the growth of secular states in the sixteenth and seventeenth centuries presented a similar challenge for modern moral and political philosophy| which thus faced the challenge of establishing norms for human conduct and their foundation without divine commands. We shall examine how the leading philosophers of modern times confronted these challenges| focusing primarily on the challenge for modern theories of knowledge but also considering at least some of the parallel developments in modern moral philosophy. Readings will include selections from Descartes| Leibniz| Locke| Berkeley| Hume| Kant| and in the nineteenth century| the great American philosopher Charles Sanders Peirce.   Written work will include several short papers and a final examination. Attendance at both lectures and discussion sections will be required| and participation in both can also count towards final grades.   
LECTURE,GRMN-256,/coursehistories/553,For centuries the pact with the devil has signified humankind's desire to surpass the limits of human knowledge and power. From the reformation chap book to the rock lyrics of Randy Newman's Faust| from Marlowe and Goethe to key Hollywood films| the legend of the devil's pact continues to be useful for exploring our fascination with forbidden powers.   
REPRESENTING HISTORY,RUSS-195,/coursehistories/5838,Since September 11| 2001| America has become more aware than ever that there is a connection between religion and violence. But what is it? Why do religious people embrace violence? Are all cults prone to violence? And do terrorists tend to belong to cults? This course will introduce students to representative terrorist groups from five different religious traditions and to cults that have taken the path of group suicide. We will examine a number of ways to understand religious terrorism| religious suicide| and cult affiliation in general.   
DR ZHIVAGO IN HIST CONTX,RUSS-475,/coursehistories/5839,This is a critical writing seminar. It fulfills the writing requirement for all undergraduates. As a discipline-based writing seminar| the course introduces students to a topic within its discipline but throughout emphasizes the development of critical thinking| analytical| and writing skills. For current listings and descriptions| visit the Critical Writing Program's website at www.writing.upenn.edu/critical.   
History of Emotions: Russia and the West,RUSS-555,/coursehistories/5840,An introduction to psychological interpretations of religious belief| experience| and behavior. Emphasis upon such major theorists as James| Freud| Jung and Allport. More recent investigations (e.g.| psychohistory| stages of religious development| religious roots of psychoanalysis| transpersonal psychologies| parapsychological research) will occasionally be included. No prerequisites.   
NAPOLEONIC ERA & TOLSTOY,RUSS-240,/coursehistories/6080,Careful textual study of a book of the Hebrew Bible ("Old Testament") as a literary and religious work in the light of modern scholarship| ancient Near Eastern documents| and comparative literature and religion. The book varies from year to year.   
Putin's Russia: Culture Society and History,RUSS-191,/coursehistories/6204,An examination of the origin and evolution of life in the Universe. This class is intended for non-majors and has no specific required science or math preparation beyond high school levels. Course material includes aspects of biology| geology| astronomy| physics| and chemistry as well as the study of and search for life in our Solar System (Mars| Europa) and elsewhere in the Universe. The origin of life on Earth and the range of extreme conditions in which life on Earth exists today will also be studied. Students will be asked to synthesize course material from lectures| readings| laboratory exercises| and homeworks to form an understanding of origin of life on Earth and the prospects for life elsewhere.   
RUSSIAN THINKERS,RUSS-261,/coursehistories/6205,An introductory course for freshmen who do not intend to major in a physical science or engineering| covering theories of the Universe ranging from the ancient perspective to the contemporary hot big bang model| including some notions of Einstein's special and general theories of relativity. Topics will include the solar system| stars| black holes| galaxies| and the structure| origin and future of the Universe itself. Elementary algebra is used. Fulfills quantitative data analysis requirement.   
MOSCOW: THE CULTURAL HISTORY,RUSS-471,/coursehistories/6206,A basic course for majors in astronomy| in other physical sciences| and in engineering. Stars| galaxies| and the evolution of the universe.   
RUSS DEAD POETS SOCIETY,RUSS-545,/coursehistories/6207,Techniques of modern astronomical observations| including: detection of light from the radio through gamma rays; sources of noise in astronomical measurements; image analysis and reduction techniques; telescope optics and adaptive optics; spectroscopic measurements; radio interferometry and spectroscopy.   
