NAME,ALIAS,PATH,DESCRIPTION
TRAD MEDICINE IN S.A.,SARS-412,/coursehistories/1502,Introduction to theory of international trade and international monetary economics. The theoretical background is used as a basis for discussion of policy issues| patterns of international trade and production| gains from trade| tariffs| and other impediments to trade| foreign exchange markets| measures of balance of payments| effects of monetary and fiscal policy| and devaluation and systems for the settlement of international payments.   
ISLAMIC MYSTICISM IN SA,SARS-416,/coursehistories/1503,Basic concepts in analysis of economic systems. Course begins with an examination of the new institutional economics literature focusing on property rights| transaction costs| and evolutionary economics. This is followed by a discussion of market economies including the U.S.| Japan| and Germany; and a discussion of the planned economies| primarily Russia and China| and their transition toward market systems.   
ARTS OF AFGHAN. & TIBET,ARTH-211,/coursehistories/1219,This course is intended as an introduction to the history of Chinese thought. The first part of the course is devoted to China's philosopical awakening in the 5th to 3rd centuries B.C. All subsequent philosophy continually returned to the problems defined during this formative period. We shall examine the various schools and thinkers of the time| and the ways in which representatives of different opinions reacted to each other.   Next we follow the current of Chinese thought leading to the Confucian revival of the T'ang and Sung dynasties. This portion of the course culminates in an extensive examination of the philosophy of Chu Hsi (1130-1200)| the most influential Neo-Confucian thinker. After considering some alternatives to Chu Hsi's vision put forward in later centuries| we assess the viability of Chinese thought in a modern context.   
LIT & SOCIETY,ENGL-093,/coursehistories/393,English is a global language with a distinctly imperial history| and this course serves as an essential introduction to literary works produced in or about the former European colonies. The focus will be poetry| film| fiction and non fiction and at least two geographic areas spanning the Americas| South Asia| the Caribbean and Africa as they reflect the impact of colonial rule on the cultural representations of identity| nationalism| race| class and gender.   See the English Department's website at www.english.upenn.edu for a description of the current offerings.   
MAJ SEM WORLD AFT 1800: CHINESE WOMEN'S HIST,HIST-206,/coursehistories/595,
GENDER MODERN SOUTH ASIA,SARS-224,/coursehistories/1592,
BEGINNING TABLA I,SARS-060,/coursehistories/2119,This is an advanced seminar that addresses the role of business in the U.S. political system| how that role has changed over time| and the relationship between business and other important political actors| including the executive branch| the legislature| organized labor| and public-interest groups| in the U.S. and other countries.   
BEGINNING SITAR I,SARS-061,/coursehistories/2120,
WOMEN & HEALTH IN S.ASIA,SARS-109,/coursehistories/2121,A systematic inquiry into the King James Version of the Bible as one of the most comprehensive and influential works of political theory ever set forth. The bible embodies a competitive series of narrative| developmental| and justificatory accounts of the origins and nature of well ordered community that encompasses founding| covenant| peoplehood| authority| law| history| and human relationships -- along with the prospect of modeling the life of a People according to a central text.   
MUSLIM CULTURE:S ASIA,SARS-204,/coursehistories/2122,Consult department for detailed descriptions. Recent topics include: Globalization; Race & Criminal Justice; Democracy & Markets in Postcommunist Europe.   
READINGS IN HINDI,SARS-215,/coursehistories/2123,
SECOND YEAR SANSKRIT,SARS-403,/coursehistories/2124,This course concerns the political economy of "North-South" relations. The seminar will investigate key concepts and perspectives about the political economy of North-South relations by examining a variety of attempts at economic transformation in Asia| Latin America| Africa| and Eastern Europe.   
LANGUAGE POLICY,SARS-543,/coursehistories/2125,A consideration of the virtues and vices of liberalism through a study of the works of a few political philosophers who recommend| seek to improve| or criticize it. This course will alternate with PSCI 580.   
RAPID RDG IN SANSKRIT,AMES-502,/coursehistories/98,Reading of selected texts.   
WRITING ABOUT ANTHRO: COMING OF AGE IN AMERICA,ANTH-009,/coursehistories/113,This is a critical writing seminar. It fulfills the writing requirement for all undergraduates. As a discipline-based writing seminar| the course introduces students to a topic within its discipline but throughout emphasizes the development of critical thinking| analytical| and writing skills. For current listings and descriptions| visit the Critical Writing Program's website at www.writing.upenn.edu/critical.   
ARCHAEOLOGY OF SO ASIA,ANTH-202,/coursehistories/1638,Students work directly from the nude model and focus on its articulation through an understanding of anatomical structure and function. Students will investigate a broad variety of drawing techniques and materials. The model will be used as the sole element in composition and as a contextualized element.   
ART OF ASIA:INDIAS.EAST,ARTH-104,/coursehistories/1665,This course provides a study of the cultures of Ireland| England| Scotland| and Wales from the perspectives of anthropology/ethnology| literature| and popular culture. Topics include contemporary re-inventions of the Celtic and Anglo-Saxon past; national identity--troubles on the borders; post-colonialism; and the world-wide Irish diaspora (especially to North America| England| and Australia). Among other issues| we will explore problems of language loss| retention| and revival; the theme of exile and the experience of immigration in memoirs| literature| and folksong; and the marketing of culture for the tourist trade.   
ECONOMIC HIST OF INDIA,ECON-027,/coursehistories/1787,
INTRO TO HINDUISM,RELS-163,/coursehistories/2104,This course examines the dynamics of political and economic change in twentieth century Latin America| with the goal of achieving an understanding of contemporary politics in the region. We will analyze topics such as the incorporation of the region to the international economy and the consolidation of oligarchic states (1880s to 1930s)| corporatism| populism| and elict pacts (1930s and 1940s)| social revolution| democratic breakdown| and military rule (1960s and 1970s)| transitions to democracy and human rights advocacy (1980s)| makret-oriented reforms (1990s)| and the turn to the left of current governments (2000s). The course will draw primarily from the experiences of Argentina| Brazil| Colombia| Chile and Mexico. No prior knowledge of the region is required.   
WRITING:INDIAN AM EXP,SARS-009,/coursehistories/2414,After a rapid review of the basic techniques for solving equations| the course will discuss one or more of the following topics: stability of linear and nonlinear systems| boundary value problems and orthogonal functions| numerical techniques| Laplace transform methods.   
ADVANCED URDU: ADV. URDU: THE GHAZAL,SARS-223,/coursehistories/2415,Informal introduction to such subjects as enumeration| the Riordan group and selected integer sequences| i.e.| Catalan| Schroeder and Motzkin numbers.   
MEDIA & SOCIETY S. ASIA,SARS-253,/coursehistories/2416,
ADVANCED PANJABI,SARS-284,/coursehistories/2417,
BEGINNING TELUGU,SARS-296,/coursehistories/2418,
ELEMENTARY SANSKRIT,SARS-400,/coursehistories/2419,"In this historical survey| students learn to listen analytically| historically| and creatively to music from the Middle Ages to the present day. A wide range of musical repertories including plainchant| opera| orchestral music| and chamber music is covered. Composers studied include Bach| Mozart| Beethoven| Verdi| and Wagner. No prior musical knowledge is required.   
Mysterious Histories: Seminar in History & Religion,SARS-433,/coursehistories/2420,Concepts of General Chemistry basic to the understanding of the health related sciences. Principles of atomic structure| chemical bonding| chemical and nuclear reactions| acids| bases| and chemical equilibria will be included. Fundamentals of Organic nomenclature and a survey of the physical| chemical and biological properties of the main organic functional groups.   
Rapid Readings in Sanskrit Poetry,SARS-541,/coursehistories/2421,Introduction to the roles of the professional nurse. Content includes overview of health care delivery systems and nursing's multiple roles in those systems; history of nursing; preparation for roles assumed by professional nurses; and the philosophy of this School of Nursing. Emphasis will be placed on assistingstudents to understand the nature of nurses' work and their contributions to promoting and maintaining the health status of individuals and groups.   
Readings in Sanskrit Philosophical Literature: Mimamsa,SARS-551,/coursehistories/2422,This introductory clinical course deals with health promotion and disease prevention with healthy and at-risk individuals in the community. Students will address the theoretical component of the course in weekly seminars. The clinical component focuses on the communication techniques and basic clinical skills and technologies used to assess health status| promote health and prevent illness. Students then integrate theoretical concepts and clinical skills and apply them in a variety of community settings| focusing on health promotion and disease prevention with healthy and at-risk individuals.   
ISLAM IN S.ASIAN CULTURE,ANTH-142,/coursehistories/2210,The course will examine the process of health care planning and policy in the major South Asian societies since the 1950s. The role of central| state and local government and non-governmental agencies| as well as of international organizations in health care planning will be analyzed. Topics will include medical services and facilities| preventative and public health| training of health care professionals| and public/private financing of health care. Specialized needs of women| children| disabled| and aged will be considered. The influence of political| economic| and socio-cultural aspects of South Asian societies on health services will be identified.   
PROBLEMS ARCHY SO. ASIA,ANTH-501,/coursehistories/2221,The course serves as an introduction to the study of population and demography| including issues pertaining to fertility| mortality| migration| and family formation and structure. Within these broad areas we consider the social| economic| and political implications of current trends| including: population explosion| baby bust| the impact of international migration on receiving societies| population aging| racial classification| growing diversity in household composition and family structure| population and environmental degradation| and the link between population and development/poverty.   
Cities and Temples in Ancient India,ARTH-212,/coursehistories/2223,This course is a comprehensive introduction to the sociological study of urban areas. This includes more general topics as the rise of cities and theories urbanism| as well as more specific areas of inquiry| including American urbanism| segregation| urban poverty| suburbanization and sprawl| neighborhoods and crime| and immigrant ghettos. The course will also devote significant attention to globalization and the process of urbanization in less developed counties.   
TOPICS IN LITERATURE: The Ancients and Shakespeare on Justice and Happiness,ENGL-016,/coursehistories/378,Freshman Seminars under the title "Topics in Literature" will afford entering students who are considering literary study as their major the opportunity to explore a particular and limited subject with a professor whose current work lies in that area. Topics may range from the lyric poems of Shakespeare's period to the ethnic fiction of contemporary America. Small class-size will insure all students the opportunity to participate in lively discussions. Students may expect frequent and extensive writing assignments| but these seminars are not writing courses; rather| they are intensive introductions to the serious study of literature. One of them may be counted toward the English major and may be applied to a period| genre| or thematic requirement within the major.   See the English Department's website at www.english.upenn.edu for a description of the current offerings.   
SOCIETY & POLIT IN INDIA,PSCI-511,/coursehistories/2094,This course is intended to introduce students to the national institutions and political processes of American government. What are the historical and philosophical foundations of the American Republic? How does American public policy get made| who makes it| and who benefits? Is a constitutional fabric woven in 1787 good enough for today? How| if at all| should American government be changed| and why? What is politics and why bother to study it? If these sorts of questions interest you| then this course will be a congenial home. It is designed to explore such questions while teaching students the basics of American politics and government.   
RELIGS OF SOUTHERN INDIA,RELS-562,/coursehistories/992,Critical examination of selected problem areas in the interpretation of religious texts| traditions| institutions| and practices in South and Southeast Asia.   
Intermediate North Indian Instrumental Performance,SARS-161,/coursehistories/2681,Fundamentals of Behavioral Medicine concerns itself with the description of ideology| disease and treatment from the perspective of a functional analyses. It is the intent of this course to extend the traditional structural analysis that traditional medicine provides.   
INTERMEDIATE TELUGU,SARS-312,/coursehistories/2682,This course is designed to teach undergraduates the fundamentals of clinical research| focusing on research design| data collection| database construction| and statistical analysis. This course stresses independent thinking and professional responsibility. Students will work closely with staff in the Emergency Department.   
INDIA: ANCIENT & MODERN,ANTH-024,/coursehistories/2459,This course draws on fictional| cinematic and mass-media representation of terrorism based on Russian as well as Western examples. We study how the magnitude of the political impact of terrorism relates to the historically changing means of production of its striking iconology. The course exposes students to major modes of imagining| narrating| showing| reenacting terrorism and forging its mystique. We examine the emergence of organized terrorism in nineteenth-century Russia as an original political-cultural phenomenon. We trace its rapid expansion and influence on the public life in the West| and on the Balkans.   Historical| political| and aesthetic approaches converge in a discussion of several case studies related to intellectual and spiritual movements such as nihilism| anarchism| populism| religious fundamentalism| and others. The public appearance of the terrorist activism and its major attributes are viewed as powerful intensifiers of its political effect: self-denial| ascetic aura| and stratagem of mystification| underground mentality| and martyrdom. The pedagogical goal of this course is to promote and cultivate critical view and analytical skills that will enable students to deal with different historical as well as cultural modes of (self-)representation of terrorism. Students are expected to learn and be able to deal with a large body of historical-factual and creative-interpreted information.   
S ASIA:  ANTHS & HISTS,ANTH-233,/coursehistories/2462,Sociology provides a unique way to look at human behavior and social interaction. Sociology is the systematic study of the groups and societies in which people live. In this introductory course| we analyze how social structures and cultures are created| maintained| and changed| and how they affect lives of individuals. In this course| we will reconsider our taken for granted world and examine what theory and research can tell us about our social world.   
TOPICS IN ASIAN-AM STDS,ASAM-150,/coursehistories/2474,Over the past two decades| the public imagination has been gripped by the concept of globalization. Scholars| corporations| advertisers and government officials have latched onto this idea as a defining feature of our current era.These various constituencies use globalization not only to account for epochal shifts in our economy and society| but also to justify new types of business strategy and public policy. This course will examine three interlinked dimensions of globalization: Global economic processes (e.g. the transnational operations of multinational firms that have given rise to a new international division of labor); cultural globalization (e.g. the spread of American brands like Coca Cola| Nike and Hollywood films)| and political globalization (e.g. the rise of supranational organizations like the IMF| World Bank and WTO that promote the idea of free markets).   Moreover| we will study globalization in the context of cities because| given their centrality to globalization processes| it is in cities that we can best understand how globalization takes place. In cities| we can study the global economic processes that restructure urban space| giving rise to new financial districts| international art exhibits and post-modern architecture and entrepreneurial strategies that seek to elevate cities to world city status. The course will examine these processes in a comparative light| contrasting urban globalization processes in Europe and North America with those in Latin America| Asia and Africa.   
INTRO BUDDHISM,RELS-173,/coursehistories/979,This course seeks to introduce students to the diversity of doctrines held and practices performed by Buddhists in Asia. By focusing on how specific beliefs and practices are tied to particular locations and particular times| we will be able to explore in detail the religious institutions| artistic| architectural| and musical traditions| textual production and legal and doctrinal developments of Buddhism over time and within its socio-historical context. Religion is never divorced from its place and its time. Furthermore| by geographically and historically grounding the study of these religions we will be able to examine how their individual ethic| cosmological and soteriological systems effect local history| economics| politics| and material culture. We will concentrate first on the person of the Budda| his many biographies and how he has been followed and worshipped in a variety of ways from Lhasa| Tibet to Phrae| Thailand. From there we touch on the foundational techings of the Buddha with an eye to how they have evolved and transformed over time. Finally| we focus on the practice of Buddhist ritual| magic and ethics in monasteries and among aly communities in Asia and even in the West. This section will confront the way Buddhists have thought of issues such as "Just-War|" Women's Rights and Abortion.   While no one quarter course could provide a detailed presentation of the beliefs and practices of Buddhism| my hope is that we will be able to look closely at certain aspects of these religions by focusing on how they are practiced in places like Nara| Japan or Vientianne| Laos.   
THERAVADA BUDDHIST TEXTS,RELS-573,/coursehistories/2675,The goal of this course is to introduce students quantitative concepts in understanding and manipulating the behavior of biological cells. We will try to understand the interplay between molecules in cells and cell function. A particular focus is on receptors - cell surface molecules that mediate cell responses. We will also try to understand processes such as adhesion| motility| cytoskeleton| signal transduction| differentiation| and gene regulation.   
The Cultural Legacies of South Asia: Part II,SARS-102,/coursehistories/2920,This course traces the literary dimension of one of America's many religious traditions| that of Protestant New England| from the Puritans to today.   
MUSICAL CULTURE N. INDIA,SARS-166,/coursehistories/2921,This course explores an aspect of American literature intensively; specific course topics will vary| and have included "American Authors and the Imagined Past" and "American Gothic."   See the English Department's website at www.english.upenn.edu for a description of the current offerings.   
Readings in Urdu: The Marsiya,SARS-225,/coursehistories/2922,This course explores an aspect of cultural studies intensively; specific course topics vary from year to year.   See the English Department's website at www.english.upenn.edu for a description of the current offerings.   
WHO ARE THE DRAVIDIANS?,SARS-238,/coursehistories/2923,
TRUTH AND CONCEALMENT,SARS-559,/coursehistories/2924,In the 16th and 17th centuries it was an almost universally held belief that women should never rule over men. However| the existence of three regnant queens Mary Tudor| Mary Stuart and Elizabeth I inescapably belied this central principle of social order. How did men and women of the period reconcile themselves to female rule| or did they? How did queens construct their public personae in order to maintain Their power? What portrayals of ruling women were employed by queens'opponents? How do political ideologists| conflicting religious beliefs| adn the pressure of dynastic struggle effect the question of female rule?   
ANTH & THE MODERN WORLD: AFGHANISTAN & ISLAMISM,ANTH-100,/coursehistories/1195,This course provides an introduction to the society| culture and history of ancient Egypt. The objective of the course is to provide an understanding of the characteristics of the civilization of ancient Egypt and how that ancient society succeeded as one of the most successful and long-lived civilizations in world history.   
POLITICS OF THE PAST,ANTH-208,/coursehistories/2723,An advanced course for students who have had AP Chemistry in high school. Included in the course coverage are: quantum mechanics of atoms| molecules and crystalline solids; statistical mechanics of gases| liquids| and solids; and coordination chemistry.   
Art and Narrative in Mughal India,ARTH-411,/coursehistories/2741,
TOPICS LIT & SOCIETY: Race Space and Law in the 19th Century United States,ENGL-293,/coursehistories/425,This course explores an aspect of Postcolonial literature intensively; specific course topics vary from year to year.   See the English Department's website at www.english.upenn.edu for a description of the current offerings.   
