NAME,ALIAS,PATH,DESCRIPTION
INDIANS O'SEAS:GLBL VW,SARS-012,/coursehistories/1003,This course is about the history of Indian immigration into different parts of the world. The course will consist of readings| discussions| observations| data collection and analysis. The topics will include cultural preservation and cultural change through generations| especially in North America| the Caribbean| the United Kingdom| and the African continent. The course will encourage organized thinking| observations and analysis of components of culture that immigrant communities are able to preserve in the long run and cultural components that undergo change or get reinterpreted. In this context| we will look at entities such as religion| food| language| and family. The course will include immigrants' success stories| their contributions| thier relationship with others groups in the new society andthe nature and extent of their links with India. The course will also address conflict with other sections of the host society| including discrimination against and victimization of immigrants. Other issues will include new social and cultural concerns of immigrants and the rise of new community organizations such as temples and cultural organizations to address those issues. The course will benefit from the study of other immigrant communities around the world.   
BEGINNING TABLA II,SARS-062,/coursehistories/1004,A continuation of Tabla I| also open to beginning students| speak to the instructor.   
BEGINNING SITAR II,SARS-063,/coursehistories/1005,This is the second semester of a beginning performance course in North Indian sitar. Students who have not taken the first semester but have experience with any musical instrument are permitted to join. Fundamentals of sitar technique| composition and improvisation are presented and practiced in class. Performance practice is supplemented by lectures| readings| and audio and video material on selected topics in North Indian musical culture. Each student is expected to put in two hours of practice per week| and complete reading| audio and written assignments. The class gives a group performance at the end of the semester.   
LEGACY OF INDIA,SARS-101,/coursehistories/1006,The course will give an overview of the rich cultural history and legacies of South Asia from the beginnings til ca. AD 1200. Highlights of South Asian religious and philsophical thought| literature and art will be considered and discussed against a background of political and social history.   
INDIAN PHILOSOPHY,SARS-103,/coursehistories/1007,The fundamentals of Hindu and Buddhist philosophy| the main patterns of Western response to it| and some basic questions of "comparative philosophy". Selected readings from classical Indian texts in English translation.   
PERFORM ARTS SOUTH ASIA,SARS-165,/coursehistories/1008,This course is a survey of selected traditions of theater| music| and dance in India and surrounding regions. Topics include ritual practices| theater| classical dance| classical music| devotional music| regional genres| and contemporary popular musics. Readings and lectures are supplemented by audio and visual materials and live performances. The aim of the course is to expose students to a variety of performance practices from this part of the world and to situate the performing arts in their social and cultural contexts. The course has no prerequisites.   
INDIAN CINEMA & SOCIETY,SARS-205,/coursehistories/1009,This course will meet for three hours to view and discuss a variety of films/videos in Hindi| Tamil| Bengali| Urdu (with English subtitles)| and English| which bring up issues of social| political| and cultural significance. Readings for the course will include articles in various fields ranging from film studies and communication to sociolinguistics and women's studies. Discussions will focus on cinema as a means of expression and as an instrument for social change| examining the various ways in which films both reflect and influence contemporary culture.   
SOUTH ASIANS IN THE US,SARS-206,/coursehistories/1010,This course begins with a historical survey of South Asian immigration in the United States. It continues with a broad look at cultural| social| and political issues which confront the South Asian American community today| issues such as citizenship and transnationality| minoritization| economic opportunity| cultural and religious maintenance and adaptation| changes in family structure and gender roles| and generational shifts. It concludes with an examination of the emergence of a body of creative writings by South Asians in America as an expatriate Indian literature of exile and as American immigrant and ethnic literature.   
BEGINNING HINDI-URDU,SARS-210,/coursehistories/1011,The course aims at developing an interactive speaking ability on everyday topics. At this stage there is less emphasis on developing reading and writing skills. The target language is presented in its sociocultural context including body language. For achieving a meaningful and operational control of the language| students acquire basic rules of the language and its use| and a basic vocabulary of about 1200 words. In addition| students learn two scripts: Devanagari script for Hindi in Fall and Nastaliq script for Urdu in Spring. Authentic and simulated video materials are used to bring the South Asian culture live to the classroom. Class activities include watching videos| singing| role-playing| language games and group work.   
INTERMEDIATE HINDI,SARS-212,/coursehistories/1012,In Intermediate Hindi the student continues to develop the four language skills| with an emphasis on real-life situations--through hearing and practicing conversation on everyday topics| reading a variety of authentic texts ranging from advertisements to short stories| watching segments of current films| and carrying out short research projects using Hindi sources. There is a strong emphasis on vocabulary development and on using contextually appropriate styles of spoken and written Hindi.   This course presupposes a knowledge of oral and literacy skills covered in Beginning Hindi. In order to get a passing grade at the end of two semesters| students enrolled in SARS 212 must achieve a level of Intermediate-Mid in all four skills (speaking| listening| reading| and writing). This fulfills the undergraduate language requirement. Students enrolled in SARS 512 must demonstrate a level of Intermediate-High in at least one skill| and Intermediate-Mid in the other three.   
ADVANCED HINDI,SARS-214,/coursehistories/1013,Advanced Hindi aims at systematically developing higher level linguistic functions and cultural nuances. Students learn to describe| narrate and support opinions in informal and formal styles. The objective of the course is to promote a meaningful interaction with written literature and with native speakers in a socially acceptable manner in a variety of simple and complicated situations. A variety of authentic materials are used| such as short stories| plays| newspapers| magazines| videos| television and radio broadcasts| and interviews. Every semester the course materials and foci vary depending on the needs and interests of students in the class.   
ACCELERATED HINDI I,SARS-216,/coursehistories/1014,This is a fast paced course for learners who have some degree of listening and speaking skills in Hindi| but have minimal or no literacy skills. In the Fall semester students acquire basic reading and writing skills and advance their speaking and listening skills to be able to communicate on everyday personal and social topics in Hindi. Grammatical accuracy and sociocultural appropriateness are emphasized throughout the course. In the Spring semester| students continue to advance all the linguistic skills (speaking| listening| reading and writing) and functions (narration| description| supporting opinion) with a special focus on reading and writing. Students develop formal vocabulary through authentic oral and written input rich in content and culture.   
MODERN SHORT STORIES,SARS-220,/coursehistories/1015,
BEGINNING TAMIL,SARS-230,/coursehistories/1016,This course introduces students to colloquial Tamil and formal written Tamil. A balance between production skills| viz. writing and speaking| and comprehension skills| viz. reading and listening| will be maintained throughoutthe course. Reading materials will introduce students to customs and habits of the Tamil speakers in Tamil Nadu| Sri Lanka| Malaysia| and Singapore. Lessons in the class will be based on a set of Tamil learning software made available at the MMETS Server. This software will be customized to the needs of students.   
INTERMEDIATE TAMIL,SARS-232,/coursehistories/1017,This course develops the skills obtained either from the Beginning Tamil course or from students' prior exposure to Tamil. The emphasis will be on using the language in actual environments both in spoken medium and in written medium. Multimedia materials such as audio and video facilities will be used extensively to provide students an exposure to the Tamil culture and customs. Besides improving their speech and writing| students will also be introduced gradually to Tamil literature| which has two thousand years of literary history. The learning process in this course will be facilitated by appropriate software equipped with multimedia facilities.   
BEGINNING BENGALI,SARS-240,/coursehistories/1018,This course introduces students to colloquial Bengali. It gives equal emphasis to each of the four skills| reading| writing| listening| and speaking. Language will be studied in the context of socio-cultural aspects of West Bengal and Bangladesh. Besides lessons from the text| a major portion of the syllabus will be based on topics drawn from films| cultural events| festivals| food| and religion.   
INTERMEDIATE BENGALI,SARS-242,/coursehistories/1019,This course develops the students' prior knowledge of Bengali. An attempt is made to gear the syllabus to meet the specific needs of students. The focus of the course is to develop the oral and aural skills of the learner as well as improve writing skills and reading strategies. Emphasis is also laid on increasing the sociolinguistic and strategic competence of the learners so that they will be able to function in the target culture. Besides discussions on various aspects of Bengali life| students read some short literary texts in the original Bengali version.   
BEGINNING GUJARATI,SARS-250,/coursehistories/1020,During the first year of Gujarati| major emphasis is placed on acquiring phonetics| grammatical patterns| and basic vocabulary. These goals are accomplished through guided drills and conversations accompanied by formal instruction on Gujarati grammar. From the outset| students are also taught the Gujarati writing system| which is used for all materials. By the end of the first year of instruction| student should be able to carry on coherent conversations on selected topics| read simple texts and compose short pieces in Gujarati.   
INTERMEDIATE GUJARATI,SARS-252,/coursehistories/1021,During the second year of Gujarati| students are introduced to progressively more difficult reading selections| along with additional instructions in the formal grammar of the language. To maintain and develop oral and aural command of the language| readings are discussed in Gujarati. To develop their writing abilities| students are also expected to compose short essays on their readings.   
BEGINNING MALAYALAM,SARS-270,/coursehistories/1022,This course is designed to develop skills in reading| writing| and speaking. It will focus on the alphabet| basic vocabulary| nouns (cases| gender and number)| verbs and their basic tenses| numerals| rules of joining words| adjectives| adverbs| and sentence structure. Guided conversation will be a part of every class. Students will receive considerable training in speaking and writing their own sentences and paragraphs.   
INTERMEDIATE MALAYALAM,SARS-272,/coursehistories/1023,This course is designed to further the language skills learned in Elementary Malayalam. Direct and indirect speech| passive voice| postpositions| and rules of joining words| will be included. Reading and discussion of texts from current Malayalam literature (essays| narration| short stories| and poems) will be a major portion of the course.   
BEGINNING PANJABI,SARS-280,/coursehistories/1024,This course emphasizes speaking and reading skills in Punjabi. Upon completion of this course| students should be able to interact meaningfully and in a socially acceptable manner in a variety of simple situations involving everyday conversational topics. Further| students should be able to read and understand the main idea and most details of simple connected texts. This course will utilize authentic printed| audio| and video materials and will provide opportunities for natural communication both within and outside the the classroom.   
INTERMEDIATE PANJABI,SARS-282,/coursehistories/1025,This course is designed as a continuation of Beginning Punjabi| but can also be taken by anyone who can demonstrate a similar level in proficiency of the language. The course objectives are to expand the mastery of sentence patterns and augment vocabulary and its usage through intensive grammar review and comprehension exercises. A special emphasis will also be placed on greater cultural awareness. Upon completion of this course students should be able to interact socially with added confidence and greater expressiveness. Students should also experience a great improvement in their comprehension of the spoken and written language.   
INTENSIVE BEGIN PASHTU,SARS-291,/coursehistories/1026,
HEALTH&SOCIETY IN S.ASIA,SARS-305,/coursehistories/1027,The countries of South Asia have large and diverse populations in need of public| preventative| and curative health services relavant to the health and disease problems of the region. This course will consider the historic origins of health services in South Asia| beginning with a focus on health needs and health services' development in the 19th century through the mid-20th century. In a context influenced by politics| economics| and socio-cultural factors| biomedical health services and education emerged as the dominant health system. Yet this system remains tied to foreign health models and contends with the socio-cultural competition of traditional medical systems. Through lectures| discussion| and assignments| this course will explore the historic and contemporary complexity of the health care systems in South Asian countires as they attempt to deliver health care to populations with wide disparities in income| education| health problems and needs. Selected comparative experiences of Asian health care systems| such as Chinese| will be discussed.   
ECONOMIC HIST OF S ASIA,SARS-402,/coursehistories/1028,Economic history of India 1500-1947. A survey of the economic interactions of the Indian subcontinent and Europe from 1500 to 1800| and an analysis of the effects of subsequent British rule prior to independence.   
AFGHAN PAK MOD SA HIST,SARS-415,/coursehistories/1029,An overview of the shared and conflicting legacy of history between the two countries; their role in shaping the contours of global politics in that region. Social| ethnic| religious| and sectarian discourses with power politics| the rise of religious militancy| Taliban| their predecessors and potential successors will also be discussed.   
KARMA&REBIRTH IND THGT,AMES-105,/coursehistories/57,A comprehensive exploration of the Indian conceptions of Karma and rebirth and their roles and application in Indian history| culture| and religion.   
ELEM SANSKRIT,AMES-402,/coursehistories/83,An introduction to the grammar of Sanskrit with emphasis on developing skills in reading Sanskrit texts.   
2ND YR SANSKRIT,AMES-403,/coursehistories/84,Fall: reading of classical Sanskrit. Spring: introduction to Vedic literature.   
DEVELOP DEBATE IN S.ASIA,ANTH-323,/coursehistories/136,The course examines various meanings of "development" in Modern South Asia (mostly India). It will be guided by three questions: i) what is development? ii) what are the "pros" and "cons" of development? iii) what are the mechanisms of development (i.e.| who is empowered to "enact" it)? We will consider the complex and changing interrelationships between "development|" on the one hand| and "civilization|" "nation|" "(post)colonialism|" "modernization" and "globalization" on the other. An emphasis will be placed on Anthropological and theoretical approaches to these issues. Preparation for and participation in class is essential. The writing requirements will include an original research paper.   
ECONS OF INDIA & CHINA,ECON-023,/coursehistories/335,This course examines the pre-reform economies of China| India| and to a lesser extent Bangladesh| Pakistan and Taiwan| from 1947 until various efforts of economic restructuring were undertaken. The pre-reform period takes about 1/3 of the course| the demographic-education-health and agricultural structures another 1/3 of the course| and the financial| industrial and international reforms take up the remainder of the course.   
INDIA BEFORE MODERNITY,HIST-085,/coursehistories/575,What makes India INDIA? Religion and Philosophy? Architechural splendor? Kingdoms? Caste? The position of women? This course will introduce students to India by studying a range of social and cultural institutions that have historically assumed to be definitive India. Through primary texts| novels and historical sociological analysis| we will ask how these institutions have been reproduced and transformed| and assess their significance for contemporary Indian society.   
DEVOTION LIT/N INDIA,RELS-552,/coursehistories/991,Readings of medieval devotional texts in the North Indian languages| such as the Ramcaritmanas of Tulsidas| Sufi narratives| medieval poetry in Hindi| Urdu| Dakkini| Bengali| etc.   
INDIA IN TRAVELER'S EYE,SARS-010,/coursehistories/1487,Introduction to economic analysis and its application. An examination of a market economy to provide an understanding of how the size and composition of national output are determined. Elements of monetary and fiscal policy| international trade| economic development| and comparative economic systems.   
INDIAN LIT & THE WEST,SARS-203,/coursehistories/1488,Theories of consumer behavior| demand| production| costs| the firm in various market contexts| factor employment| factor incomes| elementary general equilibrium| and welfare. Insofar as possible| theoretical economic concepts are given operational content| but the main emphasis is on the tools of economic thinking. It will be presumed that the student is familiar with the basic aspects of such mathematical concepts as sets| functions| and derivatives.   
MEDIA & RELIGION IN S.A.,SARS-208,/coursehistories/1489,Theories of aggregate demand and supply| including the determination of national income and product| employment and prices| and the fundamentals of monetary theory and policy. Insofar as possible| theoretical economic concepts are given operational content| but the main emphasis is on the tools of economic thinking. It will be presumed that the student is familiar with the basic aspects of such mathematical concepts as sets| functions| and derivatives.   
The Partition: Literature & Historiography,SARS-217,/coursehistories/1490,The course begins with a survey of basic descriptive statistics and data sources and then covers elementary probability theory| sampling| estimation| hypothesis testing| correlation| and regression. The course focuses not on mathematical proofs of theorems| but rather on practical issues involved in the substantive interpretation of economic data using the techniques of statistical inference. For this reason| empirical case studies that apply the techniques to real-life data are stressed and discussed throughout the course| and students are required to perform several statistical analyses of their own. May not be taken for credit by students who have taken either one or two semesters of Statistics or by any student who has already completed statistics at least at the level of Stat 101 (including the sequence Stat 111/112). (Students with a one semester AP Statistics credit for Stat 101 or higher can drop the credit to take Econ 5 via a release form available from the department). Students who have one semester of statistics take the second course in statistics or Econ 6 (or Econ 5| if Stat 111 was taken) to satisfy the statistics requirement of the major.   
BEGINNING URDU,SARS-221,/coursehistories/1491,This course is designed to introduce students to econometric techniques and their applications in economic analysis and decision making. The main objective of the course is to train the student in (i) handling economic data; (ii) quantitative analyses of economic models with probabilistic tools; (iii) econometric techniques| their application as well as their statistical and practical interpretation; (iv) implementing these techniques on a computer.   The course focuses on practical and conceptual issues involved in the substantive applications of econometric techniques. Estimation and inference procedures are formally analyzed for simple econometric models and illustrated by empirical case studies using real-life data. The course covers linear regression models| simultaneous-equations models| discrete choice models and univariate time series models. Estimation and Inference is conducted using least squares and likelihood based techniques. Students are required to perform several econometric analyses of their own.   
INTERMEDIATE URDU,SARS-222,/coursehistories/1492,A study of the government sectors' taxation and spending activities| focusing on their impact upon resource allocation| income distribution| and efficiency in the economy.   
ADVANCED TAMIL,SARS-234,/coursehistories/1493,The course begins with an extensive discussion of models of labor market demand and supply. The rest of the course addresses a variety of related topics including the schoool-to-work transition| job training| employee benefits| the role of labor unions| discrimination| workforce diversity| poverty| and public policy.   
READINGS IN GUJARATI,SARS-255,/coursehistories/1494,Theories of various industrial organizational structures and problems are developed| including monopoly| oligopoly| moral hazard and adverse selection. These theories are then applied to the study of various industries| antitrust cases| and regulatory issues.   
BEGINNING KANNADA,SARS-260,/coursehistories/1495,Systematic and critical review of the present economic literature on the health care "industry". Topics include the demography and determinants of illness| the demand for curative and preventive care and determinants of recent health cost inflation| the efficacy of markets| and the role of government.   
BEGINNING PASHTU,SARS-290,/coursehistories/1496,Introduction to the theory of international trade and international monetary economics. The theoretical background is used as a basis for discussion of policy issues. Patterns of international trade and production; gains from trade; tariffs| and impediments to trade; foreign exchange markets| balance of payments| capital flows| financial crises| coordination of monetary and fiscal policy in a global economy.   
INTERMEDIATE PASHTU,SARS-292,/coursehistories/1497,International monetary economics with emphasis on economic policy in an open economy. Topics covered in the course include: balance-of-payments adjustment| theories of exchange rate determination| the effects of exchange rate devaluation| macroeconomic policy under fixed and floating exchange rates| the Euro-dollar market| currency and balance of payments crises.   
TOPICS IN DRAVIDIAN LING,SARS-319,/coursehistories/1498,The course will cover the development and operation of the Soviet centrally planned economy--one of the grandest social experiments of the 20th century. We will review the mechanisms of plan creation| the push for the collectivization and further development of Soviet agriculture| the role of the Soviet educational system and the performance of labor markets (including forced labor camps--GULags). We will discuss the strengths and weaknesses of the Soviet system and the causes of its collapse. Privatization| called by some "piratization|" will be one of the central issues in our consideration of the transition from central planning to a market economy in the early 1990s. Even though our main focus will be on the Soviet economy and post-Soviet transition| we will occasionally look back in time to the tsarist era and even further back to find evidence to help explain Soviet/Russian economic development.   
INTRO TO TANTRA,SARS-401,/coursehistories/1499,Labor supply and labor demand| income distribution| labor market contracts and work incentives| human capital| labor market discrimination| job training and unemployment.   
HLTH CARE PLAN & POLICY,SARS-410,/coursehistories/1500,Theories of various industrial organizational structures and problems are developed| including monopoly| oligopoly| nonlinear pricing and price discrimination. These theories are used to model various industries| antitrust cases| and regulatory issues.   
CTMP ISSUES IN S.A. HLTH,SARS-411,/coursehistories/1501,This course will use basic microeconomic tools to understand how the law often| but not always| promotes economic efficiency. Among the areas to be discussed will be tort law| property law| intellectual property| antitrust regulation. The distinction between common law and legislative law will be drawn.   
