NAME,ALIAS,PATH,DESCRIPTION
ETHNICITY,URBS-270,/coursehistories/2174,The course examines a series of 19C and 20C novels (and a few short stories) about adultery| film adaptations of several of these novels| and several original adultery films in their own right. Our reading will teach us about novelistic traditions of the period in question| about the relationship of Russian literature to the European models to which it responded| as well as about adaptation and the implications of filmic vs. literary representation.   Course readings may include: Laclos' Dangerous Liaisons| Flaubert's Madame Bovary| Tolstoy's Anna Karenina| Milan Kundera's The Unbearable Lightness of Being| and other works. Films may include: Frears' Dangerous Liaisons| Vadim's Dangerous Liaisons| Nichols' The Graduate| Mikhalkov's Dark Eyes| and others. Students will apply various critical approaches in order to place adultery into its aesthetic| social and cultural context| including: sociological descriptions of modernity| Marxist examinations of family as a social and economic institution| Freudian/ Psychoanalytic interpretations of family life and transgressive sexuality| and Feminist work on the construction of gender.   
ARCHITECTURE LOC & CLASS: Philadelphia Architecture 1780-1930,URBS-272,/coursehistories/2175,Representations of war are created for as many reasons as wars are fought: to legitimate armed conflict| to critique brutality| to vilify an enemy| to mobilize popular support| to generate national pride| etc. In this course we will examine a series of representations of war drawn from the literature| film| state propaganda| memoirs| visual art| etc. of Russia| Europe and the United States. We will pursue an investigation of these images of conflict and bloodshed in the larger context of the history of military technology| social life| and communications media over the last two centuries. Students will be expected to write two papers| take part in a group presentation on an assigned topic| and take a final exa. The goal of the course will be to gain knowledge of literary history in social and historical context| and to acquire critical skills for analysis of rhetoric and visual representations.   
SENIOR SEMINAR,URBS-400,/coursehistories/2176,This course explores the ways Fyodor Dostoevsky (1821-1881) portrays the "inner world(s)" of his characters. Dostoevsky's psychological method will be considered against the historical| ideological| and literary contexts of middle to late nineteenth-century Russia. The course consists of three parts External World (the contexts of Dostoevsky)| "Inside" Dostoevsky's World (the author's technique and ideas) and The World of Text (close reading of Crime and Punishment and The Brothers Karamazov). Students will write three essays on various aspects of Dostoevsky's "spiritual realism."   
PHILANTHROPY & THE CITY,URBS-404,/coursehistories/2177,This course draws on the fictional| drama and cinematic representation of the Russian history based on Russian as well as non Russian sources and interpretations. The analysis targets major modes of imagining| such as narrating| showing and reenacting historical events| personae and epochs justified by different| historically mutating ideological postulates and forms of national self-consciousness. Common stereotypes of picturing Russia from "foreign" perspectives draw special attention. The discussion involves the following themes and outstanding figures: the mighty autocrats Ivan the Terrible| Peter the Great| and Catherine the Great; the tragic ruler Boris Godunov; the brazen rebel and royal impostor Pugachov; the notorious Rasputin| his uncanny powers| sex-appeal| and court machinations; Lenin and the October Revolution; images of war; the times of construction and the times of collapse of the Soviet Colossus.   
COM ACTIV & SCHL REFORM,URBS-408,/coursehistories/2178,The writer's lyrics| narrative poems| and drama.   
SPRAWL:DREAM/NIGHTMARE,URBS-413,/coursehistories/2179,This course continues developing students' advanced skills in Russian| and introduces students to major movements and figures of twentieth-century Russian literature and culture. We will read the works of modern Russian writers| and watch and discuss feature films. The course will introduce the first Soviet films and works of the poets of the Silver Age and beginning of the Soviet era as well as the works from later periods up to the Perestroika and Glasnost periods (the late 1980s).   
COMMUNITY ECONOMIC DEVL,URBS-452,/coursehistories/2180,Historically| India has held a prominent yet paradoxical place in the Western imagination - as a land of ancient glories| a land of spiritual profundity| a land of poverty| social injustice and unreason. In this course| we examine these and other images of India as presented in European and American fiction| travel literature| news reportage| and film. We will consider the power and resonance of these images| how they have served Western interests| and how they may have affected Indian self-understanding.   
RACE & THE CITY:  Origins & Prospects of the Black Underclass,URBS-472,/coursehistories/2181,This course is about the history of Indian immigration into different parts of the world. The course will consist of readings| discussions| observations| data collection and analysis. The topics will include cultural preservation and cultural change through generations| especially in North America| the Caribbean| the United Kingdom| and the African continent. The course will encourage organized thinking| observations and analysis of components of culture that immigrant communities are able to preserve in the long run and cultural components that undergo change or get reinterpreted. In this context| we will look at entities such as religion| food| language| and family. The course will include immigrants' success stories| their contributions| thier relationship with others groups in the new society andthe nature and extent of their links with India. The course will also address conflict with other sections of the host society| including discrimination against and victimization of immigrants. Other issues will include new social and cultural concerns of immigrants and the rise of new community organizations such as temples and cultural organizations to address those issues. The course will benefit from the study of other immigrant communities around the world.   
BIG PICTURES: MURAL ART,FNAR-222,/coursehistories/1833,
METROPOLIS:CULTR OF CITY,GRMN-244,/coursehistories/1881,St urm-Liouville problems| orthogonal functions| Fourier series| and partial differential equations including solutions of the wave| heat and Laplace equations| Fourier transforms. Introduction to complex analysis. Use of symbolic manipulation and graphics software.   
URBAN NEIGHBORHOODS,URBS-255,/coursehistories/2434,This clinical course focuses on the continued development of advanced clinical skills in the care of acute and chronically ill children. Emphasis is placed on experiences that integrate the roles of the advanced practice nurse with children who have chronic illnesses with particular emphasis on management| consultation| and research dissemination skills.   
WHO GETS ELECTED AND WHY,URBS-320,/coursehistories/2435,This course expands the emphasis on the acute care nurse practitioner's assessment and management of acutely ill and injured adults. Emphasis is placed on clinical decision making and mulltifaceted treatment options as they relate to the evaluation and management of patients in a variety of acute care settings. Nursing and medical interventions as well as other treatment modalities are explored and tested. Emphasis is placed on research-based practice and the role of the acute care nurse practitioner in conducting| evaluating| and utilizing research. Content will focus on special populations of patients with commonly encountered acute health problems.   
US URBAN POLITICAL HIST,URBS-403,/coursehistories/2436,This course focuses on the role of the Acute Care Nurse Practitioner and the expansion of advanced clinical competencies and clincal decision making abilities. Clinical experiences in acute care settings provide the student with opportunities to explore multiple governmental| social and personal resources available to acutely ill and injured adults. The application of advanced nursing| medical and biopsychosocial knowledge in the management of patients and the collaboration between the nurse practitioner and the patients| family and other health care professionals are emphasized.   
PERSP ON URBAN POVERTY,URBS-420,/coursehistories/2437,The focus of this course is a clinical approach to primary care problems commonly encountered by women in an ambulatory setting. This course provides the women's health care nurse practitioner and midwifery student student with the knowledge and problem solving approach to assist individuals with the most common health problems| including acute episodic illness as well as stable chronic disease. The concepts of health promotion and health maintenance are integrated throughout the curriculum.   
CULTRL VALUES MODRN AMER,ANTH-252,/coursehistories/2214,
Processes of Place-Making: Fostering Public Design,ARTH-290,/coursehistories/2230,Gender is an organizing principle of society| shaping social structures| cultural understandings| processes of interaction| and identities in ways that have profound consequences. It affects every aspect of people's lives| from their intimate relationships to their participation in work| family| government| and other social institutions and their place in the stratification system| Yet gender is such a taken for granted basis for differences among people that it can be hard to see the underlying social structures and cultural forces that reinforce or weaken the social boundaries that define gender. Differences in behavior| power|and experience are often seen as the result of biological imperatives or of individual choice. A sociological view of gender| in contrast| emphasizes how gender is socially constructed and how structural constraints limit choice. This course examines how differences based on gender are created and sustained| with particular attention to how other important bases of personal identity and social inequality--race and class-interact with patterns of gender relations. We will also seek to understand how social change happens and how gender inequality might be reduced.   
DIVERSITY IN HIGHER EDUC,SOCI-041,/coursehistories/1039,Freshman Seminars. Topics vary from semester to semester. Past offerings include Society and History; The 1960's: Preludes and Postludes; Mistakes| Errors| Accidents & Disasters; Urban Analysis with Computers; Race and Public Policy; Perspectives on Inequality| Homelessness and the Urban Crisis.   
INDUSTRIAL METROPOLIS,URBS-103,/coursehistories/2695,Basic principles of protein characterization| enzyme kinetics and mechanism| membrane structure and function| metabolism and biochemistry of energy| and signal transduction. A problem-solving approach will be employed and emphasis will be placed on the application of quantitative methods to biochemical problems. Each of the five major sections of the course will be concluded with group discussions specifically directed at the solution of numerical problems and the interpretation of experimental results. In order to maximize the opportunities for students to think critically| analytically and creatively| most of the material covered in the course will be tested using take-home examinations. Students will have the option of attending sessions in which the recent original literature will be discussed.   
LIBERATION & OWNERSHIP,URBS-540,/coursehistories/2696,Early development of microbiology| pathology| and immunobiology; molecular and cellular bases of immune phenomena including: immunity to pathogens| immune diseases| autoimmunity| and hypersensitivity.   
MESOP: HRTLAND OF CITIES,ANTH-236,/coursehistories/1641,The emphasis of this course is on the usage and practical applications of the large format camera and how it records and interprets architecture and landscapes. The course is directed to photographers| architects| landscape artists and historic preservationists. The skills acquired will give students a practical application to ideas learned in conceptual classes. Topics covered will include: using the camera outdoors; framing; perspective and vantage point; filters and lighting sources. Lectures and presentations on architectural photographers as well as field trips to noted local sites will also be included. $50 Studio fee.   
WRITING SEMINAR IN ASAM: Writing About Asian American Communities,ASAM-009,/coursehistories/2472,Networks constitute an important component of modern technology and society. Networks have traditionally dominated communication technology in form of communication networks| distribution of energy in form of power grid networks| and have more recently emerged as a tool for social connectivity in form of social networks. In this course| we will study mathematical techniques that are key to the design and analysis of different kinds of networks. First| we will investigate techniques for modeling evolution of networks. Specifically| we will consider random graphs (all or none connectivity| size of components| diameters under random connectivity)| small world problem| network formation and the role of topology in the evolution of networks. Next| we will investigate different kinds of stochastic processes that model the flow of information in networks. Specifically| we will develop the theory of markov processes| renewal processes| and basic queueing| diffusion models| epidemics and rumor spreading in networks.   
POPULATION & SOCIETY,SOCI-007,/coursehistories/1037,The course serves as an introduction to the study of population and demography| including issues pertaining to fertility| mortality| migration| and family formation and structure. Within these broad areas we consider the social| economic| and political implications of current trends| including: population explosion| baby bust| the impact of international migration on receiving societies| population aging| racial classification| growing diversity in household composition and family structure| population and environmental degradation| and the link between population and development/poverty.   
Faculty/Student Collaborative Action: Seminar in Urban Univ/Comm Relations,URBS-078,/coursehistories/2931,This course will expose students to the principles that underlie our understanding of how the Earth works. The goal of Earth Systems Science is to obtain a scientific understanding of the entire Earth system by describing its component parts (lithosphere| hydrosphere| atmosphere| biosphere) and their interactions| and describe how they have evolved| how they function| and how they may be expected to respond to human activity. The challenge to Earth Systems Science is to develop the capability to predict those changes that will occur in the next decade to century| both naturally and in response to human activity. Energy| both natural and human-generated| will be used as a unifying principle. Knowledge gained through this course will help students make informed decisions in all spheres of human activity: science| policy| economics| etc.   
CITIES DEMOC CITIZENSHIP,URBS-422,/coursehistories/2932,A detailed| comprehensive investigation of selected environmental problems. Guest speakers from the government and industry will give their acccounts of various environmental cases. Students will then present information on a case study of their choosing.   
ECONOMICS & URB AFFAIRS,URBS-456,/coursehistories/2933,Lead poisoning can cause learning disabilities| impaired hearing| behavioral problems| and at very high levels| seizures| coma and even death. Children up to the age of six are especially at risk because of their developing systems; they often ingest lead chips and dust while playing in their home and yards.   In ENVS 404| Penn undergraduates learn about the epidemiology of lead poisoning| the pathways of exposure| and methods for community outreach and education. Penn students collaborate with middle school and high school teachers in West Philadelphia to engage middle school children in exercises that apply environmental research relating to lead poisoning to their homes and neighborhoods.   
URBAN POLITICS IN THE US,PSCI-136,/coursehistories/2384,Homes can be built or renovated to minimize the environmental health risks and the waste of natural resources. The course will consist of lectures| student research projects and community service. The lectures will cover a range of topics including environmental health risks| healthy home environments| conservation| recycling| green construction| urban housing| and geology of West Philadelphia. For their community service| the Penn students will work with the Habitat for Humanity on their local projects building and renovating houses.   
ADVANCED TOPICS IN SOC: WEBER,SOCI-430,/coursehistories/1059,Upper level advance topics vary from semester to semester.   
FIELD METH. SOCIAL RES,SOCI-553,/coursehistories/2928,This is the first course of a two semester sequence| but each course is self contained. Over the two semesters topics are drawn from various branches of applied mathematics that are relevant to engineering and applied science. These include: Linear Algebra and Vector Spaces| Hilbert spaces| Higher-Dimensional Calculus| Vector Analysis| Differential Geometry| Tensor Analysis| Optimization and Variational Calculus| Ordinary and Partial Differential Equations| Initial-Value and Boundary-Value Problems| Green's Functions| Special Functions| Fourier Analysis| Integral Transforms and Numerical Analysis. The fall course emphasizes the study of Hilbert spaces| ordinary and partial differential equations| the initial-value| boundary-value problem| and related topics.   
URBAN SOCIOLOGY,SOCI-567,/coursehistories/1064,This course will examine the urban structures and processes which characterize the social and cultural milieu of the contemporary American city. Specific course topics will include the social organization of local urban subcultures and neighborhood communities| the cultural consequences of gentrification and racial segregation| the reputation of cities in the public imagination| and the commodification of the urban landscape.   
POST INDUSTRIAL CITY: Urban Ideologies in the Media Age,URBS-429,/coursehistories/3256,This course explores the domain of retailing; marketing to the final consumer. Emphasis is placed on marketing aspects of retailing not covered in other courses: retail strategy| merchandising| vendor relations and location.   
Neighborhood Displacement & Community Power,URBS-448,/coursehistories/3257,The effect of the Internet and related technologies on business and social institutions is more profound than that of any prior invention| including the printing press and the internal combustion engine. Furthermore| marketing plays a key role in shaping the modern consumption-led economies fueled by these technologies. MKTG 227 provides a research-based and framework-driven approach to understanding digital marketing and electronic commerce.   The course is organized around three sections and utilizes relevant theory| empirical analysis| and practical examples to develop the key learning points. Guests from the entrepreneur and investor communities participate| as appropriate. Part I presents the behavioral foundations for understanding electronic commerce| and covers the relevant phenomena and theory from economics| marketing| and related fields. Part II examines ecommerce business models and institutions including Internet retail| subscription commerce| curated commerce| and so on. Part III focuses on how digital marketing fosters ecommerce business growth. In particular| we survey| critique| and evaluate common digital marketing methods and tactics.   
THE CITY AND COLONIALISM,ARTH-202,/coursehistories/2980,This is a critical writing seminar. It fulfills the writing requirement for all undergraduates. As a discipline-based writing seminar| the course introduces students to a topic within its discipline but throughout emphasizes the development of critical thinking| analytical| and writing skills. For current listings and descriptions| visit the Critical Writing Program's website at www.writing.upenn.edu/critical.   
ADV NON-FIC WRITING,ENGL-145,/coursehistories/404,Writing with a view to publication in the freelance sections of newspapers such as THE PHILADELPHIA INQUIRER and THE NEW YORK TIMES| in magazines such as THE ATLANTIC and THE NEW YORKER| and in the literary quarterlies and the journals of opinion. Among the areas likely to be considered are writing as a public act| issues of taste and of privacy| questions of ethics and of policy| methods of research and of checking| excerpting| marketing| and the realistic understanding of assignments and of the publishing world. Student papers will be the basis of weekly editorial sessions| with concentration on the language: how to render material literate| how to recognize and dispose of padding and self-indulgence| how to tighten structure and amplify substance.   See the English Department's website at www.english.upenn.edu for a description of the current offerings.   
METROP GROWTH & POVERTY: Metropolitan Growth & Poverty,SOCI-453,/coursehistories/3246,This course includes not only conflict resolution but techniques which help manage and even encourage the valuable aspects of conflict. The central issues of this course deal with understanding the behavior of individuals| groups| and organizations in conflict management situations. The purpose of this course is to understand the theory and processes of negotiations as it is practiced ina variety of settings. The course is designed to be relevant to the broad specturm of problems that are faced by the manager and professional including management of multinationals| ethical issues| and alternative dispute resolutions. Cross listed w/ LGST 206 & OPIM 291.   
FRANKLIN COMMUNITY SEM,URBS-305,/coursehistories/3518,Gender is an organizing principle of society| shaping social structures| cultural understandings| processes of interaction| and identities in ways that have profound consequences. It affects every aspect of people's lives| from their intimate relationships to their participation in work| family| government| and other social institutions and their place in the stratification system| Yet gender is such a taken for granted basis for differences among people that it can be hard to see the underlying social structures and cultural forces that reinforce or weaken the social boundaries that define gender. Differences in behavior| power|and experience are often seen as the result of biological imperatives or of individual choice. A sociological view of gender| in contrast| emphasizes how gender is socially constructed and how structural constraints limit choice. This course examines how differences based on gender are created and sustained| with particular attention to how other important bases of personal identity and social inequality--race and class-interact with patterns of gender relations. We will also seek to understand how social change happens and how gender inequality might be reduced.   
Comprehensive School Reform as Applied Public Policy,URBS-460,/coursehistories/3519,This course will cover the founding classics of the sociological tradition including works of Tocqueville| Marx and Engels| Weber| Durkheim| Mauss| Simmel|and G.H.Mead. We will also examine how the major traditions have continued and transformed into theories of conflict| domination| resistance and social change; social solidarity| ritual and symbolism; symbolic interactionist and phenomenological theory of discourse| self and mind.   
PUBLIC INTEREST WORKSHOP,ANTH-516,/coursehistories/3278,From the mid-eighteenth to the mid-nineteenth centuries.   
URBN NARR COLONIAL KOREA,EALC-189,/coursehistories/3343,This course provides a broad-based introduction to the management of information technology focusing on three interrelated themes: technology| organization| and strategy. The goal of this course is to equip students with the knowledge and tools to utilize information systems to pursue a firm's strategic and organizational goals. The course has no prerequisites other than a general interest in the applications of information technology.   
ANCIENT CIVS OF THE WRLD,NELC-182,/coursehistories/3465,This course develops elementary skills in reading| speaking| understanding and writing the Russian language. We will work with an exciting range of authentic written materials| the Internet| videos and recordings relating to the dynamic scene of Russia today. At the end of the course students will be comfortable with the Russian alphabet and will be able to read simplified literary| commercial| and other types of texts (signs| menus| short news articles| short stories) and participate in elementary conversations about daily life (who you are| what you do every day| where you are from| likes and dislikes).   
CULTURE ARTS AND MEDIA: Culture Arts and Media in Urban Context,SOCI-336,/coursehistories/3507,This introduction to the sociology of the family explores historical| economic| and cultural changes that have shaped the past and present form of the American kinship system. It will also compare demographic and social trends and consequences of the family patterns across societies| providing perspective on differences and similarities between the U.S. family system and other nations. Students will have an opportunity to engage in research on topics of special interest.   
