NAME,ALIAS,PATH,DESCRIPTION
WESTERN DRAMA,THAR-110,/coursehistories/1117,This course will explore the forms of public performance| most specifically theatre| as they emerge from and give dramatic shape to the dynamic life of communal| civic and social bodies| from their anthropological origins in ritual and religious ceremonies| to the rise of great urban centers| to the closing of the theaters in London in 1642. This course will focus on the development of theatre practice in both Western and non-Western cultures as it intersects with the history of cities| the rise of market economies| and the emerging forces of national identity. In addition to examining the history of performance practices| theatre architecture| scenic conventions| and acting methods| this course will investigate| where appropriate| social and political history| the arts| civic ceremonies and the dramaturgic structures of urban living.   
INTRO CITY PLAN,URBS-203,/coursehistories/3583,This course investigates methods of economic analysis for decision making among alternative courses of action in engineering applications. Topics include: cost-driven design econimics| break-even anlaysis| money-time relationships| rates of return| cost estimation| depreciation and taxes| foreign exchange rates| life cylce analysis| benefit-cost rations| risk analysis| capital financing and allocation| and financial statement analysis. Case studies apply these topics to actual engineering problems.   
PENN-WEST PHILA SUMM INT,URBS-208,/coursehistories/3584,This course introduces students to the basic processes for system design and engineering and examines the management of systems engineering projects. We first discuss the systems viewpoint and the systems engineering process. Next we examine issues relating to requirements specification and problem formulation. We highlight different methods for systems modeling and forecasting and for choosing among different system alternatives. The course also provides specific examples of systems engineering taken from the fields of telecommunications| manufacturing| environment/resource systems| and transportation.   
Building Non-Profits from the Ground Up,URBS-412,/coursehistories/3585,The course aims to equip students with skills in the appraisal of large infrastructure projects| project scheduling| PERT/CPM analysis| project management| project implementation| project financing| contracts and negotiations.   
CITIES AND INTELLECTUALS,URBS-507,/coursehistories/3586,Reliability engineering as an integral part of component and system design in electronics and computer systems| electrical power systems and mechanical systems. Reliability mathematics| and fundamental concepts in reliability engineering including reliability networks| reliability evaluation techniques| failure mode and effects analysis (FMEA)| and reliability apportionment. System modeling techniques such as Fault Trees and Markov chains. Concepts of common cause failures and human reliability. Methods of analyzing and incorporating uncertainty in reliability data to the reliability models.   
TOWN OR COUNTRY: Going to Hell: Exploring the Infernal in Western Literature,ENGL-429,/coursehistories/3373,An introduction to the physical theories of the mechanical universe. The courses focuses on the development and principles of Newtonian mechanics| relativity and the relativistic mechanics of Einstein| and the quantum mechanics needed to describe atomic and nuclear phenomena. This course cannot be taken for credit by a student also receiving credit for PHYS 008| 009| or any physics course numbered 100 or greater.   
URBAN FOLKLORE,FOLK-436,/coursehistories/1308,Method and theory in biocultural anthropology applied to current issues in human health| including nutrition| growth| and reproduction. Emphasis on structure and analysis of data.   
URBAN CRISIS: American Cities Since World War II,URBS-104,/coursehistories/3690,This course will survey the major political| economic| social and intellectual trends in Japan from the earliest epoch through the 16th century. Interfaces with History 91| Modern Japanese History| in the spring semester.   
EXPLRNG LOCAL MEM & TRAD,FOLK-321,/coursehistories/3643,
CITIES & INTELLECTUALS,URBS-506,/coursehistories/3709,
RE-IMAGINING PHILA: Environmental Design Workshop,URBS-360,/coursehistories/3787,This course surveys Greek art and artifacts from Sicily to the Black Sea from the 10th BCE up to the 2nd centuries BCE reaching the Age of Alexander and the Hellenistic Kingdoms. Our objects range from public sculpture and painting on and around grand buildings and gardens| to domestic luxury arts like jewelry| cups and vases| mosaic floors| and the humbler objects of worship and every-day life. Greek addressed heroic epic| religous and political themes| engaged viewers' emotions| and served mundane as well as monumental aims. Current themes include Greek ways of looking at art and space| and ideas of invention and progress; the roll of monuments| makers and patrons in Greek society; and connections with the other cultures that inspired and made use of Greek artists and styles. To understand ancient viewers' encounters| you will meet the spaces of sanctuary and tomb| house and city| garden and private collection; your readings will sample ancient peoples' art writing. Diverse approaches introduce art historical aims and methods| and their relationships to archaeology| anthropology and other disciplines -- also to modern kinds of museums| not least our own University Museum of Archaeology.   No prerequisites. This course fulfills the 'global requirement'. Of interest to students of classical| middle-eastern| visual and religious studies| anthropology| history| communications and the GSD programs.   
LIBERATION & OWNERSHIP,URBS-480,/coursehistories/3788,Survey of the art of Ancient Egypt from the Predynastic Period through the New Kingdom. Emphasis on major monuments of architecture| sculpture| relief and painting; questions stylistic change and historical context.   
FAC/STUD COLLAB LEARNING: Action-Oriented Policies: Hist of Blk Educ in Phila Franklin to Present,BENF-210,/coursehistories/3719,Introduction to the grammar of Middle Egyptian.   
THE PHOTOGRAPHY OF URBAN PLACE,FNAR-226,/coursehistories/3740,Offered to students with advanced knowledge of Japanese; the course will focus on business-related topics.   
MAJ SEM WORLD AFT 1800: CHINESE WOMEN'S HIST,HIST-206,/coursehistories/595,
AMER POLITICS & SOCIETY,HIST-361,/coursehistories/3752,This course examines the United States conquest of the region from the Mississippi River to the Pacific coast| a physically varied and resource rich area incorporating the Great Plains| Rocky Mountains| Great Basin| Southwest| Pacific Northwest and California. Each of these sub-regions encompasses a complex of groups| institutions and cultural systems| which have changed over time as a function of war and conquest| immigration and migration| culture contact| innovation and revitalization. This has led to a western culture of expansion| individualism and corporate capitalism that continues to permeate contemporary America. Our task is to describe and explain these developments and values using film| documentary evidence| and material culture.   
POL OF POVERTY & DEVELOP,PSCI-139,/coursehistories/3778,Introduces technical drawing and explores its thematic possibilities| through both an analysis of antecedents and the production of new works. These complimentary studies serve both to establish an understanding of representation as the foundation to visual communications and to develop the ability for seeing through drawing.   
RELIGION/SECULAR VALUES: THE AMERICAN JESUS,RELS-111,/coursehistories/3499,
METROPOLITAN NATURE,URBS-290,/coursehistories/3987,Theories of various industrial organizational structures and problems are developed| including monopoly| oligopoly| nonlinear pricing and price discrimination. These theories are used to model various industries| antitrust cases| and regulatory issues.   
Memory and Urbanism in the Americas,URBS-414,/coursehistories/3988,Introduction to theory of international trade and international monetary economics. The theoretical background is used as a basis for discussion of policy issues| patterns of international trade and production| gains from trade| tariffs| and other impediments to trade| foreign exchange markets| measures of balance of payments| effects of monetary and fiscal policy| and devaluation and systems for the settlement of international payments.   
TEACHING AMER STUDIES,ENGL-401,/coursehistories/3874,An overview of several important aspects of modern biotechnology from a chemical engineering perspective: DNA| enzymes and other biomolecules| cell growth and metabolism| cellular and enzymatic reactors| bioseparation techniques| molecular genetics| and biotransport processes.   
REFORMING CITY GOVT: Effecting Change in Phila: Reforming City Government,GAFL-472,/coursehistories/3882,Introductory quantum mechanics| atomic and molecular structure| chemical bonding| and microscopic understanding of physical and chemical properties of molecules.   
ORIGIN & CULTR OF CITIES,NELC-103,/coursehistories/3914,Roman magistrates| emperors| jurists| and lawyers developed many of the fundamental legal principles that have remained at the basis of our modern legal systems. This course will introduce the students to the principal sources of the Roman law| to the nature of legal actions and trial procedures (for both civil litigation and criminal prosecution)| and also to the main institutions of the legal system. there will be strong emphasis on the basic principles and norms of the Roman law itself. The main areas of the civil law that will be dealt with in detail will include the law of persons| succession| obligations (including contracts and damage)| delicts and 'crimes'. The application of the law in social contexts will be studied by the consideration of historically documented cases such as a murder trial| a dispute over a sale| and divorce proceedings. The analysis of model cases will also be an important part of each student's involvement in the class.   
BROWNFIELD REMEDIATION,ENVS-463,/coursehistories/4037,The idea of 'race' broadly defined as the signification of biological and sociocultural differences as an index of human superiority or inferiority has played a crucial role in the literary imagination and is fundamental to studying most literatures in English   This course will examine representations of race in literary practices and in particular the centrality of such representations to the historical unfolding of communities and nations.   See the English Department's website at www.english.upenn.edu for a description of the current offerings.   
IRAQ:ANC CITIES& EMPIRES,NELC-241,/coursehistories/4089,
THE CITY IN SOUTH ASIA,SAST-002,/coursehistories/4117,FNAR 265 is an introduction to digital imaging and creative problem solving through projects that involve drawing| design and desktop publishing. Graphics software programs used include Adobe PhotoShop and Illustrator| Fractal Painter and QuarkXPress. As well as creation directly on the computer| students will be able to capture and manipulate images through scanners and digital cameras. Output methods| both traditional and alternative| are also explored in this course.   
RENAISSANCE TO REALISM,THAR-111,/coursehistories/4141,Analyzes financial problems corporations face that result from operating in an international environment. Major topics covered are corporate strategy and the decision to invest abroad| forecasting exchange rates| international portfolio diversification| managing exchange risk| taxation issues| cost of capital and financial structure in the multinational firm| and sources of financing.   
Faculty/Student Collaborative Action: Seminar in Urban Univ/Comm Relations,URBS-178,/coursehistories/4434,Elastic and plastic behavior of materials. Stress| strain| anisotropic Hook's law| equations of elasticity; solution of selected stress distribution problems plane elasticity. Yield criteria. Fracture criteria. Microscopic mechanisms of plasticity and fracture| dislocation theory.   
Media City: New Lifestyles/New Forms,URBS-259,/coursehistories/4435,Failures of classical physics and the historical basis for quantum theory. Postulates of wave mechanics; uncertainty principle| wave packets and wave-particle duality. Schrodinger equation and operators; eigenvalue problems in 1 and 3 dimensions (barriers| wells| hydrogen| atom). Perturbation theory; scattering of particles and light. Free electron theory of metals; Drude and Sommerfeld models| dispersion relations and optical properties of solids. Extensive use of computer-aided self-study will be made.   
URBAN STUDIES HONORS,URBS-401,/coursehistories/4436,The objective of this course is to study the fundamental physics of the interaction of ions| electrons| photons| and neutrons with matter. A second objective is to use the products of these interactions to characterize the atomic (or molecular) structure| composition| and defects of a semiconductor| ceramic| polymer| composite| or metal. Ion beam techniques will include Rutherford backscattering and forward recoil spectrometry| and secondary ion mass spectrometry. Electron probe techniques will include x-ray photoelectron spectroscopy. Neutron techniques will include neutron reflectivity. The strengths and weaknesses of each technique will be discussed. Examples will be drawn from metallurgy| electronic materials| polymer science| ceramic science| archaeology| and biology.   
URBAN REAL ESTATE MRKTS,URBS-415,/coursehistories/4437,Instruction chamber music performance for music majors and minors only. Students must demonstrate in an audition that they have already attained an intermediate level of musical performance.   
HOMELSSNSS & URB INEQUAL,URBS-010,/coursehistories/4688,This course introduces students to colloquial Bengali. It gives equal emphasis to each of the four skills| reading| writing| listening| and speaking. Language will be studied in the context of socio-cultural aspects of West Bengal and Bangladesh. Besides lessons from the text| a major portion of the syllabus will be based on topics drawn from films| cultural events| festivals| food| and religion.   
GIS APPL IN SOC SCIENCE,URBS-330,/coursehistories/4689,This course develops the students' prior knowledge of Bengali. An attempt is made to gear the syllabus to meet the specific needs of students. The focus of the course is to develop the oral and aural skills of the learner as well as improve writing skills and reading strategies. Emphasis is also laid on increasing the sociolinguistic and strategic competence of the learners so that they will be able to function in the target culture. Besides discussions on various aspects of Bengali life| students read some short literary texts in the original Bengali version.   
MULTCULT:PLTCSTHRYPRTC: Multiculturalism: Theory and Practice,ANTH-290,/coursehistories/4510,This course should be taken in the last semester of the Occupational Health Nursing Program. As such| it is meant to provide opportunity for the students to focus upon the occupational health setting| integrate course work and test their roles in occupational health in concert with an experienced colleague. Whenever possible| team assignments will be made for administration/consultation option and primary care options students so they can act in complimentary roles in the residency. Selected seminars are included to focus discussion and learning on health problems and concerns in occupational health.   
PHILADELPHIA 1700-2000,HIST-367,/coursehistories/4586,This course analyzes the formation and conduct of foreign policy in the United State. The course combines three elements: a study of the history of American foreign relations; an analysis of the causes of American foreign policy such sa the international system| public opinion| and the media; and a discussion of the major policy issues in contemporary U.S. foreign policy| including terrorism| civil wars| and economic policy.   
HIST/POLITICS OF PLACE,URBS-012,/coursehistories/4860,An introduction to the grammar of biblical Hebrew with an emphasis on developing language skills in handling Biblical texts.   
Cities Suburbs and Their Regions,URBS-253,/coursehistories/4861,An introduction to the skills of reading| writing| and conversing in modern Hebrew. This course assumes no previous knowledge of Hebrew.   
Berlin: History Politics Culture,GRMN-237,/coursehistories/4813,Topics vary; see department for current course information   
Urban Culture in the Middle East,HIST-205,/coursehistories/594,
CULT ARTS & MEDIA URBAN,SOCI-436,/coursehistories/4849,
URBAN AGRICULTURE,URBS-390,/coursehistories/4874,
CITIES & SUSTAINABILITY,URBS-417,/coursehistories/5058,This course is designed for advanced undergraduates and beginning graduate students with a particular interest in infectious disease biology. Note that this course is not a comprehensive survey of the field and is not appropriate for students seeking a lecture course on disease. The primary objective of this course is to teach students considering a career in the biomedical sciences how to read| discuss| and question research papers effectively. Intensive classroom discussions focus on the experimental methods used| results obtained| interpretation of these results in the context of pathogen interactions with host cells and organisms| and implications for basic research and therapeutic development.   
GLBL CITIES 21ST CNTRY: Global Cities in the 21st Century,URBS-467,/coursehistories/5059,This course will focus on the molecular mechanisms by which fundamental cellular processes are disrupted in the development of cancer.   
LECTURE,HIST-373,/coursehistories/605,This course examines the political| cultural| and intellectual history of America between 1954 and 1974. It considers the civil rights movement| the New Frontier and Great Society| the Supreme Court and right politics| the rise of the New Right| the debate over Vietnam| student radicalism| sexual liberation movements| black power| the counterculture| the urban crisis| and white backlash. The course emphasizes the transformation of liberalism and the revitalization of conservatism| and the tensions between integration and separatism| between libertarianism and communitarianism that shaped the social movements of the sixties.   
HISTORY OF AMER.EDUCATIO,HIST-463,/coursehistories/615,A survey of the history of American education from the Colonial Period to the present. Special emphasis on the relations between education and major themes in social history.   
SUSTAINABILITY IN ACTION,ARCH-255,/coursehistories/5075,Applications of physical chemistry to chemical engineering systems. Equilibrium statistical mechanics of ideal gases| dense fluids and interfacial phases. Chemical reaction rates. Collision and transition state theories. Heterogeneous catalysis. Electronic structure and properties of solids.   
TOPICS IN ASIAN-AM STDS,ASAM-150,/coursehistories/2474,Over the past two decades| the public imagination has been gripped by the concept of globalization. Scholars| corporations| advertisers and government officials have latched onto this idea as a defining feature of our current era.These various constituencies use globalization not only to account for epochal shifts in our economy and society| but also to justify new types of business strategy and public policy. This course will examine three interlinked dimensions of globalization: Global economic processes (e.g. the transnational operations of multinational firms that have given rise to a new international division of labor); cultural globalization (e.g. the spread of American brands like Coca Cola| Nike and Hollywood films)| and political globalization (e.g. the rise of supranational organizations like the IMF| World Bank and WTO that promote the idea of free markets).   Moreover| we will study globalization in the context of cities because| given their centrality to globalization processes| it is in cities that we can best understand how globalization takes place. In cities| we can study the global economic processes that restructure urban space| giving rise to new financial districts| international art exhibits and post-modern architecture and entrepreneurial strategies that seek to elevate cities to world city status. The course will examine these processes in a comparative light| contrasting urban globalization processes in Europe and North America with those in Latin America| Asia and Africa.   
WLRD HIST: E ASIA/LTAM: GENES AND HUMAN HISTORY,HIST-233,/coursehistories/4972,Archaeology of the Modern World from the Columbian voyage (1492) to the 20th century. Topics such as the rise of early modern Europe| European exploration and colonization| African American Archaeology| Asian American Archaeology| the rise of colonial society| contact with native peoples| the Industrial Revolution| and the archaeology of the 20th century will be covered.   
RACE & METRO IN 20TH C: Race and Metropolis in the Long 20th Century,HIST-356,/coursehistories/5126,This course will approach selected classic works of Western culture up to the Middle Ages with two purposes in mind. First| we will try to see how our notions of authority| agency| will and history have been shaped by these texts| in particular by epic and tragedy; further| we will consider how such concepts in turn have been complicated by the author's recognition of the power of desire and shifting definitions of gender and identity. Second| we will look at how we identify a "classic" in our culture| and will try to understand what sort of work it does for us. Texts to be read will include: Homer's ILIAD and ODYSSEY; Euripides' BACCHAE; Sophocles' OEDIPUS THE KING; Aeschylus' PROMETHEUS BOUND; Aristophanes' FROGS; Virgil's AENEID; THE CONFESSIONS OF ST AUGUSTINE| and Dante's DIVINE COMEDY. All works will be read in translation.   
Executive Power in Metropolitan American Politics,URBS-470,/coursehistories/5274,The course focuses on the natural history of different wetland types including climate| geology| and|hydrology factors that influence wetland development Associated soil| vegetation| and wildlife characteristics and key ecological processes will be covered as well. Lectures will be supplemented with weekend wetland types| ranging from tidal salt marshes to non-tidal marshes| swamps| and glacial bogs in order to provide field experience in wetland identification| characterization| and functional assessment. Outside speakers will discuss issues in wetland seed bank ecology| federal regulation| and mitigation. Students will present a short paper on the ecology of a wetland animal and a longer term paper on a selected wetland topic. Readings from the text| assorted journal papers| government technical documents| and book excerpts will provide a broad overview of the multifaceted field of wetland study.   
NUTRITIONAL ANTHROPOLOGY,ANTH-359,/coursehistories/1649,The objective of this course is to study the major decision-making areas of managerial finance and some selected topics in financial theory. The course reviews the theory and empirical evidence related to the investment and financing policies of the firm and attempts to develop decision-making ability in these areas. This course serves as an extension of FNCE 100. Some areas of financial management not covered in FNCE 100 are covered in FNCE 203. These may include leasing| mergers and acquisitions| corporate reorganizations| financial planning and working capital management| and some other selected topics. Other areas that are covered in FNCE 100 are covered more in depth and more rigorously in FNCE 203. These include investment decision making under uncertainty| cost of capital| capital structure| pricing of selected financial instruments and corporate liabilities| and dividend policy.   
IMMIGRANT URBAN LABOR IN THE U.S.,ASAM-201,/coursehistories/4890,A survey of the major themes and ideas of the Bible| with special attention paid to the contributions of archaeology and modern Biblical scholarship| including Biblical criticism and the response to it in Judaism and Christianity.   
ORIGINS OF MUSIC,MUSC-018,/coursehistories/3455,This course is an introduction to Islam as a religion as it exists in societies of the past as well as the present. It explores the many ways in which Muslims have interpreted and put into practice the prophetic message of Muhammad through historical and social analyses of varying theological| philosophical| legal| political| mystical and literary writings| as well as through visual art and music. The aim of the course is to develop a framework for explaining the sources and symbols through which specific experiences and understandings have been signified as Islamic| both by Muslims and by other peoples with whom they have come into contact| with particular emphasis given to issues of gender| religious violence and changes in beliefs and behaviors which have special relevance for contemporary society.   
FILM AND THE CITY,CINE-305,/coursehistories/5307,This is a critical writing seminar. It fulfills the writing requirement for all undergraduates. As a discipline-based writing seminar| the course introduces students to a topic within its discipline but emphasis throughout is upon the development of critical thinking| analytical| and writing skills. For current listings and descriptions| visit the Critical Writing Program's website at www.writing.upenn.edu/critical.   
