NAME,ALIAS,PATH,DESCRIPTION
AFRICANS ABROAD,HIST-489,/coursehistories/617,This seminar will examine the experiences of recent emigrants and refugees from Africa| including many now living in the city of Philadelphia and the surrounding region. In addition to reading some of the historical and comparative literature on migration| ethnic diasporas| and transnationalism| students will have the opportunity to conduct research on specific African communities in Philadelphia or elsewhere in North America| Europe| or the Middle East. African emigres' relations with both their home and host societies will be explored and compared with the experience of other immigrant groups over the past century. Topics include reasons for leaving Africa| patterns of economic and educational adaptation abroad| changes in gender and generational roles| issues of cultural and political identity| and the impact of national immigration policies.   
URBAN ETHNOGRAPHY,URBS-213,/coursehistories/5481,When knowledge leads to power| how is society as a whole affected? Case studies of the role of science in comtemporary decision making in public and business affairs.   
INTERFAITH ACTION,ANTH-483,/coursehistories/5368,This basic course in literature provides an overview of French literature and acquaints students with major literary trends through the study of representative works from each period. Students are expected to take an active part in class discussion in French. French 221 has as its theme the presentation of love and passion in French literature. Majors are required to take either French 221 or 222. They may also take both.   
Urban Ethnography: Documenting City Life,COMM-320,/coursehistories/5402,This course is intensive and is intended for dedicated| highly self-motivated students who will take responsibility for their learning and creation of meaning with their peers.   An intensive two credit course in which two semesters of elementary German (GRMN 101 & 102) are completed in one. Introduction to the basic elements of spoken and written German| with emphasis placed on the acquisition of communication skills. Readings and discussions focus on cultural differences. Expression and comprehension are then expanded through the study of literature and social themes.   
NEIGHBRHD DYN. OF CRIME,CRIM-280,/coursehistories/4930,Course focusses on a few selected topics for close attention. Topic for 1995-96 will be examination of certain current social and ethical questions--for instance those having to do with organ transplantation| abortion| suicide| euthanasia| political corruption| and "openness" as a society. Readings will be on contemporary questions but include some pre-modern materials that influence the discussion.   
EXPLORING CREATIVITY,URBS-421,/coursehistories/5495,Seminar in International Relations. A two semester sequence including review of advanced International Relations theory and research methods for the preparation of the senior thesis.   
Transportation and American Society,URBS-419,/coursehistories/5604,The pricing decision process including economic| marketing| and behavioral phenomena which constitute the environment for pricing decisions and the information and analytic tools useful to the decision maker.   
SOCIAL ENTREPRENEURSHIP,URBS-216,/coursehistories/5748,Experiments in Ethics: This is a graduate research seminar covering interdisciplinary research in psychology| philosophy| cognitive science and behavioral economics. Our focus will be on identifying and discussing issues of philosophical significance raised by recent work in moral psychology| experimental economics and behavioral decision making.   
URBAN ETHNOGRAPHY,URBS-427,/coursehistories/5749,What do we perceive? The world itself| unmediated? Sense data? Momentary particulars? The world via sensory qualia? The seminar will consider these questions| as addressed by early twentieth-century writers (Moore| Russell| James| R.W.Sellars) and by more recent thinkers (Dretske| Crane| Brewer| Noe).   
CITIES INTHE GLOBAL ECON,PSCI-519,/coursehistories/5722,Negotiation is the art and the science of creating good agreements. This course develops managerial negotiation skills by mixing lectures and practice| using cases and exercises in which students negotiate with each other. The cases cover a wide range of problems and settings: one-shot deals between individuals| repeated negotiations| negotiations over several issues| negotiations among several parties (both within and between organizations)| and cross-cultural issues. Performance in the cases accounts for nearly half the course grade. Students must also describe their experience and thoughts in a journal| and write a term paper.   
NEOLIBERALISM & THE CITY,SAST-504,/coursehistories/5734,An introductory philosophical examination of questions regarding the nature of religious experiences and beliefs; arguments for and against the existence of God; the problem of evil; the relationships of faith| reason and science| the possibility of religous knowledge| the role of religious communities| etc. Readings from the history of philosophy| 20th century and contemporary analytic philosophy| and the European phenomenological| existential| and hermeneutic traditions.   
THE NEW AFRICAN DIASPORA: African Immigrant Lives in West Philadelphia,AFST-167,/coursehistories/5852,Topics vary.   
HEART OF SOCIAL CHANGE,URBS-219,/coursehistories/6220,Second semester of a year-long design project.   
SOCIAL SCIENCE STUDIO,URBS-438,/coursehistories/6221,An intensive independent project experience incorporating both technical and non-technical aspects of the student's chosen career path. Chosen topic should incorporate elements from the student's career path electives| and may involve advisors for both technical and non-technical elements. Topics may range from biomedical research to societal| technological and business aspects of Bioengineering. A proposal| regular progress reports and meetings with a faculty advisor| a written thesis| and a presentation are required.   
BANKERS ACTIVISTS & GOVNT: THE MAKING OF URBAN HOUSING POLICY IN AMERICA,URBS-476,/coursehistories/6222,This course explores the transition from discovery of fundamental knowledge to its ultimate application in a clinical device or drug. Emphasis is placed upon factors that influence this transition and upon the integrative requirements across many fields necessary to achieve commercial success. Special emphasis is placed on entrepreneurial strategies| intellectual property| financing and the FDA process of proving safety and efficacy. Current public companies in the medical device and drug industry are studies in detail and critiqued against principles developed in class.   
CIVIC SCHOLARS PROSEMINAR,URBS-015,/coursehistories/6324,Courses in this category will study the representation and transformation of natural and cultural reality by the human imagination in literature| fine art| music and other forms of human expression. The courses will study a selection of works in various literary| artistic and musical media from antiquity to modernity in their aesthetic and historical contexts. Special attention will be given to connections among the different arts within particular cultures as well as to similarities and differences in the forms of representation and expression developed in different societies| cultures and religions. Clashes among aesthetic| political and religious perspectives on the works of human imagination and expression will inevitably be a theme in these courses. These courses will again depend upon participation by faculty from many disciplines.   For particular course descriptions| please see the Pilot Curriculum web site: http://www.college.upenn.edu/pilot curriculum/pccrsdescriptions.html   
THE POLITICS OF HOUSING & URBAN DEVELOPMENT,URBS-451,/coursehistories/6325,The purpose of this course is to present a variety of narrative genres and to discuss and illustrate the modes whereby they can be analyzed. We will be looking at shorter types of narrative: short stories| novellas| and fables| and also some extracts from longer works such as autobiographies. While some works will come from the Anglo-American tradition| a larger number will be selected from European and non-Western cultural traditions and from earlier time-periods. The course will thus offer ample opportunity for the exploration of the translation of cultural values in a comparative perspective.   
TUTORING IN URBAN PUBLIC SCHOOLS: THEORY & PRACTICE,URBS-323,/coursehistories/6474,Numerical modeling using effective algorithms with applications to problems in engineering| science| and mathematics| and is intended for graduate and advanced undergraduate students in these areas. Interpolation and curve fitting| numerical integration| solution of ordinary and partial differential equations by finite difference| and finite element methods. Includes use of representative numerical software packages such as MATLAB PDE Toolbox.   
FANTASTIC CITIES: URBAN LANDSCAPES SEEN THORUGH MEMORY IMAGINATION & DREAMS,ARCH-414,/coursehistories/6346,
ADV TPCS IN THEATRE,THAR-275,/coursehistories/1126,This course will combine an intensive practical and intellectual investigation of some area of the making of theatre: performance techniques| theatrical styles| a particular period of theatre history. For the current topics contact the Theatre Arts office.   One section of 275 every other Spring will consist of a small number of Theatre Arts majors selected by the faculty to become members of "the Edinburgh Project." This ensemble will mount a production that will be performed at the Edinburgh Festival Fringe in August. Many of the readings and exercises in this course will be geared to prepare for production; rehearsals for the project will continue after the exam period at the end of the semester.   
MAPPING PHILADELPHIA,URBS-431,/coursehistories/6567,Focused study of expressive culture in a particular cultural setting. Topics vary each semester and the course may be repeated for credit.   
SUSTAINABILITY AND THE URBAN NEIGHBORHOOD,URBS-439,/coursehistories/6568,The title of the course reflects its dual goals: on the one hand| we wish to explore how folklore and folklore research| especially in Europe| have been connected histortically to a territory language| and national belonging. Toward this end| we will examine various attemps to find in national wisdom evidence of ancient origin| glorious history| and cultural uniqueness. On the other hand| we want to understand the process of establishing a national folklore. We will examine various cultural expressions and/or inventions of the national "us" perspective. Specifically| we will explore the roles of notions such as 'tradition" and authenticiy in elevating elements of an ethnic group's folklore to the favored status of national folklore. In this context| we will consider wha account for the endurance of some nationlistic representations as opposed to others in a world that is constantly changing. We will us the Balken Slavic countries (Bulgaria| Macedonia| Serbia and Montenegro|Croatia| Slovenia| Bosnia and Herzegovina) as case studies| though students will be expected to bring their own ethnic/national background and experience to the class discussions. Reading will be from both conteemporary and historical sources| and will concern both practical problems and theoretical issues.   
INTRO TO ART: Art and Technology: 1830s-2000s,ARTH-100,/coursehistories/152,Topic Varies.   
WOMANISM AND IDENTITY POLITICS IN THE REALM OF HIP-HOP,GSWS-040,/coursehistories/6526,An introduction of modeling the human figure in clay. Students will work from the live model| acquainting themselves with issues of basic anatomy| form and function| and clay modeling. No previous experience is required; drawing experience a plus; attendance and effort are mandatory. $12 lab fee.   
